title,url,date_published,snippet,body,text
"Starting on Sunday, you will not have to test for COVID-19 to fly into the U.S.",https://www.npr.org/2022/06/10/1104138168/covid-19-negative-test-airline-travelers-lift,2022-06-10T15:12:56Z,The Centers for Disease Control and Prevention is lifting its COVID-19 testing requirement for airline travelers coming into the country. It's a major change for the travel industry.,"In this file photo, travelers pass a sign for COVID-19 testing at Logan Airport in Boston. The Biden administration is lifting its requirement for COVID testing before flying to the U.S.
Charles Kru… [+978 chars]",starting on sunday  you won t have to test for covid 19 to fly into the u s  the centers for disease control and prevention is lifting its covid 19 testing requirement for airline travelers coming into the country  it s a major change for the travel industry  in this file photo  travelers pass a sign for covid 19 testing at logan airport in boston  the biden administration is lifting its requirement for covid testing before flying to the u s   charles kru  
"1 in 5 Adult Covid Survivors in the U.S. May Develop Long Covid, Says CDC",https://www.nytimes.com/2022/05/24/health/long-covid-infections.html,2022-05-25T00:23:58Z,"Researchers identified lasting health problems in many different organ systems, including the heart, lungs and kidneys.",People in both groups who had a history of one of the 26 health conditions in the previous year were excluded from the study an attempt by the researchers to consider medical issues that patients dev… [+1976 chars],1 in 5 adult covid survivors in the u s  may develop long covid  says cdc researchers identified lasting health problems in many different organ systems  including the heart  lungs and kidneys  people in both groups who had a history of one of the 26 health conditions in the previous year were excluded from the study an attempt by the researchers to consider medical issues that patients dev  
How Does America Value Life Amid Mass Shootings and Covid Deaths?,https://www.nytimes.com/2022/05/31/us/america-life-uvalde-covid.html,2022-05-31T07:00:13Z,"Relentless mass shootings, a million dead from Covid — How much do we value a single life?","The question that should scare us is, what will it take to make us collectively bring about this change? she said.
Maybe this is our lifes work, she said. Maybe this is our work as humans.
When Tra… [+1054 chars]",how does america value life amid mass shootings and covid deaths  relentless mass shootings  a million dead from covid   how much do we value a single life  the question that should scare us is  what will it take to make us collectively bring about this change  she said   maybe this is our lifes work  she said  maybe this is our work as humans   when tra  
‘Don’t Lose Hope’: Addressing the Breakdown of College Education,https://www.nytimes.com/2022/06/05/opinion/college-education-breakdown.html,2022-06-05T21:15:01Z,Jonathan Malesic responds to readers concerned about the breakdown in college students’ learning since Covid,"When the college returned to normal this year, they overlooked the fact that they have a sophomore class of isolated, anxious, depressed kids. The freshmen got the usual orientation. Sophomores were … [+2744 chars]", don t lose hope   addressing the breakdown of college education jonathan malesic responds to readers concerned about the breakdown in college students  learning since covid when the college returned to normal this year  they overlooked the fact that they have a sophomore class of isolated  anxious  depressed kids  the freshmen got the usual orientation  sophomores were   
The Twisting Trail to the Tonys: ‘Can You Believe That We’re Here?’,https://www.nytimes.com/2022/05/18/theater/broadway-tonys.html,2022-05-18T09:00:41Z,"At times it felt like a game of survival. But during a Broadway season unlike any other, productions showed their resourcefulness while learning how to live with Covid.","Understudies became the seasons heroes: One night at Come From Away, nine of the 12 performers were standbys, including alumni and members of touring companies flown in to help out. At Thoughts of a … [+1364 chars]",the twisting trail to the tonys   can you believe that we re here   at times it felt like a game of survival  but during a broadway season unlike any other  productions showed their resourcefulness while learning how to live with covid  understudies became the seasons heroes  one night at come from away  nine of the 12 performers were standbys  including alumni and members of touring companies flown in to help out  at thoughts of a   
"Relief and Reunions After Shanghai Reopens, but Also Anxieties",https://www.nytimes.com/live/2022/06/01/world/covid-19-mandates-vaccine-cases,2022-06-01T09:21:31Z,"The authorities kept some restrictions, such as requiring residents to show negative Covid test results to use the subway and limiting access to housing compounds.","Despite strong levels of vaccination among older people, Covid killed them at vastly higher rates during this winters Omicron wave than it did last year, preying on long delays since their last shots… [+12143 chars]",relief and reunions after shanghai reopens  but also anxieties the authorities kept some restrictions  such as requiring residents to show negative covid test results to use the subway and limiting access to housing compounds  despite strong levels of vaccination among older people  covid killed them at vastly higher rates during this winters omicron wave than it did last year  preying on long delays since their last shots  
"Census Likely Miscounted the Population of 14 States, a Review Finds",https://www.nytimes.com/2022/05/19/us/2020-census-miscount-states.html,2022-05-19T16:04:27Z,"A survey indicated that census takers in 2020 undercounted the number of people in six states, mostly in the South, and overcounted in eight others. Covid is among many possible reasons.","WASHINGTON The 2020 census undercounted the population of six states and overcounted residents in eight others, the Census Bureau said on Thursday, a finding that highlighted the difficulties of cond… [+996 chars]",census likely miscounted the population of 14 states  a review finds a survey indicated that census takers in 2020 undercounted the number of people in six states  mostly in the south  and overcounted in eight others  covid is among many possible reasons  washington the 2020 census undercounted the population of six states and overcounted residents in eight others  the census bureau said on thursday  a finding that highlighted the difficulties of cond  
Here’s Why Tallies of U.S. Covid Deaths Aren’t All the Same,https://www.nytimes.com/live/2022/05/20/world/covid-19-deaths-vaccines-cases,2022-05-20T09:20:31Z,The grim milestone a little over two years into the pandemic has been anticipated for weeks and comes as hospitalizations are on the rise once again.,"In what was a typically busy week for Mayor Eric Adams, he met with the model Gigi Hadid at Netflixs studio in Brooklyn. He visited a college to promote a new degree in video game design. And he visi… [+9886 chars]",here s why tallies of u s  covid deaths aren t all the same the grim milestone a little over two years into the pandemic has been anticipated for weeks and comes as hospitalizations are on the rise once again  in what was a typically busy week for mayor eric adams  he met with the model gigi hadid at netflixs studio in brooklyn  he visited a college to promote a new degree in video game design  and he visi  
"Moderna’s Covid Vaccine Is Effective in Children Under 6, F.D.A. Says",https://www.nytimes.com/2022/06/11/us/politics/moderna-vaccine-children-fda.html,2022-06-11T08:59:58Z,Outside experts will meet next week to decide whether to recommend that the agency authorize the vaccine for kids 6 months and older.,"Children 11 and younger generally experienced fewer side effects from the vaccine than adolescents, probably because their doses were weaker, the F.D.A. said. Although fevers were more frequent in ch… [+786 chars]",moderna s covid vaccine is effective in children under 6  f d a  says outside experts will meet next week to decide whether to recommend that the agency authorize the vaccine for kids 6 months and older  children 11 and younger generally experienced fewer side effects from the vaccine than adolescents  probably because their doses were weaker  the f d a  said  although fevers were more frequent in ch  
The F.D.A. authorizes Pfizer-BioNTech boosters for children ages 5 to 11.,https://www.nytimes.com/2022/05/17/us/politics/fda-pfizer-booster-children.html,2022-05-17T14:50:40Z,More than eight million of the 28 million children in that age group in the United States have received two vaccine shots.,"In a statement, Dr. Robert M. Califf, the F.D.A.s commissioner, said: While it has largely been the case that Covid-19 tends to be less severe in children than adults, the Omicron wave has seen more … [+1278 chars]",the f d a  authorizes pfizer biontech boosters for children ages 5 to 11  more than eight million of the 28 million children in that age group in the united states have received two vaccine shots  in a statement  dr  robert m  califf  the f d a s commissioner  said  while it has largely been the case that covid 19 tends to be less severe in children than adults  the omicron wave has seen more   
Anguished Father Says 10-Year-Old Was ‘Always Smiling’,https://www.nytimes.com/article/uvalde-shooting-victims.html,2022-05-25T11:46:03Z,The first names of the victims from Tuesday’s shooting started being released by grieving family members. Police have yet to release a list.,"Pretty much Alfred Garza IIIs entire family parents, girlfriend, sister, aunt and more had gathered in the room when the Texas Rangers broke the horrible news late Tuesday: His 10-year-old daughter, … [+830 chars]",anguished father says 10 year old was  always smiling  the first names of the victims from tuesday s shooting started being released by grieving family members  police have yet to release a list  pretty much alfred garza iiis entire family parents  girlfriend  sister  aunt and more had gathered in the room when the texas rangers broke the horrible news late tuesday  his 10 year old daughter    
Parents Anxious to Vaccinate Young Children Describe an Agonizing Wait,https://www.nytimes.com/2022/06/15/us/politics/parents-covid-vaccine.html,2022-06-15T16:04:22Z,"Times readers with babies, toddlers or preschoolers who are unvaccinated against the coronavirus wrote in about worries and strains, loneliness and lost time.","A parent in Denver wrote: We are a nation of selfish children, except for the children themselves.
Katie Nelb, an information technology worker and mother of a 3-year-old in McKinney, Texas, wrote: … [+1225 chars]",parents anxious to vaccinate young children describe an agonizing wait times readers with babies  toddlers or preschoolers who are unvaccinated against the coronavirus wrote in about worries and strains  loneliness and lost time  a parent in denver wrote  we are a nation of selfish children  except for the children themselves   katie nelb  an information technology worker and mother of a 3 year old in mckinney  texas  wrote    
One Man’s Choice to Be Cremated Under the Open Sky,https://www.nytimes.com/2022/05/18/us/colorado-funeral-pyre.html,2022-05-18T09:00:43Z,A small Colorado town maintains the country’s only public outdoor funeral pyre. Philip Incao saw it as his own perfect ending.,"Dr. Incao had moved to Crestone with his second wife, Jennifer, in 2006, after practicing anthroposophic medicine a Steiner-inspired holistic approach that many mainstream physicians characterize as … [+1677 chars]",one man s choice to be cremated under the open sky a small colorado town maintains the country s only public outdoor funeral pyre  philip incao saw it as his own perfect ending  dr  incao had moved to crestone with his second wife  jennifer  in 2006  after practicing anthroposophic medicine a steiner inspired holistic approach that many mainstream physicians characterize as   
How Do You Find an Apartment in N.Y.C. These Days?,https://www.nytimes.com/2022/05/28/nyregion/apartment-hunting-tips.html,2022-05-28T20:16:17Z,"Apartment hunting in the city has never been easy, but now the search has become seemingly impossible as prices soar. Readers told us about their pandemic housing struggles — and eventual successes.","I am one of the folks who snagged a Covid deal for a January 2021 lease. It was a very, very tiny studio in Greenwich Village, but I was so thrilled to be living alone for the first time and didnt mi… [+1110 chars]",how do you find an apartment in n y c  these days  apartment hunting in the city has never been easy  but now the search has become seemingly impossible as prices soar  readers told us about their pandemic housing struggles   and eventual successes  i am one of the folks who snagged a covid deal for a january 2021 lease  it was a very  very tiny studio in greenwich village  but i was so thrilled to be living alone for the first time and didnt mi  
Philadelphia Schools Reinstate Mask Mandate,https://www.nytimes.com/2022/05/23/world/americas/philadelphia-schools-masks.html,2022-05-23T09:02:43Z,"With cases rising again, the superintendent said that as the pandemic evolves, “so too will our response to it.”","And that is not new to the city. Last month, Philadelphia became the first major American city to reinstate an indoor mask mandate in response to rising coronavirus cases, only to have its health dep… [+1544 chars]",philadelphia schools reinstate mask mandate with cases rising again  the superintendent said that as the pandemic evolves   so too will our response to it   and that is not new to the city  last month  philadelphia became the first major american city to reinstate an indoor mask mandate in response to rising coronavirus cases  only to have its health dep  
New York City Budget Deal Keeps Police Spending Flat,https://www.nytimes.com/2022/06/10/nyregion/eric-adams-nyc-nypd-budget.html,2022-06-10T21:23:46Z,"Helped by better-than-expected tax revenue, the spending plan reflects the tension between Mayor Eric Adams and the City Council over the issue of crime.","In addition to making crime-fighting a priority, Mr. Adamss mayoral platform called for improving government efficiency. But his first budget is the largest in city history. Mayor Bill de Blasios fin… [+1596 chars]",new york city budget deal keeps police spending flat helped by better than expected tax revenue  the spending plan reflects the tension between mayor eric adams and the city council over the issue of crime  in addition to making crime fighting a priority  mr  adamss mayoral platform called for improving government efficiency  but his first budget is the largest in city history  mayor bill de blasios fin  
What Liberal Prosecutors Are Drawing From Chesa Boudin’s Recall,https://www.nytimes.com/2022/06/13/us/justice-reform-boudin-recall-san-francisco.html,2022-06-13T23:33:21Z,"Voters ousted Chesa Boudin as the city’s district attorney, but his allies across the country say policies like his can still succeed.","But those gains have been met by a growing and vicious counterattack whose fear narrative has found traction in the context of elevated homicides, gun violence and the Covid-19 pandemic, said Miriam … [+1554 chars]",what liberal prosecutors are drawing from chesa boudin s recall voters ousted chesa boudin as the city s district attorney  but his allies across the country say policies like his can still succeed  but those gains have been met by a growing and vicious counterattack whose fear narrative has found traction in the context of elevated homicides  gun violence and the covid 19 pandemic  said miriam   
America’s ‘Psychic Numbing’ to Gun Violence,https://www.nytimes.com/2022/06/08/opinion/numbing-gun-violence.html,2022-06-09T00:47:45Z,Americans have become overwhelmed by the scale of so much death and convinced that there is little they can do to change it.,"He continued:
If we see something that we can do, then well do it. But, if we feel ineffective, then after a while we turn it off because its painful to keep watching these stories if we think nothi… [+1847 chars]",america s  psychic numbing  to gun violence americans have become overwhelmed by the scale of so much death and convinced that there is little they can do to change it  he continued   if we see something that we can do  then well do it  but  if we feel ineffective  then after a while we turn it off because its painful to keep watching these stories if we think nothi  
Voters Decide Fate of Scott Morrison in Australia’s Election,https://www.nytimes.com/live/2022/05/20/world/australia-election,2022-05-21T01:04:47Z,"While Australians voice concern about the rising cost of living and climate change, the race has focused on the conduct of the incumbent conservative prime minister.","Prime Minister Scott Morrison at a Liberal Party campaign event in Brisbane on Sunday.Credit...Mick Tsikas/AAP, via Associated Press
When Scott Morrison first became Australias prime minister in 201… [+3911 chars]",voters decide fate of scott morrison in australia s election while australians voice concern about the rising cost of living and climate change  the race has focused on the conduct of the incumbent conservative prime minister  prime minister scott morrison at a liberal party campaign event in brisbane on sunday credit   mick tsikas aap  via associated press  when scott morrison first became australias prime minister in 201  
"How Houston Moved 25,000 People From the Streets Into Homes of Their Own",https://www.nytimes.com/2022/06/14/headway/houston-homeless-people.html,2022-06-14T09:03:08Z,"The nation’s fourth-largest city hasn’t solved homelessness, but its remarkable progress can suggest a way forward.","To hear more audio stories from publications like The New York Times, download Audm for iPhone or Android.
One steamy morning last July, Ana Rausch commandeered a shady corner of a parking lot on th… [+39260 chars]",how houston moved 25 000 people from the streets into homes of their own the nation s fourth largest city hasn t solved homelessness  but its remarkable progress can suggest a way forward  to hear more audio stories from publications like the new york times  download audm for iphone or android   one steamy morning last july  ana rausch commandeered a shady corner of a parking lot on th  
"The Stories We Tell About Covid, Sickness and Health",https://www.nytimes.com/2022/06/08/opinion/covid-sickness-health-stories.html,2022-06-08T19:00:07Z,Grappling with a recent case of Covid.,"Even at the best of times, when it comes to health and medicine, we all live in our own realities, drawn from the particular experiences and fears our minds contain, rife with irrationalities and ima… [+2278 chars]",the stories we tell about covid  sickness and health grappling with a recent case of covid  even at the best of times  when it comes to health and medicine  we all live in our own realities  drawn from the particular experiences and fears our minds contain  rife with irrationalities and ima  
A Better Understanding of Long Covid,https://www.nytimes.com/2022/05/20/podcasts/the-daily/long-covid-symptoms.html,2022-05-20T10:00:07Z,"Who does the condition affect, and how widespread is it?","Pam Belluck contributed reporting.
The Daily is made by Lisa Tobin, Rachel Quester, Lynsea Garrison, Clare Toeniskoetter, Paige Cowett, Michael Simon Johnson, Brad Fisher, Larissa Anderson, Chris Wo… [+746 chars]",a better understanding of long covid who does the condition affect  and how widespread is it  pam belluck contributed reporting   the daily is made by lisa tobin  rachel quester  lynsea garrison  clare toeniskoetter  paige cowett  michael simon johnson  brad fisher  larissa anderson  chris wo  
The Sunday Read: ‘I have Always Struggled With My Weight. Losing It Didn’t Mean Winning.’,https://www.nytimes.com/2022/06/05/podcasts/the-daily/weight-loss-sam-anderson-sunday-read.html,2022-06-05T10:00:07Z,A diet app helped writer Sam Anderson shed his extra Covid pounds — and reminded him that he was still his old self.,"We cannot escape our bodies. So how do we reconcile them with who we really are?
Sam Anderson, a staff writer, considers this particular conundrum of the human condition by recounting his lifelong s… [+1062 chars]",the sunday read   i ve always struggled with my weight  losing it didn t mean winning   a diet app helped writer sam anderson shed his extra covid pounds   and reminded him that he was still his old self  we cannot escape our bodies  so how do we reconcile them with who we really are   sam anderson  a staff writer  considers this particular conundrum of the human condition by recounting his lifelong s  
A Million Americans Have Died From Covid. We Need to Mourn Together.,https://www.nytimes.com/2022/05/22/opinion/million-covid-deaths-america.html,2022-05-22T19:25:21Z,"The magnitude of the loss is overwhelming. Every person who died represents a community, a family or a group of friends who will never be the same.","In early December 2020, the first vaccines were administered in the United States. I remember sitting at my computer screen last June, tears streaming down my face in joy, as I watched Lin-Manuel Mir… [+2397 chars]",a million americans have died from covid  we need to mourn together  the magnitude of the loss is overwhelming  every person who died represents a community  a family or a group of friends who will never be the same  in early december 2020  the first vaccines were administered in the united states  i remember sitting at my computer screen last june  tears streaming down my face in joy  as i watched lin manuel mir  
Why Adams Is Rejecting Mask Mandates as Covid Cases Rise in New York,https://www.nytimes.com/2022/05/19/nyregion/adams-mask-mandate-covid-new-york.html,2022-05-19T21:17:54Z,Mayor Eric Adams has focused on antiviral treatments and at-home testing as coronavirus cases surge again.,"Mr. de Blasio, who oversaw the citys response during the worst waves of the virus, held near-daily virtual virus briefings, sometimes inviting outside health experts like Dr. Wafaa El-Sadr, a profess… [+1898 chars]",why adams is rejecting mask mandates as covid cases rise in new york mayor eric adams has focused on antiviral treatments and at home testing as coronavirus cases surge again  mr  de blasio  who oversaw the citys response during the worst waves of the virus  held near daily virtual virus briefings  sometimes inviting outside health experts like dr  wafaa el sadr  a profess  
70 New York Judges Went on a Montauk Retreat. 20 Came Down With Covid.,https://www.nytimes.com/2022/05/18/nyregion/ny-judges-covid-montauk-retreat.html,2022-05-18T22:25:39Z,"A judicial gathering at a seaside resort, with karaoke included, became a superspreader event.","The retreat was at Gurneys Montauk Resort and Seawater Spa and involved a number of activities for the criminal court judges association, whose members include appointed criminal court judges and tho… [+1269 chars]",70 new york judges went on a montauk retreat  20 came down with covid  a judicial gathering at a seaside resort  with karaoke included  became a superspreader event  the retreat was at gurneys montauk resort and seawater spa and involved a number of activities for the criminal court judges association  whose members include appointed criminal court judges and tho  
Florida Allows Doctors to Order Vaccines for Very Young Children,https://www.nytimes.com/2022/06/17/us/florida-kids-vaccine-desantis.html,2022-06-17T22:16:23Z,"Unlike the other 49 states and the District of Columbia, Florida did not allow health care providers to preorder the vaccines ahead of the federal government’s June 14 deadline.","Vaccinations for very young children are typically administered at pediatricians offices, but unlike pharmacies in the federal Covid vaccine program, doctors cannot order doses on their own, Dr. Gwyn… [+875 chars]",florida allows doctors to order vaccines for very young children unlike the other 49 states and the district of columbia  florida did not allow health care providers to preorder the vaccines ahead of the federal government s june 14 deadline  vaccinations for very young children are typically administered at pediatricians offices  but unlike pharmacies in the federal covid vaccine program  doctors cannot order doses on their own  dr  gwyn  
C.D.C Says Adults 50 and Over Should Get Second Booster Shot,https://www.nytimes.com/2022/05/20/us/politics/cdc-second-booster.html,2022-05-20T21:13:33Z,"Previously, the agency said those 50 and older could opt for the additional shot, but only encouraged people over 65 or with underlying medical conditions to get it.","She said in Massachusetts, a state with a high rate of vaccination, officials estimate that as many as 70 percent of hospital patients who test positive for the virus were admitted primarily for unre… [+1696 chars]",c d c says adults 50 and over should get second booster shot previously  the agency said those 50 and older could opt for the additional shot  but only encouraged people over 65 or with underlying medical conditions to get it  she said in massachusetts  a state with a high rate of vaccination  officials estimate that as many as 70 percent of hospital patients who test positive for the virus were admitted primarily for unre  
