title,url,date_published,snippet,body,text
Polestar cuts 2022 delivery forecast amid China lockdown - Reuters,https://www.reuters.com/business/autos-transportation/polestar-cuts-2022-delivery-forecast-amid-china-lockdown-2022-05-19/,2022-05-19T14:23:00Z,"Swedish electric-vehicle maker Polestar cut its 2022 delivery forecast by 15,000 units to 50,000 vehicles on Thursday, hit by COVID-19 lockdowns in China.","May 19 (Reuters) - Swedish electric-vehicle maker Polestar cut its 2022 delivery forecast by 15,000 units to 50,000 vehicles on Thursday, hit by COVID-19 lockdowns in China.
""The reduction for 2022 … [+1654 chars]",polestar cuts 2022 delivery forecast amid china lockdown    swedish electric vehicle maker polestar cut its 2022 delivery forecast by 15 000 units to 50 000 vehicles on thursday  hit by covid 19 lockdowns in china  may 19    swedish electric vehicle maker polestar cut its 2022 delivery forecast by 15 000 units to 50 000 vehicles on thursday  hit by covid 19 lockdowns in china    the reduction for 2022   
Food shortages are next global health crisis -expert - Reuters.com,https://www.reuters.com/world/food-shortages-are-next-global-health-crisis-expert-2022-06-07/,2022-06-07T18:48:00Z,"Growing food shortages may represent the same health threat to the world as the COVID-19 pandemic, a leading global health figure has warned.","French President Emmanuel Macron, Tedros Adhanom Ghebreyesus, Director-General of World Health Organization (WHO), and Agnes Buzyn, French Minister for Solidarity and Health, and Peter Alexander Sand… [+2034 chars]",food shortages are next global health crisis  expert    growing food shortages may represent the same health threat to the world as the covid 19 pandemic  a leading global health figure has warned  french president emmanuel macron  tedros adhanom ghebreyesus  director general of world health organization   and agnes buzyn  french minister for solidarity and health  and peter alexander sand  
Swiss to destroy more than 620000 expired Moderna COVID doses - Reuters,https://www.reuters.com/world/europe/swiss-destroy-more-than-620000-expired-moderna-covid-doses-2022-05-27/,2022-05-27T10:16:00Z,"Switzerland will destroy more than 620,000 expired doses of Moderna's COVID-19 vaccine, health officials said on Friday, as demand for the shots drops dramatically.","ZURICH, May 27 (Reuters) - Switzerland will destroy more than 620,000 expired doses of Moderna's COVID-19 vaccine, health officials said on Friday, as demand for the shots drops dramatically.
""It wa… [+1396 chars]",swiss to destroy more than 620000 expired moderna covid doses    switzerland will destroy more than 620 000 expired doses of moderna s covid 19 vaccine  health officials said on friday  as demand for the shots drops dramatically  zurich  may 27    switzerland will destroy more than 620 000 expired doses of moderna s covid 19 vaccine  health officials said on friday  as demand for the shots drops dramatically    it wa  
EU drug regulator: mRNA COVID vaccines do not cause absence of menstruation - Reuters.com,https://www.reuters.com/world/europe/eu-drug-regulator-mrna-covid-vaccines-do-not-cause-absence-menstruation-2022-06-10/,2022-06-10T16:08:00Z,"Available data suggest that mRNA COVID-19 vaccines do not cause an absence of menstruation, the European Union's health regulator concluded on Friday.","LONDON, June 10 (Reuters) - Available data suggest that mRNA COVID-19 vaccines do not cause an absence of menstruation, the European Union's health regulator concluded on Friday.
The assessment was … [+1321 chars]",eu drug regulator  mrna covid vaccines do not cause absence of menstruation    available data suggest that mrna covid 19 vaccines do not cause an absence of menstruation  the european union s health regulator concluded on friday  london  june 10    available data suggest that mrna covid 19 vaccines do not cause an absence of menstruation  the european union s health regulator concluded on friday   the assessment was   
Japan business community seeks further relaxation of border controls - Reuters.com,https://www.reuters.com/markets/asia/japan-business-community-seeks-further-relaxation-border-controls-2022-06-10/,2022-06-10T02:41:00Z,"Japan's business community issued a joint statement on Friday seeking further relaxation of border controls, as the country begins a gradual easing of COVID-19 travel restrictions.","TOKYO, June 10 (Reuters) - Japan's business community issued a joint statement on Friday seeking further relaxation of border controls, as the country begins a gradual easing of COVID-19 travel restr… [+1213 chars]",japan business community seeks further relaxation of border controls    japan s business community issued a joint statement on friday seeking further relaxation of border controls  as the country begins a gradual easing of covid 19 travel restrictions  tokyo  june 10    japan s business community issued a joint statement on friday seeking further relaxation of border controls  as the country begins a gradual easing of covid 19 travel restr  
U.S. to drop COVID testing for incoming international air travelers - Reuters.com,https://www.reuters.com/legal/government/us-drop-covid-testing-incoming-international-air-travelers-2022-06-10/,2022-06-10T16:09:00Z,The Biden administration will drop pre-departure COVID-19 international air testing requirements effective Sunday at 12:01 a.m. after heavy lobbying from airlines and the travel industry.,"WASHINGTON, June 10 (Reuters) - The Biden administration will drop pre-departure COVID-19 international air testing requirements effective Sunday at 12:01 a.m. after heavy lobbying from airlines and … [+2804 chars]",u s  to drop covid testing for incoming international air travelers    the biden administration will drop pre departure covid 19 international air testing requirements effective sunday at 12 01 a m  after heavy lobbying from airlines and the travel industry  washington  june 10    the biden administration will drop pre departure covid 19 international air testing requirements effective sunday at 12 01 a m  after heavy lobbying from airlines and   
"Mick Jagger positive for COVID-19, Amsterdam Rolling Stones concert postponed - Reuters.com",https://www.reuters.com/world/us/mick-jagger-positive-covid-19-amsterdam-rolling-stones-concert-postponed-2022-06-13/,2022-06-13T16:31:00Z,"The Rolling Stones postponed a concert on Monday in Amsterdam after lead singer Mick Jagger tested positive for COVID-19, the band said in a statement.","AMSTERDAM, June 13 (Reuters) - The Rolling Stones postponed a concert on Monday in Amsterdam after lead singer Mick Jagger tested positive for COVID-19, the band said in a statement.
""The Rolling St… [+935 chars]",mick jagger positive for covid 19  amsterdam rolling stones concert postponed    the rolling stones postponed a concert on monday in amsterdam after lead singer mick jagger tested positive for covid 19  the band said in a statement  amsterdam  june 13    the rolling stones postponed a concert on monday in amsterdam after lead singer mick jagger tested positive for covid 19  the band said in a statement    the rolling st  
Shanghai orders mass COVID testing each weekend until end-July - Reuters.com,https://www.reuters.com/world/china/shanghai-orders-mass-covid-testing-each-weekend-until-end-july-2022-06-15/,2022-06-15T09:35:00Z,"Shanghai will require all of its 16 districts to organise mass COVID testing for residents every weekend until the end of July, a city official said on Wednesday.","SHANGHAI, June 15 (Reuters) - Shanghai will require all of its 16 districts to organise mass COVID testing for residents every weekend until the end of July, a city official said on Wednesday.
Zhao … [+506 chars]",shanghai orders mass covid testing each weekend until end july    shanghai will require all of its 16 districts to organise mass covid testing for residents every weekend until the end of july  a city official said on wednesday  shanghai  june 15    shanghai will require all of its 16 districts to organise mass covid testing for residents every weekend until the end of july  a city official said on wednesday   zhao   
"Asia Gold Indian discounts narrow, COVID curbs keep leash on China demand - Reuters",https://www.reuters.com/markets/commodities/asia-gold-indian-discounts-narrow-covid-curbs-keep-leash-china-demand-2022-06-17/,2022-06-17T10:22:00Z,"Discounts on physical gold in India narrowed this week, helped by some fresh buying from jewellers, while COVID-19 restrictions kept activity tepid in top consumer China.","June 17 (Reuters) - Discounts on physical gold in India narrowed this week, helped by some fresh buying from jewellers, while COVID-19 restrictions kept activity tepid in top consumer China.
Indian … [+2081 chars]",asia gold indian discounts narrow  covid curbs keep leash on china demand    discounts on physical gold in india narrowed this week  helped by some fresh buying from jewellers  while covid 19 restrictions kept activity tepid in top consumer china  june 17    discounts on physical gold in india narrowed this week  helped by some fresh buying from jewellers  while covid 19 restrictions kept activity tepid in top consumer china   indian   
Almeida out of Giro d'Italia after testing positive for COVID - Reuters.com,https://www.reuters.com/lifestyle/sports/almeida-out-giro-ditalia-after-testing-positive-covid-2022-05-26/,2022-05-26T12:36:00Z,"Joao Almeida of UAE Team Emirates has withdrawn from the Giro d'Italia after testing positive for COVID-19, his team announced on Thursday.","May 26 (Reuters) - Joao Almeida of UAE Team Emirates has withdrawn from the Giro d'Italia after testing positive for COVID-19, his team announced on Thursday.
The Portuguese rider was fourth in the … [+1290 chars]",almeida out of giro d italia after testing positive for covid    joao almeida of uae team emirates has withdrawn from the giro d italia after testing positive for covid 19  his team announced on thursday  may 26    joao almeida of uae team emirates has withdrawn from the giro d italia after testing positive for covid 19  his team announced on thursday   the portuguese rider was fourth in the   
EU health regulator backs using AstraZeneca COVID shot as booster - Reuters,https://www.reuters.com/world/europe/eu-health-regulator-backs-using-astrazeneca-covid-shot-booster-2022-05-19/,2022-05-19T15:12:00Z,"The European health regulator on Thursday endorsed the use of AstraZeneca's <a href=""https://www.reuters.com/companies/AZN.L"" target=""_blank"">(AZN.L)</a> COVID vaccine, Vaxzevria, as a booster.","LONDON, May 19 (Reuters) - The European health regulator on Thursday endorsed the use of AstraZeneca's (AZN.L) COVID vaccine, Vaxzevria, as a booster.
The recommendation, made by a committee of the … [+1991 chars]",eu health regulator backs using astrazeneca covid shot as booster    the european health regulator on thursday endorsed the use of astrazeneca s  covid vaccine  vaxzevria  as a booster  london  may 19    the european health regulator on thursday endorsed the use of astrazeneca s  covid vaccine  vaxzevria  as a booster   the recommendation  made by a committee of the   
In pictures: Shanghai takes steps towards ending lockdown - Reuters,https://www.reuters.com/news/picture/in-pictures-shanghai-takes-steps-towards-idUSRTS86OFI,2022-05-27T16:36:00Z,"Residents chat through gaps in barriers at a closed residential area during lockdown, amid the COVID-19 outbreak, in Shanghai, China, May 27, 2022.  REUTERS/Aly Song","Reuters, the news and media division of Thomson Reuters, is the worlds largest multimedia news provider, reaching billions of people worldwide every day. Reuters provides business, financial, nationa… [+139 chars]",in pictures  shanghai takes steps towards ending lockdown    residents chat through gaps in barriers at a closed residential area during lockdown  amid the covid 19 outbreak  in shanghai  china  may 27  2022    aly song   the news and media division of thomson   is the worlds largest multimedia news provider  reaching billions of people worldwide every day   provides business  financial  nationa  
U.S. Open called off due to COVID-related organisational complications - Reuters.com,https://www.reuters.com/lifestyle/sports/us-open-called-off-due-covid-related-organisational-complications-2022-06-07/,2022-06-07T10:44:00Z,The Badminton World Federation (BWF) said on Tuesday this year's U.S. Open has been cancelled due to organisational complications caused by COVID-19.,"June 7 (Reuters) - The Badminton World Federation (BWF) said on Tuesday this year's U.S. Open has been cancelled due to organisational complications caused by COVID-19.
The U.S. Open, a Super 300 to… [+596 chars]",u s  open called off due to covid related organisational complications    the badminton world federation  said on tuesday this year s u s  open has been cancelled due to organisational complications caused by covid 19  june 7    the badminton world federation  said on tuesday this year s u s  open has been cancelled due to organisational complications caused by covid 19   the u s  open  a super 300 to  
Oil dives as U.S. inflation data surges; China imposes lockdowns - Reuters.com,https://www.reuters.com/markets/europe/oil-dives-us-inflation-data-surges-china-imposes-lockdowns-2022-06-10/,2022-06-10T17:04:00Z,"Oil prices sank on Friday, after U.S. consumer prices rose more than expected and China imposed new COVID-19 lockdown measures.","NEW YORK, June 10 (Reuters) - Oil prices sank on Friday, after U.S. consumer prices rose more than expected and China imposed new COVID-19 lockdown measures.
Brent crude fell $2.12, or 1.7%, to $120… [+2746 chars]",oil dives as u s  inflation data surges  china imposes lockdowns    oil prices sank on friday  after u s  consumer prices rose more than expected and china imposed new covid 19 lockdown measures  new york  june 10    oil prices sank on friday  after u s  consumer prices rose more than expected and china imposed new covid 19 lockdown measures   brent crude fell  2 12  or 1 7   to  120  
"New WHO panel to speed up pandemic response, address shortcomings - Reuters",https://www.reuters.com/business/healthcare-pharmaceuticals/new-who-panel-speed-up-pandemic-response-address-shortcomings-2022-05-30/,2022-05-30T17:16:00Z,The World Health Organization's governing board agreed on Monday to form a new committee to help speed up its response to health emergencies like COVID-19.,"GENEVA, May 30 (Reuters) - The World Health Organization's governing board agreed on Monday to form a new committee to help speed up its response to health emergencies like COVID-19.
The U.N. health… [+1833 chars]",new who panel to speed up pandemic response  address shortcomings    the world health organization s governing board agreed on monday to form a new committee to help speed up its response to health emergencies like covid 19  geneva  may 30    the world health organization s governing board agreed on monday to form a new committee to help speed up its response to health emergencies like covid 19   the u n  health  
"As Shanghai reopens, California ports prepare for cargo surge - Reuters",https://www.reuters.com/markets/commodities/shanghai-reopens-california-ports-prepare-cargo-surge-2022-06-02/,2022-06-02T23:29:00Z,"California port leaders expect imports to rise as Shanghai, home to the world's busiest seaport, emerges from a two-month COVID-19 lockdown.","June 2 (Reuters) - California port leaders expect imports to rise as Shanghai, home to the world's busiest seaport, emerges from a two-month COVID-19 lockdown.
The question is whether that release o… [+1919 chars]",as shanghai reopens  california ports prepare for cargo surge    california port leaders expect imports to rise as shanghai  home to the world s busiest seaport  emerges from a two month covid 19 lockdown  june 2    california port leaders expect imports to rise as shanghai  home to the world s busiest seaport  emerges from a two month covid 19 lockdown   the question is whether that release o  
Shanghai's Minhang district announces new lockdown - Reuters,https://www.reuters.com/world/china/shanghais-minhang-district-announces-new-lockdown-2022-06-09/,2022-06-09T00:52:00Z,"The sprawling district of Minhang in central Shanghai has implemented new lockdown measures to detect and control COVID-19 transmission risks, the district government said on Thursday.","SHANGHAI, June 9 (Reuters) - The sprawling district of Minhang in central Shanghai has implemented new lockdown measures to detect and control COVID-19 transmission risks, the district government sai… [+820 chars]",shanghai s minhang district announces new lockdown    the sprawling district of minhang in central shanghai has implemented new lockdown measures to detect and control covid 19 transmission risks  the district government said on thursday  shanghai  june 9    the sprawling district of minhang in central shanghai has implemented new lockdown measures to detect and control covid 19 transmission risks  the district government sai  
Bank of England to drop post-COVID capital buffer rule - Reuters.com,https://www.reuters.com/business/finance/bank-england-drop-post-covid-capital-buffer-rule-2022-06-13/,2022-06-13T09:25:00Z,The Bank of England said on Monday that it would remove a post-COVID capital buffer adjustment now that risks from the pandemic had subsided.,"LONDON, June 13 (Reuters) - The Bank of England said on Monday that it would remove a post-COVID capital buffer adjustment now that risks from the pandemic had subsided.
""Removing a temporary capita… [+584 chars]",bank of england to drop post covid capital buffer rule    the bank of england said on monday that it would remove a post covid capital buffer adjustment now that risks from the pandemic had subsided  london  june 13    the bank of england said on monday that it would remove a post covid capital buffer adjustment now that risks from the pandemic had subsided    removing a temporary capita  
German trade with China largely unaffected by lockdowns - stats office - Reuters.com,https://www.reuters.com/markets/europe/german-trade-with-china-largely-unaffected-by-lockdowns-stats-office-2022-06-13/,2022-06-13T07:54:00Z,"German trade with China in April was little affected by COVID-19 lockdowns and consequent disarray in supply chains, the Federal Statistics Office said on Monday.","BERLIN, June 13 (Reuters) - German trade with China in April was little affected by COVID-19 lockdowns and consequent disarray in supply chains, the Federal Statistics Office said on Monday.
Germany… [+1395 chars]",german trade with china largely unaffected by lockdowns   stats office    german trade with china in april was little affected by covid 19 lockdowns and consequent disarray in supply chains  the federal statistics office said on monday  berlin  june 13    german trade with china in april was little affected by covid 19 lockdowns and consequent disarray in supply chains  the federal statistics office said on monday   germany  
Crowell builds London tech practice with Baker Botts dealmaker - Reuters.com,https://www.reuters.com/legal/legalindustry/crowell-builds-london-tech-practice-with-baker-botts-dealmaker-2022-06-09/,2022-06-09T09:16:00Z,"Crowell & Moring said Thursday it has added David Ramm, who has advised technology companies and COVID-19 vaccine developers, as a partner on its London M&A team.","(Reuters) - Crowell &amp; Moring said Thursday it has added David Ramm, who has advised technology companies and COVID-19 vaccine developers, as a partner on its London M&amp;A team.
Ramm said he wo… [+1601 chars]",crowell builds london tech practice with baker botts dealmaker    crowell   moring said thursday it has added david ramm  who has advised technology companies and covid 19 vaccine developers  as a partner on its london m a team     crowell  amp  moring said thursday it has added david ramm  who has advised technology companies and covid 19 vaccine developers  as a partner on its london m amp a team   ramm said he wo  
India's opposition leader Sonia Gandhi hospitalised with COVID-related issues - Reuters India,https://www.reuters.com/world/india/indias-opposition-leader-sonia-gandhi-hospitalised-with-covid-related-issues-2022-06-12/,2022-06-12T11:34:00Z,"The leader of India's main opposition party, Sonia Gandhi, has been admitted to hospital in New Delhi with health issues related to COVID-19, her Congress party said.","NEW DELHI, June 12 (Reuters) - The leader of India's main opposition party, Sonia Gandhi, has been admitted to hospital in New Delhi with health issues related to COVID-19, her Congress party said.
… [+1161 chars]",india s opposition leader sonia gandhi hospitalised with covid related issues    india the leader of india s main opposition party  sonia gandhi  has been admitted to hospital in new delhi with health issues related to covid 19  her congress party said  new delhi  june 12    the leader of india s main opposition party  sonia gandhi  has been admitted to hospital in new delhi with health issues related to covid 19  her congress party said     
Harvard University president says he will step down in 2023 - Reuters,https://www.reuters.com/world/us/harvard-university-president-says-he-will-step-down-2023-2022-06-08/,2022-06-08T20:17:00Z,Harvard President Lawrence Bacow said on Wednesday that he would leave his post in June 2023 after helping shepherd the nation's oldest university through the COVID pandemic.,"June 8 (Reuters) - Harvard President Lawrence Bacow said on Wednesday that he would leave his post in June 2023 after helping shepherd the nation's oldest university through the COVID pandemic.
Baco… [+630 chars]",harvard university president says he will step down in 2023    harvard president lawrence bacow said on wednesday that he would leave his post in june 2023 after helping shepherd the nation s oldest university through the covid pandemic  june 8    harvard president lawrence bacow said on wednesday that he would leave his post in june 2023 after helping shepherd the nation s oldest university through the covid pandemic   baco  
"Beijing bar-linked COVID outbreak is easing as measures take effect, official says - Reuters",https://www.reuters.com/world/china/beijing-bar-linked-covid-outbreak-is-easing-measures-take-effect-official-says-2022-06-16/,2022-06-16T08:37:00Z,"China's capital Beijing's eight-day measures to fight a COVID-19 outbreak linked to a local bar has shown effect, a city government spokesperson said on Thursday.","BEIJING, June 16 (Reuters) - China's capital Beijing's eight-day measures to fight a COVID-19 outbreak linked to a local bar has shown effect, a city government spokesperson said on Thursday.
The ba… [+409 chars]",beijing bar linked covid outbreak is easing as measures take effect  official says    china s capital beijing s eight day measures to fight a covid 19 outbreak linked to a local bar has shown effect  a city government spokesperson said on thursday  beijing  june 16    china s capital beijing s eight day measures to fight a covid 19 outbreak linked to a local bar has shown effect  a city government spokesperson said on thursday   the ba  
Bahrain Victorious withdraw from Tour de Suisse after positive COVID tests - Reuters,https://www.reuters.com/lifestyle/sports/bahrain-victorious-withdraw-tour-de-suisse-after-positive-covid-tests-2022-06-17/,2022-06-17T08:37:00Z,"Bahrain Victorious withdrew from the Tour de Suisse after being notified of positive COVID-19 results from a round of tests conducted on Friday, the team said.","June 17 (Reuters) - Bahrain Victorious withdrew from the Tour de Suisse after being notified of positive COVID-19 results from a round of tests conducted on Friday, the team said.
Their withdrawal f… [+827 chars]",bahrain victorious withdraw from tour de suisse after positive covid tests    bahrain victorious withdrew from the tour de suisse after being notified of positive covid 19 results from a round of tests conducted on friday  the team said  june 17    bahrain victorious withdrew from the tour de suisse after being notified of positive covid 19 results from a round of tests conducted on friday  the team said   their withdrawal f  
COVID-wracked N.Korea may greet Biden with a missile test - Reuters,https://www.reuters.com/world/asia-pacific/covid-wracked-nkorea-may-greet-biden-with-missile-test-2022-05-18/,2022-05-18T04:14:00Z,"Despite battling a wave of suspected COVID-19 infections, North Korea appears to be preparing to test an intercontinental ballistic missile (ICBM) ahead of U.S. President Joe Biden's first official trip to South Korea, a U.S. official said.","WASHINGTON/SEOUL, May 18 (Reuters) - Despite battling a wave of suspected COVID-19 infections, North Korea appears to be preparing to test an intercontinental ballistic missile (ICBM) ahead of U.S. P… [+3923 chars]",covid wracked n korea may greet biden with a missile test    despite battling a wave of suspected covid 19 infections  north korea appears to be preparing to test an intercontinental ballistic missile  ahead of u s  president joe biden s first official trip to south korea  a u s  official said  washington seoul  may 18    despite battling a wave of suspected covid 19 infections  north korea appears to be preparing to test an intercontinental ballistic missile  ahead of u s  p  
