title,url,date_published,snippet,body,text
From the Miami mayor’s office to the White House? Why not?,https://www.washingtonpost.com/opinions/2022/05/20/miami-mayor-francis-suarez-republican-rising-star/,2022-05-20T11:00:16Z,"Francis Suarez, a Republican, is not coy about what he calls « the big job. »","Placeholder while article actions load
MIAMI The mayor of the nations most progressing and least progressive large city says a confluence of macro factors explains both attributes. Abundant sunshine… [+4559 chars]",from the miami mayor s office to the white house  why not  francis suarez  a republican  is not coy about what he calls   the big job      miami the mayor of the nations most progressing and least progressive large city says a confluence of macro factors explains both attributes  abundant sunshine  
Rescuing restaurants (again) ought to give Congress indigestion,https://www.washingtonpost.com/opinions/2022/06/01/congress-second-restaurant-rescue/,2022-06-01T11:00:39Z,"Arriving as federal spending has driven inflation to a 40-year high, the Restaurant Revitalization Replenishment Act indicates disregard for this rule: When you are in a hole, quit digging.","Placeholder while article actions load
It is axiomatic that the titles of congressional bills, like the titles of Marx Brothers movies (Duck Soup, Horse Feathers), are not scrupulously informative. … [+4782 chars]",rescuing restaurants  ought to give congress indigestion arriving as federal spending has driven inflation to a 40 year high  the restaurant revitalization replenishment act indicates disregard for this rule  when you are in a hole  quit digging    it is axiomatic that the titles of congressional bills  like the titles of marx brothers movies   are not scrupulously informative    
How Fox News has dominated the White House briefing,https://www.washingtonpost.com/opinions/2022/06/07/fox-news-press-briefings/,2022-06-07T17:53:26Z,Why do Fox News correspondents eat up so much time?,"Placeholder while article actions load
On Day 2 of the Biden administration, Fox News host Sean Hannity taunted White House press secretary Jen Psaki by hyping network White House correspondent Pete… [+7211 chars]",how fox news has dominated the white house briefing why do fox news correspondents eat up so much time    on day 2 of the biden administration  fox news host sean hannity taunted white house press secretary jen psaki by hyping network white house correspondent pete  
Biden wants to rebuild the EPA. He does not have the money to do it.,https://www.washingtonpost.com/climate-environment/2022/05/31/epa-biden-climate-chemical-safety/,2022-05-31T10:00:00Z,"After years of neglect, President Biden promised to reinvigorate the EPA as part of his push to tackle climate change and ease the pollution burden placed on poor and minority communities. But the agency’s budgetary woes are preventing the nation’s top pollut…","Placeholder while article actions load
They were locked out. Experts tasked with assessing how hundreds of new chemicals may harm human health couldnt access the data they needed to do their work.
… [+9882 chars]",biden wants to rebuild the epa  he doesn t have the money to do it  after years of neglect  president biden promised to reinvigorate the epa as part of his push to tackle climate change and ease the pollution burden placed on poor and minority communities  but the agency s budgetary woes are preventing the nation s top pollut    they were locked out  experts tasked with assessing how hundreds of new chemicals may harm human health couldnt access the data they needed to do their work     
Air pollution worse for global lifespan than cigarettes or alcohol,https://www.washingtonpost.com/world/2022/06/15/global-pollution-air-quality-life-index-report-life-expectancy/,2022-06-15T20:51:03Z,"Air pollution takes more than two years off global average life expectancy, the Air Quality Life Index found — making breathing more dangerous globally than smoking cigaretttes or drinking alcohol.","Placeholder while article actions load
Breathing is more dangerous than smoking cigarettes or drinking alcohol.
Thats according to the latest report from the Energy Policy Institute at the Universi… [+7672 chars]",air pollution worse for global lifespan than cigarettes or alcohol air pollution takes more than two years off global average life expectancy  the air quality life index found   making breathing more dangerous globally than smoking cigaretttes or drinking alcohol    breathing is more dangerous than smoking cigarettes or drinking alcohol   thats according to the latest report from the energy policy institute at the universi  
Block-by-block data show pollution’s stark toll on people of color,https://www.washingtonpost.com/climate-environment/2022/05/25/aclima-bay-area-pollution-racism/,2022-05-25T11:00:00Z,The data released Tuesday by Aclima — a California-based tech company that measured the region’s air quality block-by-block for the first time — found that communities of color and low-income communities are exposed to much more pollution than mostly White co…,"Placeholder while article actions load
Finding the most polluted places in the San Francisco Bay area is simple, a new air quality analysis shows: Locate places where mostly Black, Latino, Asian and… [+10118 chars]",block by block data show pollution s stark toll on people of color the data released tuesday by aclima   a california based tech company that measured the region s air quality block by block for the first time   found that communities of color and low income communities are exposed to much more pollution than mostly white co    finding the most polluted places in the san francisco bay area is simple  a new air quality analysis shows  locate places where mostly black  latino  asian and  
Climate change is forcing schools to close early for ‘heat days’,https://www.washingtonpost.com/education/2022/06/04/school-heat-days-climate-change/,2022-06-04T10:00:59Z,"Regions where extreme heat was once rare now periodically find their buildings unbearable. Schools are using double the number of heat days compared with a decade ago, a study found.","Placeholder while article actions load
Temperatures kept rising in Philadelphia and Baltimore. Finally, it was just too hot to keep students in classrooms without air conditioning. On Tuesday, both … [+11331 chars]",climate change is forcing schools to close early for  heat days  regions where extreme heat was once rare now periodically find their buildings unbearable  schools are using double the number of heat days compared with a decade ago  a study found    temperatures kept rising in philadelphia and baltimore  finally  it was just too hot to keep students in classrooms without air conditioning  on tuesday  both   
Most Americans do not accept the mass slaughter of children. Why does the GOP?,https://www.washingtonpost.com/opinions/2022/06/06/guns-deaths-violence-schooting-cbs-poll-shows-republicans-accept-mass-slaughter-children/,2022-06-06T16:46:52Z,A new poll shows that it's not just politicians who are the problem.,"Placeholder while article actions load
Republicans often throw out platitudes on their refusal to tackle the gun epidemic:We all care about kids, they say. Sometimes their tone becomes defensive: Do… [+3068 chars]",most americans don t accept the mass slaughter of children  why does the gop  a new poll shows that it s not just politicians who are the problem    republicans often throw out platitudes on their refusal to tackle the gun epidemic we all care about kids  they say  sometimes their tone becomes defensive  do  
One Republican should be thrilled with the Jan. 6 hearings,https://www.washingtonpost.com/opinions/2022/06/07/donald-trump-january-6-insurrection-committee-hearings-ron-desantis-should-be-thrilled/,2022-06-07T11:45:32Z,Florida Gov. Ron DeSantis offers Trumpism without Trump.,"Placeholder while article actions load
Donald Trumps grip on the GOP remains superior to any other Republican, but it is not absolute. That means the Jan. 6 hearings, which Trump allies have decried… [+3611 chars]",one republican should be thrilled with the jan  6 hearings florida gov  ron desantis offers trumpism without trump    donald trumps grip on the gop remains superior to any other republican  but it is not absolute  that means the jan  6 hearings  which trump allies have decried  
Four things Biden can do to improve his standing,https://www.washingtonpost.com/opinions/2022/05/31/four-things-biden-can-do-improve-his-political-slump/,2022-05-31T16:00:40Z,Biden needs to get a grip on his presidency.,"Placeholder while article actions load
NBC News summarized what widespread reporting has made clear for months: President Biden is frustrated with his administration, which lacks a clear message and… [+4031 chars]",four things biden can do to improve his standing biden needs to get a grip on his presidency    nbc news summarized what widespread reporting has made clear for months  president biden is frustrated with his administration  which lacks a clear message and  
The media must say it: The GOP is undermining democracy,https://www.washingtonpost.com/opinions/2022/06/14/media-must-say-it-gop-is-undermining-democracy/,2022-06-14T14:00:00Z,Hiring more reporters to cover threats to democracy is not enough.,"Placeholder while article actions load
Many newsrooms, in their attempt to cover the movement against democracy across the country, have hired more reporters to cover threats to democracy. Thats an … [+4465 chars]",the media must say it  the gop is undermining democracy hiring more reporters to cover threats to democracy is not enough    many newsrooms  in their attempt to cover the movement against democracy across the country  have hired more reporters to cover threats to democracy  thats an   
Biden’s rousing speech before the AFL-CIO is exactly the message Democrats need,https://www.washingtonpost.com/opinions/2022/06/15/bidens-rousing-speech-before-afl-cio-is-exactly-message-democrats-need/,2022-06-15T14:00:00Z,Maybe Biden should talk to unions more often.,"Placeholder while article actions load
President Biden and his White House staff have received a lot of criticism lately, much of it from Democrats nervous that his message isnt breaking through or … [+4705 chars]",biden s rousing speech before the afl cio is exactly the message democrats need maybe biden should talk to unions more often    president biden and his white house staff have received a lot of criticism lately  much of it from democrats nervous that his message isnt breaking through or   
Biden’s protection from covid: Few close contacts,https://www.washingtonpost.com/politics/2022/05/19/biden-covid-close-contacts/,2022-05-19T14:56:22Z,"Biden's vice president, spokeswoman and daughter are not close contacts when it comes to covid, raising the question: Who does meet at length with the president?","Placeholder while article actions load
When Vice President Harris contracted covid, the White House assured the public that she could not have passed the disease to the president: She hadnt been wit… [+6502 chars]",biden s protection from covid  few close contacts biden s vice president  spokeswoman and daughter are not close contacts when it comes to covid  raising the question  who does meet at length with the president    when vice president harris contracted covid  the white house assured the public that she could not have passed the disease to the president  she hadnt been wit  
Congressional covid funding deal appears ‘dead’ after GOP criticism,https://www.washingtonpost.com/health/2022/06/16/covid-funding-deal-appears-dead/,2022-06-16T22:17:47Z,Republican senators accuse White House of 'false information’; Biden officials say GOP keeps finding new objections to covid funding.,"Placeholder while article actions load
A congressional deal for billions of dollars in additional coronavirus funding appeared dead Thursday after Senate Republicans accused the White House of being… [+5950 chars]",congressional covid funding deal appears  dead  after gop criticism republican senators accuse white house of  false information   biden officials say gop keeps finding new objections to covid funding    a congressional deal for billions of dollars in additional coronavirus funding appeared dead thursday after senate republicans accused the white house of being  
"As Herschel Walker’s GOP profile rises, the falsehoods mount",https://www.washingtonpost.com/politics/2022/06/14/herschel-walker-false-claims-senate-georgia/,2022-06-14T19:39:06Z,"The title of “honorary deputy” that Herschel Walker, the GOP nominee for the U.S. Senate in Georgia, is promoting as his link to law enforcement was likened by one former prosecutor to « a junior ranger badge. »","Placeholder while article actions load
During the course of Herschel Walkers Senate campaign, the Republican nominee in Georgia has won the hearts of former president Donald Trump and GOP voters hop… [+8506 chars]",as herschel walker s gop profile rises  the falsehoods mount the title of  honorary deputy  that herschel walker  the gop nominee for the u s  senate in georgia  is promoting as his link to law enforcement was likened by one former prosecutor to   a junior ranger badge      during the course of herschel walkers senate campaign  the republican nominee in georgia has won the hearts of former president donald trump and gop voters hop  
"Even from the CDC, America gets two very different pandemic messages",https://www.washingtonpost.com/politics/2022/05/18/even-cdc-america-gets-two-very-different-pandemic-messages/,2022-05-18T20:47:38Z,"Everything is fine, except that it isn't.","Placeholder while article actions load
On Tuesday afternoon, the Centers for Disease Control and Preventions preferred dashboard for evaluating the state of the coronavirus pandemic offered a broadl… [+4227 chars]",even from the cdc  america gets two very different pandemic messages everything is fine  except that it isn t    on tuesday afternoon  the centers for disease control and preventions preferred dashboard for evaluating the state of the coronavirus pandemic offered a broadl  
"Post Politics Now: Biden says recession ‘not inevitable,’ acknowledges Americans are ‘really down’",https://www.washingtonpost.com/politics/2022/06/17/biden-recession-americans-down-senate/,2022-06-17T11:17:14Z,The Senate left town this week with a deal on guns still unresolved and a coronavirus funding package in severe peril.,President Biden said that a recession is not inevitable but acknowledged that Americans are really down after coping with the far-reaching consequences of the coronavirus pandemic and a long stretch … [+1125 chars],post politics now  biden says recession  not inevitable   acknowledges americans are  really down  the senate left town this week with a deal on guns still unresolved and a coronavirus funding package in severe peril  president biden said that a recession is not inevitable but acknowledged that americans are really down after coping with the far reaching consequences of the coronavirus pandemic and a long stretch   
Biden visit showcases hardened stances on North Korea,https://www.washingtonpost.com/world/2022/05/24/biden-north-korea-south-korea/,2022-05-24T11:01:24Z,The Biden administration appears to be returning to the Obama-era « strategic patience » of not engaging in North Korea.,"Placeholder while article actions load
SEOUL President Biden was about to take off from Seoul to Tokyo during his first Asia trip as president, when a reporter asked if he had a message for North Ko… [+4969 chars]",biden visit showcases hardened stances on north korea the biden administration appears to be returning to the obama era   strategic patience   of not engaging in north korea    seoul president biden was about to take off from seoul to tokyo during his first asia trip as president  when a reporter asked if he had a message for north ko  
"YouTube pulls Jan. 6 committee post, citing election disinformation",https://www.washingtonpost.com/technology/2022/06/17/jan6-youtube-committee-clip-pulled/,2022-06-17T20:06:31Z,YouTube said the clip did not include information disputing Trump.,"Placeholder while article actions load
YouTube took down a clip uploaded by the Jan. 6 committee to the video platform, saying the video, which featured a clip of former president Donald Trump telli… [+1893 chars]",youtube pulls jan  6 committee post  citing election disinformation youtube said the clip did not include information disputing trump    youtube took down a clip uploaded by the jan  6 committee to the video platform  saying the video  which featured a clip of former president donald trump telli  
Pennsylvania GOP Senate race is likely headed to a recount,https://www.washingtonpost.com/politics/2022/05/20/pennsylvania-republican-senate-primary-recount/,2022-05-20T21:33:02Z,The Associated Press said the race was too close to call.,"Placeholder while article actions load
The Pennsylvania Senate GOP primary is almost certainly headed for a recount after the Associated Press said on Friday it could not project a winner because th… [+2212 chars]",pennsylvania gop senate race is likely headed to a recount  said the race was too close to call    the pennsylvania senate gop primary is almost certainly headed for a recount after  said on friday it could not project a winner because th  
Anti-vaccine doctor sentenced to prison for Jan. 6 trespassing,https://www.washingtonpost.com/national-security/2022/06/16/simone-gold-sentenced/,2022-06-16T18:29:18Z,"A federal judge blasted Simone Gold for using her legal woes to raise $430,000 for herself and her organization.","Placeholder while article actions load
A federal judge on Thursday sentenced Simone Gold, the founder of the anti-vaccine group Americas Frontline Doctors, to 60 days in jail for trespassing in the … [+3676 chars]",anti vaccine doctor sentenced to prison for jan  6 trespassing a federal judge blasted simone gold for using her legal woes to raise  430 000 for herself and her organization    a federal judge on thursday sentenced simone gold  the founder of the anti vaccine group americas frontline doctors  to 60 days in jail for trespassing in the   
Justice Dept. to unveil new efforts to bolster hate-crime reporting,https://www.washingtonpost.com/national-security/2022/05/20/justice-hate-crimes-asian/,2022-05-20T09:00:00Z,Attorney General Merrick Garland will welcome civic leaders to the Justice Department to shine a spotlight on new efforts to improve tracking and reporting of bias-motivated crimes.,"Placeholder while article actions load
With the nation still reeling from a racist mass shooting in Buffalo, Attorney General Merrick Garland on Friday will welcome Black and Asian American communit… [+4759 chars]",justice dept  to unveil new efforts to bolster hate crime reporting attorney general merrick garland will welcome civic leaders to the justice department to shine a spotlight on new efforts to improve tracking and reporting of bias motivated crimes    with the nation still reeling from a racist mass shooting in buffalo  attorney general merrick garland on friday will welcome black and asian american communit  
"Biden’s charm offensive seeks to strengthen ties with South Korea, Indo-Pacific region",https://www.washingtonpost.com/politics/2022/05/21/biden-asia-korea-japan-meeting/,2022-05-21T08:38:59Z,"Biden began engaging personally with Korea's president on the 10th day of his tenure, part of an effort to exert more influence in the region.","Placeholder while article actions load
SEOUL President Biden on Saturday held bilateral talks with South Korean President Yoon Suk-yeol, speaking of the shared sacrifice that united the two countrie… [+5940 chars]",biden s charm offensive seeks to strengthen ties with south korea  indo pacific region biden began engaging personally with korea s president on the 10th day of his tenure  part of an effort to exert more influence in the region    seoul president biden on saturday held bilateral talks with south korean president yoon suk yeol  speaking of the shared sacrifice that united the two countrie  
"Herschel Walker, who criticizes absentee fathers, acknowledges second son",https://www.washingtonpost.com/politics/2022/06/15/herschel-walker-son-georgia-senate/,2022-06-15T14:03:35Z,"Scott Paradise, Walker’s campaign manager, confirmed in a statement to The Washington Post early Wednesday that Walker, an outspoken critic of absentee fathers in Black households, has a second son.","Placeholder while article actions load
Herschel Walker, the Republican Senate nominee in Georgia who has been a vocal critic of absentee fathers in Black households, acknowledged Tuesday that he has… [+5182 chars]",herschel walker  who criticizes absentee fathers  acknowledges second son scott paradise  walker s campaign manager  confirmed in a statement to  early wednesday that walker  an outspoken critic of absentee fathers in black households  has a second son    herschel walker  the republican senate nominee in georgia who has been a vocal critic of absentee fathers in black households  acknowledged tuesday that he has  
Whistleblower report on baby formula did not reach top FDA food safety official,https://www.washingtonpost.com/politics/2022/05/25/whistleblower-fda-yiannas-report-abbott-baby-formula/,2022-05-25T12:00:34Z,"Frank Yiannas, the FDA’s deputy commissioner for food policy and response, didn’t learn about a whistleblower complaint alleging safety issues at a baby formula plant until four months later, according to Yiannas and and others knowledgeable about the case.","Placeholder while article actions load
When a whistleblower sent a 34-page report to the Food and Drug Administration in October alleging a host of unsanitary conditions at an Abbott infant formula … [+16409 chars]",whistleblower report on baby formula didn t reach top fda food safety official frank yiannas  the fda s deputy commissioner for food policy and response  didn t learn about a whistleblower complaint alleging safety issues at a baby formula plant until four months later  according to yiannas and and others knowledgeable about the case    when a whistleblower sent a 34 page report to the food and drug administration in october alleging a host of unsanitary conditions at an abbott infant formula   
Some in GOP question red-flag laws as Senate tries to clinch gun deal,https://www.washingtonpost.com/politics/2022/06/09/senate-red-flag-laws/,2022-06-09T21:00:07Z,Conservatives on Capitol Hill are voicing some sharper objections to the measures.,"Placeholder while article actions load
Conservative Republicans on Capitol Hill are voicing increasingly sharp objections to any federal effort to promote red-flag laws meant to keep guns away from … [+7590 chars]",some in gop question red flag laws as senate tries to clinch gun deal conservatives on capitol hill are voicing some sharper objections to the measures    conservative republicans on capitol hill are voicing increasingly sharp objections to any federal effort to promote red flag laws meant to keep guns away from   
"Biden, after months focused on Ukraine, makes first trip to Asia",https://www.washingtonpost.com/politics/2022/05/19/biden-japan-south-korea-trip/,2022-05-19T09:00:28Z,"The president and his foreign policy aides have been wrestling with how to help Ukraine. Now, Biden will try to reassure Asian allies that he is still committed to leading a coalition against China.","Placeholder while article actions load
For almost three months, President Biden and his top foreign policy aides have been immersed in the Russian war in Ukraine, wrestling with how to punish Moscow… [+7480 chars]",biden  after months focused on ukraine  makes first trip to asia the president and his foreign policy aides have been wrestling with how to help ukraine  now  biden will try to reassure asian allies that he is still committed to leading a coalition against china    for almost three months  president biden and his top foreign policy aides have been immersed in the russian war in ukraine  wrestling with how to punish moscow  
Michigan gubernatorial candidate arrested on Jan. 6 Capitol riot charge,https://www.washingtonpost.com/national-security/2022/06/09/ryan-kelley-arrested-michigan-jan-6/,2022-06-09T17:05:20Z,"An outspoken Trump supporter who has focused his campaign on false claims of election fraud, Kelley allegedly waved on the mob headed into Capitol and tore inauguration-stage scaffolding.","Placeholder while article actions load
Michigan Republican gubernatorial candidate Ryan D. Kelly was arrested Thursday on misdemeanor charges of participating in the Jan. 6, 2021, siege of the Capit… [+6909 chars]",michigan gubernatorial candidate arrested on jan  6 capitol riot charge an outspoken trump supporter who has focused his campaign on false claims of election fraud  kelley allegedly waved on the mob headed into capitol and tore inauguration stage scaffolding    michigan republican gubernatorial candidate ryan d  kelly was arrested thursday on misdemeanor charges of participating in the jan  6  2021  siege of the capit  
