title,url,date_published,snippet,body,text
Soaring inflation and $6.30 gas spur relief checks in California,https://www.washingtonpost.com/business/2022/06/28/california-inflation-relief-gas-prices/,2022-06-28 19:06:47+00:00,"The California measure is a response to high gas prices and inflation, Democratic lawmakers say.","Placeholder while article actions load
Nearly 23 million residents of California, which has the nations highest average gas prices, may soon receive inflation relief checks to help address soaring c… [+6429 chars]",soaring inflation and 6 30 gas spur relief checks in california the california measure is a response to high gas prices and inflation democratic lawmakers say nearly 23 million residents of california which has the nations highest average gas prices may soon receive inflation relief checks to help address soaring c
Biden to urge Congress to suspend federal gas tax for 3 months,https://www.washingtonpost.com/politics/2022/06/22/biden-gas-tax-holiday/,2022-06-22 09:00:00+00:00,Biden will urge Congress Wednesday to suspend the federal gas tax. He is also calling on states to suspend their gas taxes.,"Placeholder while article actions load
President Biden will urge Congress on Wednesday to suspend the federal gas tax of 18.3 cents per gallon for three months, marking the latest White House effort… [+7277 chars]",biden to urge congress to suspend federal gas tax for 3 months biden will urge congress wednesday to suspend the federal gas tax he is also calling on states to suspend their gas taxes president biden will urge congress on wednesday to suspend the federal gas tax of 18 3 cents per gallon for three months marking the latest white house effort
The U.S.-Russia conflict is heating up — in cyberspace,https://www.washingtonpost.com/opinions/2022/06/07/us-russia-conflict-is-heating-up-cyberspace/,2022-06-07 21:50:48+00:00,The internet confrontation is a microcosm of Russia’s larger standoff with the West.,"Placeholder while article actions load
As the war in Ukraine rages, a long-standing battle between Russia and the United States over cyberspace is also heating up, with a top Russian diplomat warnin… [+5136 chars]",the u s russia conflict is heating up in cyberspace the internet confrontation is a microcosm of russia s larger standoff with the west as the war in ukraine rages a long standing battle between russia and the united states over cyberspace is also heating up with a top russian diplomat warnin
"NATO is united on Ukraine. Good, but plenty could still go wrong.",https://www.washingtonpost.com/opinions/2022/06/29/nato-summit-madrid-ukraine-biden-weapons/,2022-06-29 21:17:04+00:00,"Slow weapons delivery to Ukraine, political fatigue among allies and unwise provocations could shift the advantage to Russia.","Placeholder while article actions load
Brussels NATO solidarity was on display at a summit meeting this week in Madrid. One after another, officials pledged to stay the course and combat Russian Pre… [+4795 chars]",nato is united on ukraine good but plenty could still go wrong slow weapons delivery to ukraine political fatigue among allies and unwise provocations could shift the advantage to russia brussels nato solidarity was on display at a summit meeting this week in madrid one after another officials pledged to stay the course and combat russian pre
"In Ukraine, is the balance tipping in Moscow’s favor? Not yet.",https://www.washingtonpost.com/opinions/2022/06/14/ukraine-weapons-russia-eastern-ukraine/,2022-06-14 21:43:51+00:00,"Ukraine says it needs more heavy weapons, fast. But Russia has its own challenges, and U.S. officials say fears that Russia is winning are overblown.","Placeholder while article actions load
Russian military advances in eastern Ukraine this month have raised growing concern in the West that the balance of the war is tipping in Moscows favor. But Bi… [+5034 chars]",in ukraine is the balance tipping in moscow s favor not yet ukraine says it needs more heavy weapons fast but russia has its own challenges and u s officials say fears that russia is winning are overblown russian military advances in eastern ukraine this month have raised growing concern in the west that the balance of the war is tipping in moscows favor but bi
Analysis | Hopes of Russian help on ransomware are officially dead - The Washington Post,https://www.washingtonpost.com/politics/2022/06/01/hopes-russian-help-ransomware-are-officially-dead/,2022-06-01 12:12:00+00:00,Moscow signaled a chance for cooperation but reversed course.,"Placeholder while article actions load
Welcome to The Cybersecurity 202! It seems like Portland, Ore.-based author Nancy Crampton Brophy who was recently convicted of murdering her husband did herse… [+12061 chars]",analysis hopes of russian help on ransomware are officially dead moscow signaled a chance for cooperation but reversed course welcome to the cybersecurity 202 it seems like portland ore based author nancy crampton brophy who was recently convicted of murdering her husband did herse
Elevated cyber threats are the 'new normal' - The Washington Post,https://www.washingtonpost.com/politics/2022/06/07/elevated-cyber-threats-are-new-normal/,2022-06-07 15:05:00+00:00,"We’ll be facing major threats for the ‘foreseeable future,’ cyber officials say","Placeholder while article actions load
Welcome to The Cybersecurity 202!Judd Apatows George Carlin documentary on HBO is a triumph and a great history lesson. I highly recommend it. Heres one of Car… [+11372 chars]",elevated cyber threats are the new normal we will be facing major threats for the foreseeable future cyber officials say welcome to the cybersecurity 202 judd apatows george carlin documentary on hbo is a triumph and a great history lesson i highly recommend it heres one of car
Cybersecurity's bad and it's getting worse - The Washington Post,https://www.washingtonpost.com/politics/2022/06/24/cybersecuritys-bad-its-getting-worse/,2022-06-24 12:20:00+00:00,Three big takeaways from eight years on the cyber beat.,"Placeholder while article actions load
Welcome to The Cybersecurity 202! This is my last newsletter after three-and-a-half years as author of The Cybersecurity 202. Its been a blast!
Thank you!: To… [+12396 chars]",cybersecurity s bad and it is getting worse three big takeaways from eight years on the cyber beat welcome to the cybersecurity 202 this is my last newsletter after three and a half years as author of the cybersecurity 202 its been a blast thank you to
It’s time to start thinking about the endgame in Ukraine,https://www.washingtonpost.com/opinions/2022/06/16/ukraine-war-endgame-russia-europe-us-goals/,2022-06-16 21:52:32+00:00,Both Ukraine and its Western friends need to formulate war goals.,"Placeholder while article actions load
In 1942, Winston Churchill tried to ready the British people for a long conflict. This is not the end, he said, referring to the Allied victory in Egypt. It is… [+4987 chars]",it is time to start thinking about the endgame in ukraine both ukraine and its western friends need to formulate war goals in 1942 winston churchill tried to ready the british people for a long conflict this is not the end he said referring to the allied victory in egypt it is
The best China strategy? Defeat Russia.,https://www.washingtonpost.com/opinions/2022/06/09/biden-administration-defeat-russia-contain-china-ukraine-war/,2022-06-09 22:47:04+00:00,Putin’s Russia is the world’s great spoiler.,"Placeholder while article actions load
We are now living in a totally new era, said the 99-year old Henry Kissinger, commenting on Russias invasion of Ukraine. In an op-ed last week, President Biden… [+4886 chars]",the best china strategy defeat russia putin s russia is the world s great spoiler we are now living in a totally new era said the 99 year old henry kissinger commenting on russias invasion of ukraine in an op ed last week president biden
"In Africa, Eastern Europe battles Russian narrative on Ukraine",https://www.washingtonpost.com/national-security/2022/06/25/africa-hunger-ukraine-grain-russia/,2022-06-25 09:00:13+00:00,Russia has convinced some African nations that sanctions are causing the global food crisis. Eastern European countries are trying to change that narrative.,"Placeholder while article actions load
With fears growing of a severe food crisis sparked by the war in Ukraine, Kyiv and its Eastern European allies are opening a new front in their battle to build… [+7950 chars]",in africa eastern europe battles russian narrative on ukraine russia has convinced some african nations that sanctions are causing the global food crisis eastern european countries are trying to change that narrative with fears growing of a severe food crisis sparked by the war in ukraine kyiv and its eastern european allies are opening a new front in their battle to build
Russia threatens Lithuania for enforcing E.U. sanctions on Kaliningrad,https://www.washingtonpost.com/world/2022/06/21/kaliningrad-lithuania-russia-reaction/,2022-06-21 14:01:24+00:00,"Russia said there would be ""serious"" consequences after Lithuania banned sanctioned goods from passing through to Moscow's exclave of Kaliningrad.","Placeholder while article actions load
Moscow warned Tuesday that Lithuania would face serious consequences for barring the transit of E.U.-sanctioned goods through its territory to the Russian excl… [+2949 chars]",russia threatens lithuania for enforcing e u sanctions on kaliningrad russia said there would be serious consequences after lithuania banned sanctioned goods from passing through to moscow s exclave of kaliningrad moscow warned tuesday that lithuania would face serious consequences for barring the transit of e u sanctioned goods through its territory to the russian excl
"How Kaliningrad, Russian territory surrounded by NATO, is tangled in the Ukraine war",https://www.washingtonpost.com/world/2022/06/21/kaliningrad-lithuania-eu-blockade-russia-nato/,2022-06-21 07:56:50+00:00,"Lithuania is enforcing sanctions on goods shipped to Kaliningrad, which is surrounded by NATO members and physically separated from the rest of Russia.","The Russian exclave of Kaliningrad, located hundreds of miles west of the rest of the country, is the latest flash pointbetween Moscow and the rest of Europe as the fallout from Russian President Vla… [+687 chars]",how kaliningrad russian territory surrounded by nato is tangled in the ukraine war lithuania is enforcing sanctions on goods shipped to kaliningrad which is surrounded by nato members and physically separated from the rest of russia the russian exclave of kaliningrad located hundreds of miles west of the rest of the country is the latest flash pointbetween moscow and the rest of europe as the fallout from russian president vla
Hacked Russian radio station broadcasts Ukrainian anthem,https://www.washingtonpost.com/world/2022/06/09/russia-radio-station-hacked-ukraine-anthem-kommersant/,2022-06-09 07:45:19+00:00,Russian radio station Kommersant FM's news bulletin was interrupted by the Ukrainian anthem and antiwar songs.,"Placeholder while article actions load
A Russian radio stations news bulletin was interrupted Wednesday by Ukrainian anthems and antiwar songs, in the latest example of Russian media outlets apparen… [+2266 chars]",hacked russian radio station broadcasts ukrainian anthem russian radio station kommersant fm s news bulletin was interrupted by the ukrainian anthem and antiwar songs a russian radio stations news bulletin was interrupted wednesday by ukrainian anthems and antiwar songs in the latest example of russian media outlets apparen
"Putin thinks West will blink first in war of attrition, Russian elites say",https://www.washingtonpost.com/world/2022/06/03/russia-putin-economy-attrition-war/,2022-06-03 07:00:20+00:00,The Kremlin is seeking to ramp up economic pressure to erode foreign support for Ukraine.,"Placeholder while article actions load
Russian President Vladimir Putin is digging in for a long war of attrition over Ukraine and will be relentless in trying to use economic weapons, such as a blo… [+7864 chars]",putin thinks west will blink first in war of attrition russian elites say the kremlin is seeking to ramp up economic pressure to erode foreign support for ukraine russian president vladimir putin is digging in for a long war of attrition over ukraine and will be relentless in trying to use economic weapons such as a blo
"Beijing chafes at Moscow's requests for support, Chinese officials say",https://www.washingtonpost.com/national-security/2022/06/02/china-support-russia-ukraine/,2022-06-02 21:58:17+00:00,"Moscow has on at least two occasions pressed Beijing to offer new forms of economic support — exchanges that one Chinese official described as “tense.«  Officials declined to share specifics of Russia’s requests, but one official said it included maintaining …","Placeholder while article actions load
Russian officials have raised increasingly frustrated requests for greater support during discussions with Beijing in recent weeks, calling on China to live up… [+9869 chars]",beijing chafes at moscow s requests for support chinese officials say moscow has on at least two occasions pressed beijing to offer new forms of economic support exchanges that one chinese official described as tense officials declined to share specifics of russia s requests but one official said it included maintaining russian officials have raised increasingly frustrated requests for greater support during discussions with beijing in recent weeks calling on china to live up
"China on wrong side of history for backing Russian interests amid war, U.S. warns",https://www.washingtonpost.com/world/2022/06/16/china-xi-jinping-putin-russia-sovereignty-ukraine/,2022-06-16 07:15:19+00:00,"In a call with Putin, Xi said China and Russia support each other's ""core interests concerning sovereignty and security.”","Placeholder while article actions load
Chinese President Xi Jinping declared his support for Russias sovereignty and security during a Wednesday phone call with Vladimir Putin, prompting a swift U.S… [+3096 chars]",china on wrong side of history for backing russian interests amid war u s warns in a call with putin xi said china and russia support each other s core interests concerning sovereignty and security chinese president xi jinping declared his support for russias sovereignty and security during a wednesday phone call with vladimir putin prompting a swift u s
De-arched former Moscow McDonald's reopens without Big Macs,https://www.washingtonpost.com/world/2022/06/12/mcdonalds-moscow-reopen/,2022-06-12 16:55:32+00:00,The new name translates roughly from Russian as « tasty and that's it. »,"Placeholder while article actions load
There are no arches, golden or otherwise, in the ersatz McDonalds that opened Sunday in Moscow. The familiar red and yellow colors are nowhere to be found. Mis… [+6394 chars]",de arched former moscow mcdonald s reopens without big macs the new name translates roughly from russian as tasty and that is it there are no arches golden or otherwise in the ersatz mcdonalds that opened sunday in moscow the familiar red and yellow colors are nowhere to be found mis
"Last month, China imported more Russian crude oil than ever before",https://www.washingtonpost.com/world/2022/06/20/china-russia-oil-exports/,2022-06-20 09:43:42+00:00,"Over the first 100 days of the war, China has become the world's leading buyer of Russian fossil fuels, as many Western nations cut back on Russian oil and gas.","Placeholder while article actions load
Chinas imports of Russia crude oil hit a record of 8.42 million metric tons in May, as Chinese buyers take advantage of discounted prices as part of Beijings p… [+3313 chars]",last month china imported more russian crude oil than ever before over the first 100 days of the war china has become the world s leading buyer of russian fossil fuels as many western nations cut back on russian oil and gas chinas imports of russia crude oil hit a record of 8 42 million metric tons in may as chinese buyers take advantage of discounted prices as part of beijings p
"Russia-Ukraine war live updates: Ukraine marks 100 days of war, under bombardment and on the counterattack",https://www.washingtonpost.com/world/2022/06/03/russia-ukraine-war-news-putin-live-updates/,2022-06-03 06:01:00+00:00,Ukraine’s Zelensky called areas under Russian control a « zone of total catastrophe » and said the military situation in Severodonetsk was dire.,"The Russian Defense Ministry said Thursday that grain can be exported from Ukraines ports in the Black Sea using humanitarian corridors, amid concerns that a Russian blockade could threaten the globa… [+1711 chars]",russia ukraine war live updates ukraine marks 100 days of war under bombardment and on the counterattack ukraine s zelensky called areas under russian control a zone of total catastrophe and said the military situation in severodonetsk was dire the russian defense ministry said thursday that grain can be exported from ukraines ports in the black sea using humanitarian corridors amid concerns that a russian blockade could threaten the globa
"As businesses flee Russia, a New York model returns to Moscow",https://www.washingtonpost.com/national-security/2022/06/21/russia-model-dikhtyar/,2022-06-21 09:00:00+00:00,Kira Dikhtyar returned to Moscow this spring to launch a new clothing line in Russia while declaring her support for Russian President Vladimir Putin.,"Placeholder while article actions load
As Western businesses fled Russia following Moscows invasion of Ukraine, Kira Dikhtyar, a 33-year-old model in New York City, traveled in the opposite directio… [+9143 chars]",as businesses flee russia a new york model returns to moscow kira dikhtyar returned to moscow this spring to launch a new clothing line in russia while declaring her support for russian president vladimir putin as western businesses fled russia following moscows invasion of ukraine kira dikhtyar a 33 year old model in new york city traveled in the opposite directio
G-7 leaders seek price cap on Russian oil to 'starve' Putin's war effort,https://www.washingtonpost.com/world/2022/06/27/g7-biden-russian-oil-price-cap/,2022-06-27 08:23:04+00:00,"Tensions have emerged between Group of Seven leaders, as French President Emmanuel Macron has argued that any price cap should include gas.","Placeholder while article actions load
TELFS, Austria President Biden and his Group of Seven counterparts plan to unveil additional economic measures Monday to pressure Russia to end its war in Ukra… [+3033 chars]",g 7 leaders seek price cap on russian oil to starve putin s war effort tensions have emerged between group of seven leaders as french president emmanuel macron has argued that any price cap should include gas telfs austria president biden and his group of seven counterparts plan to unveil additional economic measures monday to pressure russia to end its war in ukra
"Russian missiles hit Kyiv, shattering the capital's relative calm",https://www.washingtonpost.com/world/2022/06/26/ukraine-kyiv-blasts-playground/,2022-06-26 21:46:42+00:00,"The Sunday blasts hit a kindergarten playground and residential building in Kyiv, killing at least one — as Group of Seven nations leaders met in Germany for a summit.","Placeholder while article actions load
KYIV A series of strikes hit Kyiv early Sunday, shattering a sense of relative calm since Russias withdrawal from the capital in early April, as the Group of S… [+3595 chars]",russian missiles hit kyiv shattering the capital s relative calm the sunday blasts hit a kindergarten playground and residential building in kyiv killing at least one as group of seven nations leaders met in germany for a summit kyiv a series of strikes hit kyiv early sunday shattering a sense of relative calm since russias withdrawal from the capital in early april as the group of s
"Russia-Ukraine war live updates: Ukraine claws back part of Severodonetsk, but Putin shows no sign of slowing",https://www.washingtonpost.com/world/2022/06/04/russia-ukraine-war-putin-news-live-updates/,2022-06-04 06:01:40+00:00,Ukraine also rejected a British intelligence forecast that Russia could control the Luhansk region in two weeks.,"Russian President Vladimir Putin is digging in for a long war of attrition over Ukraine and will be relentless in trying to use economic weapons, such as a blockade of Ukrainian grain exports, to whi… [+801 chars]",russia ukraine war live updates ukraine claws back part of severodonetsk but putin shows no sign of slowing ukraine also rejected a british intelligence forecast that russia could control the luhansk region in two weeks russian president vladimir putin is digging in for a long war of attrition over ukraine and will be relentless in trying to use economic weapons such as a blockade of ukrainian grain exports to whi
U.S. probing how American electronics wound up in Russian military gear,https://www.washingtonpost.com/world/2022/06/15/us-computer-chips-russian-military/,2022-06-15 22:55:16+00:00,Agents from the FBI and the Commerce Department are conducting joint visits to tech companies whose components have been found in abandoned weapons systems in Ukraine.,"Placeholder while article actions load
Federal agents have begun questioning U.S. technology companies on how their computer chips ended up in Russian military equipment recovered in Ukraine.
Comme… [+8595 chars]",u s probing how american electronics wound up in russian military gear agents from the fbi and the commerce department are conducting joint visits to tech companies whose components have been found in abandoned weapons systems in ukraine federal agents have begun questioning u s technology companies on how their computer chips ended up in russian military equipment recovered in ukraine comme
The diplomatic war over Ukrainian grain exports heats up,https://www.washingtonpost.com/world/2022/06/07/grain-export-blockade-russia-ukraine-africa/,2022-06-07 04:01:50+00:00,"Foreign governments are struggling for options to release Ukraine's immense supply of agricultural products, particularly wheat.","Placeholder while article actions load
Youre reading an excerpt from the Todays WorldView newsletter. Sign up to get the rest free, including news from around the globe, interesting ideas and opinio… [+6458 chars]",the diplomatic war over ukrainian grain exports heats up foreign governments are struggling for options to release ukraine s immense supply of agricultural products particularly wheat youre reading an excerpt from the todays worldview newsletter sign up to get the rest free including news from around the globe interesting ideas and opinio
Fiji court lets U.S. seize Russian oligarch's $300 million superyacht,https://www.washingtonpost.com/world/2022/06/08/fiji-yacht-russian-oligarch-suleyman-kerimov-ukraine/,2022-06-08 07:29:30+00:00,"The Amadea, a superyacht that U.S. officials say is owned by Russian oligarch Suleyman Kerimov, is heading to the United States.","Placeholder while article actions load
The United States secured a victory in its campaign to punish Russian billionaires for the war in Ukraine when Fijis Supreme Court ruled Tuesday that a $300 mi… [+3992 chars]",fiji court lets u s seize russian oligarch s 300 million superyacht the amadea a superyacht that u s officials say is owned by russian oligarch suleyman kerimov is heading to the united states the united states secured a victory in its campaign to punish russian billionaires for the war in ukraine when fijis supreme court ruled tuesday that a 300 mi
"As prices rise, Europeans divided over how Ukraine war should end",https://www.washingtonpost.com/world/2022/06/15/ukraine-war-support-inflation-europe-poll-yougov/,2022-06-15 14:50:32+00:00,"A poll of Europeans from 10 countries suggests public attention may turn to fears about the war's wider impact, including the rising cost of living.","Placeholder while article actions load
As the war in Ukraine drags on through its fourth month, Europeans remain largely united in backing Kyiv, but they are divided over how long theyre willing to … [+5355 chars]",as prices rise europeans divided over how ukraine war should end a poll of europeans from 10 countries suggests public attention may turn to fears about the war s wider impact including the rising cost of living as the war in ukraine drags on through its fourth month europeans remain largely united in backing kyiv but they are divided over how long theyre willing to
Estonian leader urges faster help for Ukraine amid signs of war fatigue,https://www.washingtonpost.com/world/2022/06/16/estonia-kallas-ukraine-allies-aid/,2022-06-16 15:30:47+00:00,Concerns are growing that inflation will erode support for the Ukraine war among Western allies and entrench Russian gains,"Placeholder while article actions load
Ukraines allies need to accelerate their military assistance and other forms of aid before war fatigue takes hold in the West and Russia makes territorial gain… [+5358 chars]",estonian leader urges faster help for ukraine amid signs of war fatigue concerns are growing that inflation will erode support for the ukraine war among western allies and entrench russian gains ukraines allies need to accelerate their military assistance and other forms of aid before war fatigue takes hold in the west and russia makes territorial gain
