title,url,date_published,snippet,body,text
"EU sanctions should include Russian gas embargo, says Ukraine official - Reuters",https://www.reuters.com/world/europe/eu-sanctions-should-include-russian-gas-embargo-says-ukraine-official-2022-06-26/,2022-06-26 11:17:00+00:00,"The latest missile strikes by Russia on Kyiv show that international sanctions should be more aggressive and include an EU embargo on Russian gas, the Ukraine president's chief of staff said on Sunday.","KYIV, June 26 (Reuters) - The latest missile strikes by Russia on Kyiv show that international sanctions should be more aggressive and include an EU embargo on Russian gas, the Ukraine president's ch… [+505 chars]",eu sanctions should include russian gas embargo says ukraine official the latest missile strikes by russia on kyiv show that international sanctions should be more aggressive and include an eu embargo on russian gas the ukraine president s chief of staff said on sunday kyiv june 26 the latest missile strikes by russia on kyiv show that international sanctions should be more aggressive and include an eu embargo on russian gas the ukraine president s ch
Russian bank VTB says sanctions stalling effort to hire U.S. lawyers - Reuters,https://www.reuters.com/legal/legalindustry/russian-bank-vtb-says-sanctions-stalling-effort-hire-us-lawyers-2022-06-16/,2022-06-16 18:50:00+00:00,Lawyers who are set to take over the defense of Russia's VTB Bank in a Manhattan federal court lawsuit say U.S. sanctions are preventing them from getting to work and getting paid.,"(Reuters) - Lawyers who are set to take over the defense of Russia's VTB Bank in a Manhattan federal court lawsuit say U.S. sanctions are preventing them from getting to work and getting paid.
Marc … [+2493 chars]",russian bank vtb says sanctions stalling effort to hire u s lawyers lawyers who are set to take over the defense of russia s vtb bank in a manhattan federal court lawsuit say u s sanctions are preventing them from getting to work and getting paid lawyers who are set to take over the defense of russia s vtb bank in a manhattan federal court lawsuit say u s sanctions are preventing them from getting to work and getting paid marc
"Biden, G7 leaders to agree on import ban on Russian gold - source - Reuters.com",https://www.reuters.com/world/biden-g7-leaders-agree-import-ban-russian-gold-source-2022-06-25/,2022-06-25 17:03:00+00:00,"U.S. President Joe Biden and his G7 counterparts will agree on an import ban on new gold from Russia as they broaden sanctions against Moscow for its war against Ukraine, a source familiar with the matter told Reuters on Saturday.","WASHINGTON, June 25 (Reuters) - U.S. President Joe Biden and his G7 counterparts will agree on an import ban on new gold from Russia as they broaden sanctions against Moscow for its war against Ukrai… [+674 chars]",biden g7 leaders to agree on import ban on russian gold source u s president joe biden and his g7 counterparts will agree on an import ban on new gold from russia as they broaden sanctions against moscow for its war against ukraine a source familiar with the matter told on saturday washington june 25 u s president joe biden and his g7 counterparts will agree on an import ban on new gold from russia as they broaden sanctions against moscow for its war against ukrai
"Russian diesel exports to Europe drop in May, but yet to nosedive - Reuters",https://www.reuters.com/business/energy/russian-diesel-exports-europe-drop-may-yet-nosedive-2022-05-31/,2022-05-31 12:00:00+00:00,"Russian diesel exports to Europe declined by 8% in May from the previous month to their lowest since October 2020, data showed, as traders slowly reduce purchases from Russia in response to tightening sanctions on Moscow.","LONDON, May 31 (Reuters) - Russian diesel exports to Europe declined by 8% in May from the previous month to their lowest since October 2020, data showed, as traders slowly reduce purchases from Russ… [+1754 chars]",russian diesel exports to europe drop in may but yet to nosedive russian diesel exports to europe declined by 8 in may from the previous month to their lowest since october 2020 data showed as traders slowly reduce purchases from russia in response to tightening sanctions on moscow london may 31 russian diesel exports to europe declined by 8 in may from the previous month to their lowest since october 2020 data showed as traders slowly reduce purchases from russ
Russian rouble weakens past 63 vs dollar after EU sanctions - Reuters,https://www.reuters.com/markets/currencies/russian-rouble-weakens-past-63-vs-dollar-after-eu-sanctions-2022-05-31/,2022-05-31 09:03:00+00:00,The Russian rouble firmed past 61 against the dollar on Tuesday but soon slipped back towards 64 as capital controls provided support and concerns about new European sanctions dragged the market lower.,May 31 (Reuters) - The Russian rouble firmed past 61 against the dollar on Tuesday but soon slipped back towards 64 as capital controls provided support and concerns about new European sanctions drag… [+1734 chars],russian rouble weakens past 63 vs dollar after eu sanctions the russian rouble firmed past 61 against the dollar on tuesday but soon slipped back towards 64 as capital controls provided support and concerns about new european sanctions dragged the market lower may 31 the russian rouble firmed past 61 against the dollar on tuesday but soon slipped back towards 64 as capital controls provided support and concerns about new european sanctions drag
"Time is running out for Russia, German economy minister says - Reuters",https://www.reuters.com/world/europe/time-is-running-out-russia-german-economy-minister-says-2022-06-02/,2022-06-02 10:33:00+00:00,"Germany must work harder to reduce its energy-dependence on Russia but Western sanctions in response to Moscow's invasion of Ukraine are still taking a heavy toll on the Russian war machine, German Economy Minister Robert Habeck said on Thursday.","BERLIN, June 2 (Reuters) - Germany must work harder to reduce its energy-dependence on Russia but Western sanctions in response to Moscow's invasion of Ukraine are still taking a heavy toll on the Ru… [+979 chars]",time is running out for russia german economy minister says germany must work harder to reduce its energy dependence on russia but western sanctions in response to moscow s invasion of ukraine are still taking a heavy toll on the russian war machine german economy minister robert habeck said on thursday berlin june 2 germany must work harder to reduce its energy dependence on russia but western sanctions in response to moscow s invasion of ukraine are still taking a heavy toll on the ru
"Kremlin says Putin, Xi agreed to boost ties in energy, finance - Reuters.com",https://www.reuters.com/world/europe/kremlin-says-putin-xi-agreed-boost-ties-energy-finance-2022-06-15/,2022-06-15 13:31:00+00:00,"Russian President Vladimir Putin agreed in a phone call with his Chinese counterpart Xi Jinping to expand cooperation in energy, finance and industry as Moscow faces unprecedented Western sanctions over Ukraine, the Kremlin said on Wednesday.","June 15 (Reuters) - Russian President Vladimir Putin agreed in a phone call with his Chinese counterpart Xi Jinping to expand cooperation in energy, finance and industry as Moscow faces unprecedented… [+505 chars]",kremlin says putin xi agreed to boost ties in energy finance russian president vladimir putin agreed in a phone call with his chinese counterpart xi jinping to expand cooperation in energy finance and industry as moscow faces unprecedented western sanctions over ukraine the kremlin said on wednesday june 15 russian president vladimir putin agreed in a phone call with his chinese counterpart xi jinping to expand cooperation in energy finance and industry as moscow faces unprecedented
"UK sets out new Russia sanctions for ""barbaric treatment of children in Ukraine"" - Reuters",https://www.reuters.com/world/uk/uk-sets-out-new-russia-sanctions-barbaric-treatment-children-ukraine-2022-06-16/,2022-06-16 10:35:00+00:00,"Britain on Thursday said it had sanctioned Russian Children's Rights Commissioner Maria Lvova-Belova for the ""forced transfer and adoption of Ukrainian children"", as part of a new wave of sanctions against Russia over the Ukrainian crisis.","LONDON, June 16 (Reuters) - Britain on Thursday said it had sanctioned Russian Children's Rights Commissioner Maria Lvova-Belova for the ""forced transfer and adoption of Ukrainian children"", as part … [+622 chars]",uk sets out new russia sanctions for barbaric treatment of children in ukraine britain on thursday said it had sanctioned russian children s rights commissioner maria lvova belova for the forced transfer and adoption of ukrainian children as part of a new wave of sanctions against russia over the ukrainian crisis london june 16 britain on thursday said it had sanctioned russian children s rights commissioner maria lvova belova for the forced transfer and adoption of ukrainian children as part
"Russian region says Lithuania will curb imports, exports by rail - Reuters",https://www.reuters.com/world/europe/russian-region-says-lithuania-will-curb-imports-exports-by-rail-2022-06-17/,2022-06-17 21:49:00+00:00,"Lithuania has told the Russian region of Kaliningrad that it will block the import and export of a large number of goods by rail because of Western sanctions, the regional governor said on Friday.","June 17 (Reuters) - Lithuania has told the Russian region of Kaliningrad that it will block the import and export of a large number of goods by rail because of Western sanctions, the regional governo… [+1709 chars]",russian region says lithuania will curb imports exports by rail lithuania has told the russian region of kaliningrad that it will block the import and export of a large number of goods by rail because of western sanctions the regional governor said on friday june 17 lithuania has told the russian region of kaliningrad that it will block the import and export of a large number of goods by rail because of western sanctions the regional governo
"U.S. urges countries to reach out if having issues with Russian food, fertilizer exports - Reuters",https://www.reuters.com/world/europe/us-urges-countries-reach-out-if-having-issues-with-russian-food-fertilizer-2022-06-22/,2022-06-22 21:49:00+00:00,"Countries should ask the United States for help if they have any problems importing Russian food and fertilizer, a senior U.S. official said on Wednesday, stressing that such goods were not subject to U.S. sanctions over Moscow's war in Ukraine.","NEW YORK, June 22 (Reuters) - Countries should ask the United States for help if they have any problems importing Russian food and fertilizer, a senior U.S. official said on Wednesday, stressing that… [+2313 chars]",u s urges countries to reach out if having issues with russian food fertilizer exports countries should ask the united states for help if they have any problems importing russian food and fertilizer a senior u s official said on wednesday stressing that such goods were not subject to u s sanctions over moscow s war in ukraine new york june 22 countries should ask the united states for help if they have any problems importing russian food and fertilizer a senior u s official said on wednesday stressing that
"Latest U.S. sanctions on Russia target gold, banks, defense-related entities -Treasury website - Reuters.com",https://www.reuters.com/world/europe/latest-us-sanctions-russia-target-gold-banks-defense-related-entities-treasury-2022-06-28/,2022-06-28 14:55:00+00:00,"The United States on Tuesday imposed sanctions on over 100 targets and banned the import of new Russian gold, increasing pressure on Russia following its invasion of Ukraine in line with commitments made by the G7 this week.","WASHINGTON, June 28 (Reuters) - The United States on Tuesday imposed sanctions on over 100 targets and banned the import of new Russian gold, increasing pressure on Russia following its invasion of U… [+2368 chars]",latest u s sanctions on russia target gold banks defense related entities treasury website the united states on tuesday imposed sanctions on over 100 targets and banned the import of new russian gold increasing pressure on russia following its invasion of ukraine in line with commitments made by the g7 this week washington june 28 the united states on tuesday imposed sanctions on over 100 targets and banned the import of new russian gold increasing pressure on russia following its invasion of u
Russian service sector shrinks again in May on weak demand - PMI - Reuters,https://www.reuters.com/markets/europe/russian-service-sector-shrinks-again-may-weak-demand-pmi-2022-06-03/,2022-06-03 06:14:00+00:00,"Russia's service sector shrank for the third consecutive month in May, under pressure from the impact of Western sanctions and weak demand at home, the S&P Global purchasing managers index (PMI) showed on Friday.","June 3 (Reuters) - Russia's service sector shrank for the third consecutive month in May, under pressure from the impact of Western sanctions and weak demand at home, the S&amp;P Global purchasing ma… [+1618 chars]",russian service sector shrinks again in may on weak demand pmi russia s service sector shrank for the third consecutive month in may under pressure from the impact of western sanctions and weak demand at home the s p global purchasing managers index showed on friday june 3 russia s service sector shrank for the third consecutive month in may under pressure from the impact of western sanctions and weak demand at home the s amp p global purchasing ma
Saudi Arabia to raise oil production if Russian output falls under sanctions- FT - Reuters,https://www.reuters.com/business/energy/saudi-arabia-raise-oil-production-if-russian-output-falls-under-sanctions-ft-2022-06-02/,2022-06-02 01:35:00+00:00,"Saudi Arabia is prepared to raise its oil production if Russia's output falls substantially because of the western sanctions imposed on it, the Financial Times reported on Wednesday, citing sources.","June 1 (Reuters) - Saudi Arabia is prepared to raise its oil production if Russia's output falls substantially because of the western sanctions imposed on it, the Financial Times reported on Wednesda… [+1243 chars]",saudi arabia to raise oil production if russian output falls under sanctions ft saudi arabia is prepared to raise its oil production if russia s output falls substantially because of the western sanctions imposed on it the financial times reported on wednesday citing sources june 1 saudi arabia is prepared to raise its oil production if russia s output falls substantially because of the western sanctions imposed on it the financial times reported on wednesda
Germany faces 5 bln euros a year hit from Russian gas sanctions -newspaper - Reuters.com,https://www.reuters.com/business/energy/germany-faces-5-bln-euros-year-hit-russian-gas-sanctions-newspaper-2022-06-05/,2022-06-05 15:31:00+00:00,"Russia's sanctions against Gazprom Germania and its subsidiaries could cost German taxpayers and gas users an extra 5 billion euros ($5.4 billion) a year to pay for replacement gas, the Welt am Sonntag weekly reported, citing industry representatives.","BERLIN, June 5 (Reuters) - Russia's sanctions against Gazprom Germania and its subsidiaries could cost German taxpayers and gas users an extra 5 billion euros ($5.4 billion) a year to pay for replace… [+1550 chars]",germany faces 5 bln euros a year hit from russian gas sanctions newspaper russia s sanctions against gazprom germania and its subsidiaries could cost german taxpayers and gas users an extra 5 billion euros a year to pay for replacement gas the welt am sonntag weekly reported citing industry representatives berlin june 5 russia s sanctions against gazprom germania and its subsidiaries could cost german taxpayers and gas users an extra 5 billion euros a year to pay for replace
EXCLUSIVE Kazakhstan renames its export oil to avoid Russia sanctions risk - Reuters,https://www.reuters.com/business/energy/exclusive-kazakhstan-renames-its-export-oil-avoid-russia-sanctions-risk-2022-06-03/,2022-06-03 14:06:00+00:00,Kazakhstan is changing the name of the oil it exports via Russian sea ports to Kazakhstan Export Blend Crude Oil (KEBCO) to dissociate it from oil originating in Russia in order to avoid sanction risks and issues with financing.,June 3 (Reuters) - Kazakhstan is changing the name of the oil it exports via Russian sea ports to Kazakhstan Export Blend Crude Oil (KEBCO) to dissociate it from oil originating in Russia in order to… [+2210 chars],exclusive kazakhstan renames its export oil to avoid russia sanctions risk kazakhstan is changing the name of the oil it exports via russian sea ports to kazakhstan export blend crude oil to dissociate it from oil originating in russia in order to avoid sanction risks and issues with financing june 3 kazakhstan is changing the name of the oil it exports via russian sea ports to kazakhstan export blend crude oil to dissociate it from oil originating in russia in order to
Sanctions-hit Kremlin to stage annual 'Russian Davos' bereft of financial elite - Reuters.com,https://www.reuters.com/world/europe/sanctions-hit-kremlin-stage-annual-russian-davos-bereft-financial-elite-2022-06-14/,2022-06-14 15:26:00+00:00,"Russia for years hosted world leaders and business titans at its annual economic forum in St Petersburg, but the ""Russian Davos"" will see little of the global financial elite this time around with Moscow isolated by sanctions over its actions in Ukraine.","June 14 (Reuters) - Russia for years hosted world leaders and business titans at its annual economic forum in St Petersburg, but the ""Russian Davos"" will see little of the global financial elite this… [+5240 chars]",sanctions hit kremlin to stage annual russian davos bereft of financial elite russia for years hosted world leaders and business titans at its annual economic forum in st petersburg but the russian davos will see little of the global financial elite this time around with moscow isolated by sanctions over its actions in ukraine june 14 russia for years hosted world leaders and business titans at its annual economic forum in st petersburg but the russian davos will see little of the global financial elite this
U.S. Treasury says all buying of Russian debt and equity banned under sanctions - Reuters.com,https://www.reuters.com/markets/us/us-treasury-says-all-buying-russian-debt-equity-banned-under-sanctions-2022-06-07/,2022-06-07 15:07:00+00:00,"The U.S. Treasury Department has advised U.S. money managers that Washington's sanctions on Moscow bar any secondary market purchases of debt or stocks belonging to Russia's government and firms, not just newly issued, further tightening curbs on the country …","WASHINGTON/LONDON, June 7 (Reuters) - The U.S. Treasury Department has advised U.S. money managers that Washington's sanctions on Moscow bar any secondary market purchases of debt or stocks belonging… [+1925 chars]",u s treasury says all buying of russian debt and equity banned under sanctions the u s treasury department has advised u s money managers that washington s sanctions on moscow bar any secondary market purchases of debt or stocks belonging to russia s government and firms not just newly issued further tightening curbs on the country washington london june 7 the u s treasury department has advised u s money managers that washington s sanctions on moscow bar any secondary market purchases of debt or stocks belonging
"EU unity on Russian sanctions 'starting to crumble', German minister says - Reuters.com",https://www.reuters.com/world/europe/eu-unity-russian-sanctions-starting-crumble-german-minister-says-2022-05-29/,2022-05-29 16:10:00+00:00,"German Economy Minister Robert Habeck on Sunday expressed fears that the European Union's unity was ""starting to crumble"" ahead of a summit to discuss an oil embargo against Russia and plans to cut dependence on Russian energy.","BERLIN, May 29 (Reuters) - German Economy Minister Robert Habeck on Sunday expressed fears that the European Union's unity was ""starting to crumble"" ahead of a summit to discuss an oil embargo agains… [+1381 chars]",eu unity on russian sanctions starting to crumble german minister says german economy minister robert habeck on sunday expressed fears that the european union s unity was starting to crumble ahead of a summit to discuss an oil embargo against russia and plans to cut dependence on russian energy berlin may 29 german economy minister robert habeck on sunday expressed fears that the european union s unity was starting to crumble ahead of a summit to discuss an oil embargo agains
EU blacklists wife of Russian billionaire Melnichenko to curb bypassing sanctions - Reuters,https://www.reuters.com/world/europe/eu-blacklists-wife-russian-billionaire-melnichenko-curb-bypassing-sanctions-2022-06-03/,2022-06-03 17:02:00+00:00,"The European Union on Friday blacklisted Aleksandra Melnichenko, the wife of Andrey Melnichenko, a previously sanctioned Russian billionaire who Reuters revealed had reassigned his companies to her in a bid to contain the business damage.","BRUSSELS, June 3 (Reuters) - The European Union on Friday blacklisted Aleksandra Melnichenko, the wife of Andrey Melnichenko, a previously sanctioned Russian billionaire who Reuters revealed had reas… [+1828 chars]",eu blacklists wife of russian billionaire melnichenko to curb bypassing sanctions the european union on friday blacklisted aleksandra melnichenko the wife of andrey melnichenko a previously sanctioned russian billionaire who revealed had reassigned his companies to her in a bid to contain the business damage brussels june 3 the european union on friday blacklisted aleksandra melnichenko the wife of andrey melnichenko a previously sanctioned russian billionaire who revealed had reas
Swiss lower house backs power to independently impose sanctions - Reuters.com,https://www.reuters.com/world/europe/swiss-lower-house-backs-power-independently-impose-sanctions-2022-06-09/,2022-06-09 14:59:00+00:00,Switzerland's lower house on Thursday backed legal changes that will allow the usually neutral country to impose sanctions independently of other nations or international groups on people or entities that have violated international humanitarian law.,"ZURICH, June 9 (Reuters) - Switzerland's lower house on Thursday backed legal changes that will allow the usually neutral country to impose sanctions independently of other nations or international g… [+1936 chars]",swiss lower house backs power to independently impose sanctions switzerland s lower house on thursday backed legal changes that will allow the usually neutral country to impose sanctions independently of other nations or international groups on people or entities that have violated international humanitarian law zurich june 9 switzerland s lower house on thursday backed legal changes that will allow the usually neutral country to impose sanctions independently of other nations or international g
"Russia, Turkey agree to more consultations on grain exports from Ukraine - Reuters",https://www.reuters.com/world/russia-turkey-agree-more-consultations-grain-exports-ukraine-2022-06-22/,2022-06-22 09:36:00+00:00,"Russian and Turkish delegations have agreed to continue consultations on safe vessel departures and grain exports from Ukrainian ports, the Russian defence ministry said on Wednesday.","June 22 (Reuters) - Russian and Turkish delegations have agreed to continue consultations on safe vessel departures and grain exports from Ukrainian ports, the Russian defence ministry said on Wednes… [+438 chars]",russia turkey agree to more consultations on grain exports from ukraine russian and turkish delegations have agreed to continue consultations on safe vessel departures and grain exports from ukrainian ports the russian defence ministry said on wednesday june 22 russian and turkish delegations have agreed to continue consultations on safe vessel departures and grain exports from ukrainian ports the russian defence ministry said on wednes
"Canada imposes Russia-related sanctions 22 individuals, 4 entities - Reuters",https://www.reuters.com/world/europe/canada-imposes-russia-related-sanctions-22-individuals-4-entities-2022-05-31/,2022-05-31 13:27:00+00:00,Canada said Tuesday it was imposing new sanctions on Russia and putting restrictions on 22 individuals and four entities in response to Moscow's invasion of Ukraine.,"OTTAWA, May 31 (Reuters) - Canada said Tuesday it was imposing new sanctions on Russia and putting restrictions on 22 individuals and four entities in response to Moscow's invasion of Ukraine.
The r… [+552 chars]",canada imposes russia related sanctions 22 individuals 4 entities canada said tuesday it was imposing new sanctions on russia and putting restrictions on 22 individuals and four entities in response to moscow s invasion of ukraine ottawa may 31 canada said tuesday it was imposing new sanctions on russia and putting restrictions on 22 individuals and four entities in response to moscow s invasion of ukraine the r
