title,url,date_published,snippet,body,text
What the ban on Russian gold imports means for its increasingly isolated economy.,https://www.nytimes.com/2022/06/27/business/russian-gold-imports-ban.html,2022-06-27 13:24:34+00:00,"The move by the United States, Britain and others builds on steps to cut Russia off from the international financial system.","Russia, one of the worlds biggest producers of gold, cranked up the mining of new gold to compensate for some of the paralyzed assets, Christopher Swift, a national security lawyer at Foley and Lardn… [+928 chars]",what the ban on russian gold imports means for its increasingly isolated economy the move by the united states britain and others builds on steps to cut russia off from the international financial system russia one of the worlds biggest producers of gold cranked up the mining of new gold to compensate for some of the paralyzed assets christopher swift a national security lawyer at foley and lardn
Biden Has ‘Only Bad Options’ for Bringing Down Oil Prices,https://www.nytimes.com/2022/06/05/business/biden-oil-saudi-arabia.html,2022-06-05 20:31:28+00:00,"The president’s trip to Saudi Arabia is unlikely to reduce oil and gasoline prices, and it is not clear that anything else he might do would work, either.",Mr. Biden and his aides have been jawboning U.S. oil executives to pump more oil with little success. Most oil companies are reluctant to expand production because they fear that drilling more now wi… [+3745 chars],biden has only bad options for bringing down oil prices the president s trip to saudi arabia is unlikely to reduce oil and gasoline prices and it is not clear that anything else he might do would work either mr biden and his aides have been jawboning u s oil executives to pump more oil with little success most oil companies are reluctant to expand production because they fear that drilling more now wi
Fossil-Fuel Shares Lead the Stock Market. How Awkward.,https://www.nytimes.com/2022/06/03/business/stock-market-energy-climate-change.html,2022-06-03 13:00:07+00:00,"If you want to make money in the market but also be a responsible citizen in a warming world, you’re in a tough spot. But there are some promising options, our columnist says.","If you are paying attention to science, this is awkward in the extreme. To cite just one recent, important report, a body of experts convened by the United Nations and known as the Intergovernmental … [+2006 chars]",fossil fuel shares lead the stock market how awkward if you want to make money in the market but also be a responsible citizen in a warming world you are in a tough spot but there are some promising options our columnist says if you are paying attention to science this is awkward in the extreme to cite just one recent important report a body of experts convened by the united nations and known as the intergovernmental
A Defiant Putin Says Russia Will Flourish Without the West,https://www.nytimes.com/2022/06/17/world/europe/putin-russia-econony-ukraine.html,2022-06-17 19:56:50+00:00,"In a speech at an economic forum, he called the U.S. a fading power and said sanctions on Russia, not the Ukraine war, are hurting Western economies.","Ukrainian officials have heatedly dismissed the legitimacy of any putative referendums organized by the Kremlin and its proxies.
Updated June 17, 2022, 3:16 p.m. ET
The chief executives of blue-chi… [+1400 chars]",a defiant putin says russia will flourish without the west in a speech at an economic forum he called the u s a fading power and said sanctions on russia not the ukraine war are hurting western economies ukrainian officials have heatedly dismissed the legitimacy of any putative referendums organized by the kremlin and its proxies updated june 17 2022 3 16 p m et the chief executives of blue chi
"In Russia Crisis, India Tries to Balance Geopolitics and Economics",https://www.nytimes.com/2022/06/28/world/asia/in-russia-crisis-india-tries-to-balance-geopolitics-and-economics.html,2022-06-28 13:12:49+00:00,"Prime Minister Narendra Modi, who attended the G7 meeting, is also trying to position India as the voice of poorer nations, arguing that sanctions hurt developing countries the most.","We are trying everything to meet the demands of residents, he added.
The West is starting to recognize that sanctions have done serious damage globally, without significantly crimping the Kremlin's … [+1453 chars]",in russia crisis india tries to balance geopolitics and economics prime minister narendra modi who attended the g7 meeting is also trying to position india as the voice of poorer nations arguing that sanctions hurt developing countries the most we are trying everything to meet the demands of residents he added the west is starting to recognize that sanctions have done serious damage globally without significantly crimping the kremlin s
Fiji Hands Over Superyacht to U.S. Says Is Tied to Russian Oligarch,https://www.nytimes.com/2022/06/07/world/europe/fiji-superyacht-russia-oligarch.html,2022-06-07 07:06:24+00:00,The handover of the Amadea is the latest development in a global effort to seize the assets of oligarchs with ties to Russia’s president.,"Fiji has handed over to the United States a $325 million superyacht that American investigators say is owned by a Russian billionaire on a U.S. sanctions list, the island nations top prosecutor said … [+899 chars]",fiji hands over superyacht to u s says is tied to russian oligarch the handover of the amadea is the latest development in a global effort to seize the assets of oligarchs with ties to russia s president fiji has handed over to the united states a 325 million superyacht that american investigators say is owned by a russian billionaire on a u s sanctions list the island nations top prosecutor said
Russia Appears Closer to Falling Into Default as Grace Period Ends,https://www.nytimes.com/2022/06/26/world/europe/default-bond.html,2022-06-27 07:18:12+00:00,"This default would be unusual because it would be a result of economic sanctions blocking transactions, not because the government has run out of money.","The risk of default emerged in late February after Russia invaded Ukraine and sanctions were imposed to sever the country from international financial markets. In late May, Russia tried to navigate t… [+1243 chars]",russia appears closer to falling into default as grace period ends this default would be unusual because it would be a result of economic sanctions blocking transactions not because the government has run out of money the risk of default emerged in late february after russia invaded ukraine and sanctions were imposed to sever the country from international financial markets in late may russia tried to navigate t
A Cap on the Price of Russian Oil Comes With Many Questions,https://www.nytimes.com/2022/06/28/world/europe/russian-oil-price-cap.html,2022-06-28 08:02:22+00:00,The idea is to limit how much Russia can earn from the oil it sells while still keeping markets well supplied.,"Leaders of the Group of 7 nations meeting in Germany, seeking a new way to throttle Russias finances while limiting the harm to Western economies, are discussing imposing a ceiling on the price paid … [+457 chars]",a cap on the price of russian oil comes with many questions the idea is to limit how much russia can earn from the oil it sells while still keeping markets well supplied leaders of the group of 7 nations meeting in germany seeking a new way to throttle russias finances while limiting the harm to western economies are discussing imposing a ceiling on the price paid
E.U. leaders plan for a painful scenario: Russia turning off the gas.,https://www.nytimes.com/2022/06/24/world/europe/russia-germany-gas-shortage.html,2022-06-24 16:57:16+00:00,"The tapering of gas has forced Germany, Europe’s economic engine, to escalate its energy emergency protocol and urge residents to conserve power. The next step is rationing.","Now its 12 member states that have either been totally cut off or partially, she added.
Ms. von der Leyen said she would ask her experts to propose an emergency plan to tackle possible shortages goi… [+1138 chars]",e u leaders plan for a painful scenario russia turning off the gas the tapering of gas has forced germany europe s economic engine to escalate its energy emergency protocol and urge residents to conserve power the next step is rationing now its 12 member states that have either been totally cut off or partially she added ms von der leyen said she would ask her experts to propose an emergency plan to tackle possible shortages goi
"Western Move to Choke Russia’s Oil Exports Boomerangs, for Now",https://www.nytimes.com/2022/06/21/world/europe/ukraine-russian-oil-embargo.html,2022-06-21 22:35:28+00:00,"With China and India buying the Russian oil shunned by the West in an effort to force an end the Ukraine invasion, Moscow is earning more now than it did before the war.","But in the short term, the United States and its Western allies had been counting on economic sanctions, not criminal prosecutions, to persuade Moscow to back down, or at least degrade its ability to… [+745 chars]",western move to choke russia s oil exports boomerangs for now with china and india buying the russian oil shunned by the west in an effort to force an end the ukraine invasion moscow is earning more now than it did before the war but in the short term the united states and its western allies had been counting on economic sanctions not criminal prosecutions to persuade moscow to back down or at least degrade its ability to
"U.S.-Led Alliance Faces Frustration, and Pain of its Own, Over Russia Sanctions",https://www.nytimes.com/2022/06/24/us/politics/russia-ukraine-biden-sanctions.html,2022-06-24 22:03:52+00:00,Vladimir V. Putin is making gains in his war on Ukraine while the United States and its allies struggle with soaring energy prices and inflation.,"Today, former Obama officials say those sanctions had a modest impact at best, although some argue they helped deter Mr. Putin from a larger invasion of Ukraine at the time.
U.S.-led sanctions on Ir… [+1726 chars]",u s led alliance faces frustration and pain of its own over russia sanctions vladimir v putin is making gains in his war on ukraine while the united states and its allies struggle with soaring energy prices and inflation today former obama officials say those sanctions had a modest impact at best although some argue they helped deter mr putin from a larger invasion of ukraine at the time u s led sanctions on ir
"A Link to Besieged Ukrainians Is Cut, as Allies Question Strategy",https://www.nytimes.com/2022/06/14/world/europe/ukraine-russia-war-sievierodonetsk.html,2022-06-14 21:41:13+00:00,"The last bridge to the city of Sievierodonetsk fell as street battles raged, and some Western officials questioned Ukraine’s ability to keep resisting the Russian onslaught.","The profession of support notwithstanding, the remarkable initial unity in response to Russias invasion seems to be fraying among the Western allies who have shipped weapons to Ukraine and imposed a … [+1499 chars]",a link to besieged ukrainians is cut as allies question strategy the last bridge to the city of sievierodonetsk fell as street battles raged and some western officials questioned ukraine s ability to keep resisting the russian onslaught the profession of support notwithstanding the remarkable initial unity in response to russias invasion seems to be fraying among the western allies who have shipped weapons to ukraine and imposed a
"Putin’s Threats Highlight the Dangers of a New, Riskier Nuclear Era",https://www.nytimes.com/2022/06/01/us/politics/nuclear-arms-treaties.html,2022-06-01 17:01:24+00:00,"After generations of stability in nuclear arms control, a warning to Russia from President Biden shows how old norms are eroding.","There are a lot of things that he would do in the context of escalation before he would get to nuclear weapons, Ms. Haines said.
The White House, the Pentagon and the intelligence agencies are exami… [+1373 chars]",putin s threats highlight the dangers of a new riskier nuclear era after generations of stability in nuclear arms control a warning to russia from president biden shows how old norms are eroding there are a lot of things that he would do in the context of escalation before he would get to nuclear weapons ms haines said the white house the pentagon and the intelligence agencies are exami
"Heading to Ukraine, the Leaders of France and Germany Face a Tense Reception",https://www.nytimes.com/2022/06/15/world/europe/ukraine-france-germany-scholz.html,2022-06-15 21:44:39+00:00,"Chancellor Olaf Scholz of Germany and President Emmanuel Macron of France have had strained relations with Ukraine’s leaders since Russia invaded, struggling to balance support for Kyiv with the rising economic costs of the war.",Formal peace talks have long stalled between Ukraine and Russia as the war has shifted to a grinding artillery battle in which Russia appears to have an edge. Many in Kyiv have come to regard Europea… [+1357 chars],heading to ukraine the leaders of france and germany face a tense reception chancellor olaf scholz of germany and president emmanuel macron of france have had strained relations with ukraine s leaders since russia invaded struggling to balance support for kyiv with the rising economic costs of the war formal peace talks have long stalled between ukraine and russia as the war has shifted to a grinding artillery battle in which russia appears to have an edge many in kyiv have come to regard europea
Ukraine Live Updates: African Union Leader to Appeal to Putin Over Food Concerns,https://www.nytimes.com/live/2022/06/03/world/russia-ukraine-war-news,2022-06-03 06:12:55+00:00,"On the 100th day of the war, Russian troops are making slow but substantial gains. The U.N. has warned that the naval blockade of Ukraine could lead to famine around the world.","DAKAR, Senegal With many of the worlds poorest countries facing alarming levels of hunger and starvation, the leader of the African Union is set to meet with President Vladimir V. Putin on Friday and… [+3210 chars]",ukraine live updates african union leader to appeal to putin over food concerns on the 100th day of the war russian troops are making slow but substantial gains the u n has warned that the naval blockade of ukraine could lead to famine around the world dakar senegal with many of the worlds poorest countries facing alarming levels of hunger and starvation the leader of the african union is set to meet with president vladimir v putin on friday and
Ukraine Live Updates: Russia Signals Harsh Sentences for Captured Americans,https://www.nytimes.com/live/2022/06/21/world/russia-ukraine-war-news,2022-06-21 07:56:00+00:00,"A Russian official said that the men are not protected by the Geneva Conventions as prisoners of war. In eastern Ukraine, U.S. officials say, Moscow is likely to end up with more territory, but neither side will gain full control of the region.","Wheat stored at a farm on the outskirts of Lviv, Ukraine, in May.Credit...Diego Ibarra Sanchez for The New York Times
The Black Sea blockade that is preventing Ukraine from exporting food and other … [+2359 chars]",ukraine live updates russia signals harsh sentences for captured americans a russian official said that the men are not protected by the geneva conventions as prisoners of war in eastern ukraine u s officials say moscow is likely to end up with more territory but neither side will gain full control of the region wheat stored at a farm on the outskirts of lviv ukraine in may credit diego ibarra sanchez for the new york times the black sea blockade that is preventing ukraine from exporting food and other
"Ukraine Live Updates: 100 Days of War Felt Like a ‘Long, Difficult Day’",https://www.nytimes.com/live/2022/06/04/world/russia-ukraine-war-news,2022-06-04 08:01:33+00:00,Kyiv’s mayor called the past few months “a time of courage and perseverance.” Analysts and officials say no end to the conflict is in sight.,"DAKAR, Senegal A meeting on Friday between the head of the African Union and President Vladimir V. Putin of Russia highlighted the acute needs each one hopes the other can fill: Africa needs food, an… [+5473 chars]",ukraine live updates 100 days of war felt like a long difficult day kyiv s mayor called the past few months a time of courage and perseverance analysts and officials say no end to the conflict is in sight dakar senegal a meeting on friday between the head of the african union and president vladimir v putin of russia highlighted the acute needs each one hopes the other can fill africa needs food an
"McDonald’s, Moscow Style, Is Back, as Russian Economy Stumbles On",https://www.nytimes.com/2022/06/10/world/europe/russia-economy-mcdonalds.html,2022-06-10 21:37:34+00:00,"The reopening of the fast-food stores under Russian ownership illustrates the economy’s surprising resilience in the face of intense sanctions, though difficult times lie ahead.","Banned from using European airspace, Aeroflot is now focusing on domestic routes and working to switch to Russian planes a process that will take years. Siemens, which built telegraph lines across th… [+1677 chars]",mcdonald s moscow style is back as russian economy stumbles on the reopening of the fast food stores under russian ownership illustrates the economy s surprising resilience in the face of intense sanctions though difficult times lie ahead banned from using european airspace aeroflot is now focusing on domestic routes and working to switch to russian planes a process that will take years siemens which built telegraph lines across th
U.S. Imposes Sanctions on Yacht Company That Caters to Russian Elites,https://www.nytimes.com/2022/06/02/us/politics/russia-oligarchs-yachts-sanctions.html,2022-06-02 14:45:43+00:00,The Treasury Department also identified four yachts as being linked to President Vladimir V. Putin of Russia.,"WASHINGTON The U.S. government leveled sanctions against a yacht management company and its owners, describing them as part of a corrupt system that allows Russian elites and President Vladimir V. Pu… [+1117 chars]",u s imposes sanctions on yacht company that caters to russian elites the treasury department also identified four yachts as being linked to president vladimir v putin of russia washington the u s government leveled sanctions against a yacht management company and its owners describing them as part of a corrupt system that allows russian elites and president vladimir v pu
Russia Threatens Lithuania Over Kaliningrad Cargo,https://www.nytimes.com/2022/06/24/world/europe/kaliningrad-russia-rail-sanctions.html,2022-06-24 16:13:11+00:00,"Russia has accused Lithuania, a NATO member, of choking off the flow of goods to Kaliningrad, its enclave on the Baltic, as part of sanctions over the war in Ukraine. Lithuania says Russia is lying.","KYBARTAI, Lithuania As war rages in Ukraine, fueling ever-growing tensions between NATO and Russia, a sleepy Baltic railway station with no passengers and few trains this week found itself at the cen… [+10739 chars]",russia threatens lithuania over kaliningrad cargo russia has accused lithuania a nato member of choking off the flow of goods to kaliningrad its enclave on the baltic as part of sanctions over the war in ukraine lithuania says russia is lying kybartai lithuania as war rages in ukraine fueling ever growing tensions between nato and russia a sleepy baltic railway station with no passengers and few trains this week found itself at the cen
Russian Elites Show No Sign of Broad Challenge to Putin,https://www.nytimes.com/2022/06/23/world/europe/russia-war-oligarchs-putin.html,2022-06-23 04:01:13+00:00,"Many business owners and intellectuals fled Russia after the invasion of Ukraine, but others stayed behind, struggling to redefine their lives. Their diverging choices do not add up to a broad challenge to Vladimir Putin’s war.","Yet what is happening in reality, interviews show, is that the mood spans a spectrum from desperation to exhilaration, but with one common denominator: the sense that the countrys future is out of th… [+1123 chars]",russian elites show no sign of broad challenge to putin many business owners and intellectuals fled russia after the invasion of ukraine but others stayed behind struggling to redefine their lives their diverging choices do not add up to a broad challenge to vladimir putin s war yet what is happening in reality interviews show is that the mood spans a spectrum from desperation to exhilaration but with one common denominator the sense that the countrys future is out of th
Ukraine Live Updates: Russia’s Economy Proves More Resilient Than Expected,https://www.nytimes.com/live/2022/06/11/world/russia-ukraine-war-news,2022-06-11 08:02:20+00:00,"Ukraine’s economy is damaged but functional. Its military is short of Western weapons, giving Russia an advantage along the eastern front.","Yevgeny Shumilkin is going back to work on Sunday. To prepare, he pulled the familiar M off what had been his McDonalds shirt and covered the M on his McDonalds jacket with a Russian flag patch.It wi… [+10129 chars]",ukraine live updates russia s economy proves more resilient than expected ukraine s economy is damaged but functional its military is short of western weapons giving russia an advantage along the eastern front yevgeny shumilkin is going back to work on sunday to prepare he pulled the familiar m off what had been his mcdonalds shirt and covered the m on his mcdonalds jacket with a russian flag patch it wi
Seizing Russian Assets to Help Ukraine Sets off White House Debate,https://www.nytimes.com/2022/05/31/us/politics/russia-sanctions-central-bank-assets.html,2022-05-31 19:52:11+00:00,Some European officials want to use more than $300 billion in Russian central bank assets to rebuild Ukraine. But Biden administration officials warn that diverting those funds could be illegal.,"I think its very natural that given the enormous destruction in Ukraine and huge rebuilding costs that they will face, that we will look to Russia to help pay at least a portion of the price that wil… [+2443 chars]",seizing russian assets to help ukraine sets off white house debate some european officials want to use more than 300 billion in russian central bank assets to rebuild ukraine but biden administration officials warn that diverting those funds could be illegal i think its very natural that given the enormous destruction in ukraine and huge rebuilding costs that they will face that we will look to russia to help pay at least a portion of the price that wil
"Russian Military Is Repeating Mistakes in Eastern Ukraine, U.S. Says",https://www.nytimes.com/2022/05/31/us/politics/russia-military-eastern-ukraine.html,2022-05-31 20:08:21+00:00,"President Vladimir V. Putin sent in a new commander in April, but Russian troops are still facing morale and other problems, American officials say.","In Ukraine, he established a more streamlined process. Russian pilots began coordinating with troops on the ground toward a similar objective in the eastern region of Donbas, and Russian units were t… [+2410 chars]",russian military is repeating mistakes in eastern ukraine u s says president vladimir v putin sent in a new commander in april but russian troops are still facing morale and other problems american officials say in ukraine he established a more streamlined process russian pilots began coordinating with troops on the ground toward a similar objective in the eastern region of donbas and russian units were t
EU Calls Russia’s Blockade of Ukranian Grain a War Crime,https://www.nytimes.com/2022/06/20/world/europe/russia-blockade-ukraine-grain.html,2022-06-20 20:51:39+00:00,"The war is contributing to global food shortages and rising prices, and the United Nations warns of possible famine. Ukraine is usually a major grain exporter.","President Volodymyr Zelensky of Ukraine made the same point in a remote address to the African Union on Monday. Moscow has deep ties to many African countries, which have been reluctant to criticize … [+730 chars]",eu calls russia s blockade of ukranian grain a war crime the war is contributing to global food shortages and rising prices and the united nations warns of possible famine ukraine is usually a major grain exporter president volodymyr zelensky of ukraine made the same point in a remote address to the african union on monday moscow has deep ties to many african countries which have been reluctant to criticize
How Russia’s Wagner Group Is Expanding in Africa,https://www.nytimes.com/2022/05/31/world/africa/wagner-group-africa.html,2022-05-31 20:08:29+00:00,"Best known for its mercenaries, the Wagner Group also mines diamonds, spreads disinformation and props up autocrats in an effort to grow Russia’s footprint.","Since 2016 the US. has imposed at least seven sets of sanctions on Mr. Prigozhin, his companies and his associates, singling out his yacht and three private jets. Facebook and Twitter haveremoved hun… [+1288 chars]",how russia s wagner group is expanding in africa best known for its mercenaries the wagner group also mines diamonds spreads disinformation and props up autocrats in an effort to grow russia s footprint since 2016 the us has imposed at least seven sets of sanctions on mr prigozhin his companies and his associates singling out his yacht and three private jets facebook and twitter haveremoved hun
