title,url,date_published,snippet,body,text
Why the oil price is spiking again,https://www.economist.com/finance-and-economics/2022/05/31/why-the-oil-price-is-spiking-again,2022-05-31 20:35:52+00:00,A tightening EU embargo of Russian oil is just one explanation,In the 1970s Arab states used the oil weapon of embargoes to punish Western governments for supporting Israel. On May 30th the heads of the 27 eu member governments agreed to turn the weapon on thems… [+4851 chars],why the oil price is spiking again a tightening eu embargo of russian oil is just one explanation in the 1970s arab states used the oil weapon of embargoes to punish western governments for supporting israel on may 30th the heads of the 27 eu member governments agreed to turn the weapon on thems
Refiners are providing a fresh source of drama for oil markets,https://www.economist.com/finance-and-economics/2022/06/09/refiners-are-providing-a-fresh-source-of-drama-for-oil-markets,2022-06-09 10:31:08+00:00,"The low-key, low-margin industry is printing money","Americas driving season has officially begun. Despite rising inflation and the lingering threat of the pandemic, motorists hit the highways with gusto over the recent Memorial Day long weekend. Some … [+4721 chars]",refiners are providing a fresh source of drama for oil markets the low key low margin industry is printing money americas driving season has officially begun despite rising inflation and the lingering threat of the pandemic motorists hit the highways with gusto over the recent memorial day long weekend some
Could seizing Russian assets help rebuild Ukraine?,https://www.economist.com/finance-and-economics/2022/06/06/could-seizing-russian-assets-help-rebuild-ukraine,2022-06-06 20:27:15+00:00,There are both legal and practical hurdles in the way,"In 2011 viktor vekselberg, a metals tycoon and Kremlin insider, visited the team designing the Tango, a $90m yacht he had ordered, to oversee its construction. His attention to detail proved his undo… [+10429 chars]",could seizing russian assets help rebuild ukraine there are both legal and practical hurdles in the way in 2011 viktor vekselberg a metals tycoon and kremlin insider visited the team designing the tango a 90m yacht he had ordered to oversee its construction his attention to detail proved his undo
Has Russia legalised intellectual-property theft?,https://www.economist.com/business/2022/06/02/has-russia-legalised-intellectual-property-theft,2022-06-02 09:06:33+00:00,A new law seems to strip away the IP rights of Western firms,"As its economy was being bombarded with Western sanctions in early March, Russia decided to amend a section of its civil code. The world took little notice of decree number 299, which authorised the … [+3203 chars]",has russia legalised intellectual property theft a new law seems to strip away the ip rights of western firms as its economy was being bombarded with western sanctions in early march russia decided to amend a section of its civil code the world took little notice of decree number 299 which authorised the
The West has a chance to wean India off Russian weaponry,https://www.economist.com/asia/2022/06/13/the-west-has-a-chance-to-wean-india-off-russian-weaponry,2022-06-13 17:31:24+00:00,"But co-operation on defence with America, in particular, remains fraught","Joint weapons production between India and the West has a long and chequered history. Consider the Tejas fighter jet, whose development was approved in 1983 by Indira Gandhi, the prime minister of th… [+6862 chars]",the west has a chance to wean india off russian weaponry but co operation on defence with america in particular remains fraught joint weapons production between india and the west has a long and chequered history consider the tejas fighter jet whose development was approved in 1983 by indira gandhi the prime minister of th
A plan to revive South Korea’s nuclear-power sector faces obstacles,https://www.economist.com/asia/2022/06/08/a-plan-to-revive-south-koreas-nuclear-power-sector-faces-obstacles,2022-06-08 16:48:29+00:00,But it could help wean the country off fossil fuels,"The south gate of Shin Hanul, a nuclear power station in Uljin on South Koreas east coast, does not get a lot of traffic. At lunchtime on a recent weekday there were no heavy vehicles to be seen, onl… [+3822 chars]",a plan to revive south korea s nuclear power sector faces obstacles but it could help wean the country off fossil fuels the south gate of shin hanul a nuclear power station in uljin on south koreas east coast does not get a lot of traffic at lunchtime on a recent weekday there were no heavy vehicles to be seen onl
Is Turkey more trouble to NATO than it is worth?,https://www.economist.com/europe/2022/06/16/is-turkey-more-trouble-to-nato-than-it-is-worth,2022-06-16 14:07:54+00:00,Recep Tayyip Erdogan’s government is the alliance’s loose cannon,"The received wisdom is that Russias invasion of Ukraine has breathed new life, and a new sense of purpose, urgency and unity into nato. Someone forgot to tell Recep Tayyip Erdogan. Over the past mont… [+6047 chars]",is turkey more trouble to nato than it is worth recep tayyip erdogan s government is the alliance s loose cannon the received wisdom is that russias invasion of ukraine has breathed new life and a new sense of purpose urgency and unity into nato someone forgot to tell recep tayyip erdogan over the past mont
Emmanuel Macron seeks to advertise his support for Ukraine,https://www.economist.com/europe/2022/06/14/emmanuel-macron-seeks-to-advertise-his-support-for-ukraine,2022-06-14 18:12:10+00:00,Confusion lingers about France’s attitude towards Russia’s war,"FRANCES PRESIDENT, Emmanuel Macron, left his electoral worries at home on June 14th when he flew to Romania to start a brief tour of eastern Europe. Just days before the run-off votes in legislative … [+5975 chars]",emmanuel macron seeks to advertise his support for ukraine confusion lingers about france s attitude towards russia s war frances president emmanuel macron left his electoral worries at home on june 14th when he flew to romania to start a brief tour of eastern europe just days before the run off votes in legislative
Europe is squabbling—but remains united where it really matters,https://www.economist.com/europe/2022/06/02/europe-is-squabbling-but-remains-united-where-it-really-matters,2022-06-02 13:21:30+00:00,A new sanctions package belies complaints of internal rifts,"Unity among the nations of Europe is like a French soufflé. First comes the impressive puff, then, inexorably, a graceless sagging as the dish is tested by time and cutlery. Both the diplomat and the… [+6168 chars]",europe is squabbling but remains united where it really matters a new sanctions package belies complaints of internal rifts unity among the nations of europe is like a french souffl first comes the impressive puff then inexorably a graceless sagging as the dish is tested by time and cutlery both the diplomat and the
NATO holds its most important summit in generations,https://www.economist.com/europe/2022/06/26/nato-holds-its-most-important-summit-in-generations,2022-06-26 19:24:55+00:00,The alliance is fortifying its eastern borders. But it is divided over how far to go in Ukraine,"WHEN NATO published its strategic concepta sort of vision statementin 2010, things were looking good. Today the Euro-Atlantic area is at peace and the threat of a conventional attack against NATO ter… [+10725 chars]",nato holds its most important summit in generations the alliance is fortifying its eastern borders but it is divided over how far to go in ukraine when nato published its strategic concepta sort of vision statementin 2010 things were looking good today the euro atlantic area is at peace and the threat of a conventional attack against nato ter
Bashar al-Assad is hollowing out Syria’s ravaged state,https://www.economist.com/middle-east-and-africa/2022/06/16/bashar-al-assad-is-hollowing-out-syrias-ravaged-state,2022-06-16 14:07:53+00:00,Protection rackets and drug-dealing are big sources of income,"Forget flamboyant Arab dictators in military attire laden with medals or clad in swirling tribal robes. Bashar al-Assad, Syrias president, is the picture of modesty. Usually he wears no jewellery, no… [+5341 chars]",bashar al assad is hollowing out syria s ravaged state protection rackets and drug dealing are big sources of income forget flamboyant arab dictators in military attire laden with medals or clad in swirling tribal robes bashar al assad syrias president is the picture of modesty usually he wears no jewellery no
Why the West should be wary of permanently seizing Russian assets,https://www.economist.com/leaders/2022/06/09/why-the-west-should-be-wary-of-permanently-seizing-russian-assets,2022-06-09 10:38:55+00:00,Permanently grabbing Russian assets is a seductive idea. It would also be a mistake,"More than 100 days into the war in Ukraine, the biggest sanctions programme ever imposed on a major economy is still being tightened. America and Europe have frozen Russias currency reserves held in … [+4513 chars]",why the west should be wary of permanently seizing russian assets permanently grabbing russian assets is a seductive idea it would also be a mistake more than 100 days into the war in ukraine the biggest sanctions programme ever imposed on a major economy is still being tightened america and europe have frozen russias currency reserves held in
A new nuclear era,https://www.economist.com/leaders/2022/06/02/a-new-nuclear-era,2022-06-02 09:15:42+00:00,"With his threats to use the bomb, Russia’s president has overturned the nuclear order","One hundred days ago Vladimir Putin launched his invasion of Ukraine by warning of a nuclear strike. Having exalted Russias atomic arsenal and promised Ukraines subjugation, he threatened countries t… [+6374 chars]",a new nuclear era with his threats to use the bomb russia s president has overturned the nuclear order one hundred days ago vladimir putin launched his invasion of ukraine by warning of a nuclear strike having exalted russias atomic arsenal and promised ukraines subjugation he threatened countries t
Energy security gives climate-friendly nuclear-power plants a new appeal,https://www.economist.com/briefing/2022/06/23/energy-security-gives-climate-friendly-nuclear-power-plants-a-new-appeal,2022-06-23 15:24:24+00:00,To make good on it they have to get easier to build,"The worlds largest crane, Big Carl, trundles up and down the railway which bisects the site. To the south are cavernous temporary structures which serve as factory floors, sheltered from the elements… [+16365 chars]",energy security gives climate friendly nuclear power plants a new appeal to make good on it they have to get easier to build the worlds largest crane big carl trundles up and down the railway which bisects the site to the south are cavernous temporary structures which serve as factory floors sheltered from the elements
Russia’s invasion of Ukraine has eroded the nuclear taboo,https://www.economist.com/briefing/2022/06/02/russias-invasion-of-ukraine-has-eroded-the-nuclear-taboo,2022-06-02 09:59:01+00:00,This war is unlikely to go nuclear. But it is increasing the risk that future conflicts will,"In 1999 nina tannenwald, a political scientist at Brown University, wrote a paper analysing something she had observed among generals, politicians and strategists: the nuclear taboo. This was not, sh… [+16173 chars]",russia s invasion of ukraine has eroded the nuclear taboo this war is unlikely to go nuclear but it is increasing the risk that future conflicts will in 1999 nina tannenwald a political scientist at brown university wrote a paper analysing something she had observed among generals politicians and strategists the nuclear taboo this was not sh
Oligarch megayacht hides in UAE creek...,https://apnews.com/article/russia-ukraine-politics-technology-middle-east-c6592eb5a483c7d95e47cc9bd8f77bde,2022-06-01 12:07:36+00:00,"Oligarch megayacht hides in UAE creek...

 
 
 
 (Top headline, 8th story, link)

 

 

 
 Related stories:Kremlin propaganda declares WW3 has started...
Threatens to wipe out USA with Satan II missiles...
Biden to Provide Ukraine With Advanced Rocket S…","RAS AL-KHAIMAH, United Arab Emirates (AP) In the dusty, northern-most sheikhdom of the United Arab Emirates, where laborers cycle by rustic tea shops, one of the worlds largest yachts sits in a quiet… [+6123 chars]",oligarch megayacht hides in uae creek oligarch megayacht hides in uae creek related stories kremlin propaganda declares ww3 has started threatens to wipe out usa with satan ii missiles biden to provide ukraine with advanced rocket s ras al khaimah united arab emirates in the dusty northern most sheikhdom of the united arab emirates where laborers cycle by rustic tea shops one of the worlds largest yachts sits in a quiet
"Missiles strike Kyiv, shattering sense of calm...",https://apnews.com/article/russia-ukraine-kyiv-government-and-politics-e98d1d788e132c2a1f2c8ead7ae58761,2022-06-05 10:10:36+00:00,"Missiles strike Kyiv, shattering sense of calm...

 
 
 
 (Top headline, 3rd story, link)

 

 

 
 Related stories:WAR TURNS: Hail of Russian artillery tests Ukrainian morale...
'They're in hell'...
Zelensky losing 60 to 100 soldiers a day...
Battle i…","KYIV, Ukraine (AP) Russias defense ministry said a barrage of airstrikes on Ukraines capital destroyed tanks donated by the West and other armor in an attack on Sunday that shattered five weeks of ee… [+8085 chars]",missiles strike kyiv shattering sense of calm missiles strike kyiv shattering sense of calm related stories war turns hail of russian artillery tests ukrainian morale they are in hell zelensky losing 60 to 100 soldiers a day battle i kyiv ukraine russias defense ministry said a barrage of airstrikes on ukraines capital destroyed tanks donated by the west and other armor in an attack on sunday that shattered five weeks of ee
Key city's fate in balance as fighting rages in east Ukraine...,https://apnews.com/article/russia-ukraine-moscow-business-blockades-74883ed750fb8778259cf733e1095fb8,2022-06-09 11:49:40+00:00,"BAKHMUT, Ukraine (AP) — The human cost of the war in Ukraine  mounted as workers pulled up to 100 bodies from each smashed building in the devastated city of Mariupol — a gruesome effort that one official described as an “endless caravan of death.”","BAKHMUT, Ukraine (AP) The human cost of the war in Ukraine mounted as workers pulled up to 100 bodies from each smashed building in the devastated city of Mariupol a gruesome effort that one official… [+6209 chars]",key city s fate in balance as fighting rages in east ukraine bakhmut ukraine the human cost of the war in ukraine mounted as workers pulled up to 100 bodies from each smashed building in the devastated city of mariupol a gruesome effort that one official described as an endless caravan of death bakhmut ukraine the human cost of the war in ukraine mounted as workers pulled up to 100 bodies from each smashed building in the devastated city of mariupol a gruesome effort that one official
Biden Says US Will Provide Advanced Rocket Systems to Ukraine...,https://apnews.com/article/russia-ukraine-kyiv-politics-middle-east-fc6b7e347f0aa95d8aa3654479677f6f,2022-06-01 00:34:36+00:00,"Biden Says US Will Provide Advanced Rocket Systems to Ukraine...

 
 
 
 (Top headline, 4th story, link)

 

 

 
 Related stories:Kremlin propaganda declares 'WW3 has started'...
Threatens to wipe out USA with just four Satan II missiles...
Moscow Mili…","KYIV, Ukraine A regional Ukrainian governor on Tuesday said the Russian bombardment has caused a leak of toxic nitric acid from an industrial facility.
Luhansk Gov. Serhiy Haidai said a Russian air … [+16034 chars]",biden says us will provide advanced rocket systems to ukraine biden says us will provide advanced rocket systems to ukraine related stories kremlin propaganda declares ww3 has started threatens to wipe out usa with just four satan ii missiles moscow mili kyiv ukraine a regional ukrainian governor on tuesday said the russian bombardment has caused a leak of toxic nitric acid from an industrial facility luhansk gov serhiy haidai said a russian air
Macron says Russia can't win...,https://apnews.com/article/russia-ukraine-politics-united-nations-terrorist-attacks-be890f11b0a5abfb41ddb1cfc8d5b212,2022-06-28 16:34:39+00:00,"Macron says Russia can't win...

 
 
 
 (First column, 9th story, link)

 

 

 
 Related stories:Pentagon Blasts Putin Nuke Saber-Rattling...
NATO INCREASES FORCES TO 300,000...
UK: '1937 MOMENT'...

 

 
 
 Drudge Report Feed needs your support!   B…","KREMENCHUK, Ukraine (AP) Frances president denounced Russias fiery airstrike on a crowded shopping mall in Ukraine as a new war crime Tuesday and vowed the Wests support for Kyiv would not waver, say… [+6465 chars]",macron says russia cannot win macron says russia cannot win related stories pentagon blasts putin nuke saber rattling nato increases forces to 300 000 uk 1937 moment drudge report feed needs your support b kremenchuk ukraine frances president denounced russias fiery airstrike on a crowded shopping mall in ukraine as a new war crime tuesday and vowed the wests support for kyiv would not waver say
Biden urges Western unity amid war fatigue...,https://apnews.com/article/russia-ukraine-g-7-summit-inflation-biden-moscow-8ec2d58070215ec8393b25e4109eac97,2022-06-26 15:01:38+00:00,"ELMAU, Germany (AP) — President Joe Biden on Sunday praised the continued unity of the global alliance confronting Russia, as he and other heads of the Group of Seven leading economies strategized on sustaining the pressure in their effort to isolate Moscow o…","ELMAU, Germany (AP) President Joe Biden on Sunday praised the continued unity of the global alliance confronting Russia, as he and other heads of the Group of Seven leading economies strategized on s… [+6269 chars]",biden urges western unity amid war fatigue elmau germany president joe biden on sunday praised the continued unity of the global alliance confronting russia as he and other heads of the group of seven leading economies strategized on sustaining the pressure in their effort to isolate moscow o elmau germany president joe biden on sunday praised the continued unity of the global alliance confronting russia as he and other heads of the group of seven leading economies strategized on s
EXPLAINER: What's the impact of a Russian debt default? - The Associated Press - en Español,https://apnews.com/article/russia-ukraine-foreign-debt-sovereign-322dd9b66c6954063ef810c5922f0315,2022-06-26 17:05:25+00:00,"<ol><li>EXPLAINER: What's the impact of a Russian debt default?  The Associated Press - en Español
</li><li>Russia Is Hours Away From Its First Foreign Default in a Century  Bloomberg
</li><li>Sanctions Push Russia Near First Foreign Default Since Revolutio…","Russia is poised to default on its foreign debt for the first time since the 1917 Bolshevik Revolution, further alienating the country from the global financial system following sanctions imposed ove… [+5890 chars]",explainer what is the impact of a russian debt default en espa ol explainer what is the impact of a russian debt default en espa ol russia is hours away from its first foreign default in a century bloomberg sanctions push russia near first foreign default since revolutio russia is poised to default on its foreign debt for the first time since the 1917 bolshevik revolution further alienating the country from the global financial system following sanctions imposed ove
"Serbia ignores EU sanctions, secures gas deal with Putin - The Associated Press",https://apnews.com/article/russia-ukraine-putin-european-union-aleksandar-vucic-5a6bbab20373ef26829378c6a0eb6065,2022-05-29 17:55:25+00:00,"BELGRADE, Serbia (AP) — As the war in Ukraine rages , Serbia's president announced that he has secured an “extremely favorable” natural gas deal with Russia during a telephone conversation Sunday with Russian President Vladimir Putin.","BELGRADE, Serbia (AP) As the war in Ukraine rages, Serbias president announced that he has secured an extremely favorable natural gas deal with Russia during a telephone conversation Sunday with Russ… [+2524 chars]",serbia ignores eu sanctions secures gas deal with putin belgrade serbia as the war in ukraine rages serbia s president announced that he has secured an extremely favorable natural gas deal with russia during a telephone conversation sunday with russian president vladimir putin belgrade serbia as the war in ukraine rages serbias president announced that he has secured an extremely favorable natural gas deal with russia during a telephone conversation sunday with russ
EU leaders agree on partial embargo on Russian oil - The Associated Press,https://apnews.com/article/russia-ukraine-zelenskyy-hungary-european-union-d0d4144c84749f84676a2f41b03b2ad4,2022-05-30 23:38:08+00:00,"<ol><li>EU leaders agree on partial embargo on Russian oil  The Associated Press
</li><li>EU disagreements stall progress on proposed Russia sanctions  Al Jazeera English
</li><li>Latest Russia-Ukraine News  The New York Times
</li><li>Hungary's Orbán says…",BRUSSELS (AP) European Union leaders agreed Monday to embargo most Russian oil imports into the bloc by year-end as part of new sanctions on Moscow worked out at a summit focused on helping Ukraine w… [+4690 chars],eu leaders agree on partial embargo on russian oil eu leaders agree on partial embargo on russian oil eu disagreements stall progress on proposed russia sanctions al jazeera english latest russia ukraine news the new york times hungary s orb n says brussels european union leaders agreed monday to embargo most russian oil imports into the bloc by year end as part of new sanctions on moscow worked out at a summit focused on helping ukraine w
$30B from Russian oligarchs frozen under REPO seizure effort - The Associated Press - en Español,https://apnews.com/article/russia-ukraine-government-and-politics-d67e109941461f0b8df53832582b9ca9,2022-06-29 09:59:17+00:00,"WASHINGTON (AP) — A multinational task force designed to seize Russian oligarchs' wealth  has blocked and frozen $30 billion in sanctioned individuals' property and funds in its first 100 days in operation, the Treasury Department reported Wednesday.",WASHINGTON (AP) A multinational task force designed to seize Russian oligarchs wealth has blocked and frozen $30 billion in sanctioned individuals property and funds in its first 100 days in operatio… [+2559 chars],30b from russian oligarchs frozen under repo seizure effort en espa ol washington a multinational task force designed to seize russian oligarchs wealth has blocked and frozen 30 billion in sanctioned individuals property and funds in its first 100 days in operation the treasury department reported wednesday washington a multinational task force designed to seize russian oligarchs wealth has blocked and frozen 30 billion in sanctioned individuals property and funds in its first 100 days in operatio
Russia offers foreign debt payment system similar to gas one - The Associated Press,https://apnews.com/article/russia-ukraine-putin-government-and-politics-9040260186a97d33bc693bf279abceed,2022-05-30 11:04:48+00:00,"<ol><li>Russia offers foreign debt payment system similar to gas one  The Associated Press
</li><li>Russia Readies New Bond-Payment Plan in Bid to Avoid Default  Bloomberg
</li><li>Russia eyes gas-for-roubles template for foreign Eurobond payments  Reuters…","MOSCOW (AP) Russia said Monday it may use an arrangement similar to that used for payments for its gas supplies to pay its dollar-denominated foreign debts.
The Vedomosti business daily quoted Finan… [+2744 chars]",russia offers foreign debt payment system similar to gas one russia offers foreign debt payment system similar to gas one russia readies new bond payment plan in bid to avoid default bloomberg russia eyes gas for roubles template for foreign eurobond payments moscow russia said monday it may use an arrangement similar to that used for payments for its gas supplies to pay its dollar denominated foreign debts the vedomosti business daily quoted finan
G-7 leaders end summit pledging to hurt Russia economically - The Associated Press,https://apnews.com/article/nato-climate-g-7-summit-russia-ukraine-zelenskyy-7e539b7f8b1900259e7d0198591c6d5c,2022-06-28 11:03:45+00:00,"<ol><li>G-7 leaders end summit pledging to hurt Russia economically  The Associated Press
</li><li>G7 leaders work to 'starve' Russia of oil money as Zelensky says he wants the war over by the end of the year  CNN
</li><li>G-7 leaders stop short of new ener…","ELMAU, Germany (AP) Leaders of the worlds wealthiest democracies struck a united stance to support Ukraine for as long as it takes as Russias invasion grinds on, and said they would explore far-reach… [+5372 chars]",g 7 leaders end summit pledging to hurt russia economically g 7 leaders end summit pledging to hurt russia economically g7 leaders work to starve russia of oil money as zelensky says he wants the war over by the end of the year cnn g 7 leaders stop short of new ener elmau germany leaders of the worlds wealthiest democracies struck a united stance to support ukraine for as long as it takes as russias invasion grinds on and said they would explore far reach
