title,url,date_published,snippet,body
"Ukraine Live Updates: 100 Days of War Felt Like a ‘Long, Difficult Day’",https://www.nytimes.com/live/2022/06/04/world/russia-ukraine-war-news,2022-06-04T08:01:33Z,Kyiv’s mayor called the past few months “a time of courage and perseverance.” Analysts and officials say no end to the conflict is in sight.,"DAKAR, Senegal A meeting on Friday between the head of the African Union and President Vladimir V. Putin of Russia highlighted the acute needs each one hopes the other can fill: Africa needs food, an… [+5473 chars]"
"McDonald’s, Moscow Style, Is Back, as Russian Economy Stumbles On",https://www.nytimes.com/2022/06/10/world/europe/russia-economy-mcdonalds.html,2022-06-10T21:37:34Z,"The reopening of the fast-food stores under Russian ownership illustrates the economy’s surprising resilience in the face of intense sanctions, though difficult times lie ahead.","Banned from using European airspace, Aeroflot is now focusing on domestic routes and working to switch to Russian planes a process that will take years. Siemens, which built telegraph lines across th… [+1677 chars]"
U.S. Imposes Sanctions on Yacht Company That Caters to Russian Elites,https://www.nytimes.com/2022/06/02/us/politics/russia-oligarchs-yachts-sanctions.html,2022-06-02T14:45:43Z,The Treasury Department also identified four yachts as being linked to President Vladimir V. Putin of Russia.,"WASHINGTON The U.S. government leveled sanctions against a yacht management company and its owners, describing them as part of a corrupt system that allows Russian elites and President Vladimir V. Pu… [+1117 chars]"
Russia Threatens Lithuania Over Kaliningrad Cargo,https://www.nytimes.com/2022/06/24/world/europe/kaliningrad-russia-rail-sanctions.html,2022-06-24T16:13:11Z,"Russia has accused Lithuania, a NATO member, of choking off the flow of goods to Kaliningrad, its enclave on the Baltic, as part of sanctions over the war in Ukraine. Lithuania says Russia is lying.","KYBARTAI, Lithuania As war rages in Ukraine, fueling ever-growing tensions between NATO and Russia, a sleepy Baltic railway station with no passengers and few trains this week found itself at the cen… [+10739 chars]"
"In Russia Crisis, India Tries to Balance Geopolitics and Economics",https://www.nytimes.com/2022/06/28/world/asia/india-russia-war.html,2022-06-28T13:12:50Z,"Prime Minister Narendra Modi, who attended the G7 meeting, is also trying to position India as the voice of poorer nations, arguing that sanctions hurt developing countries the most.","We are trying everything to meet the demands of residents, he added.
The West is starting to recognize that sanctions have done serious damage globally, without significantly crimping the Kremlin's … [+1453 chars]"
Russian Elites Show No Sign of Broad Challenge to Putin,https://www.nytimes.com/2022/06/23/world/europe/russia-war-oligarchs-putin.html,2022-06-23T04:01:13Z,"Many business owners and intellectuals fled Russia after the invasion of Ukraine, but others stayed behind, struggling to redefine their lives. Their diverging choices do not add up to a broad challenge to Vladimir Putin’s war.","Yet what is happening in reality, interviews show, is that the mood spans a spectrum from desperation to exhilaration, but with one common denominator: the sense that the countrys future is out of th… [+1123 chars]"
A cap on the price of Russian oil comes with many questions.,https://www.nytimes.com/2022/06/28/world/europe/a-cap-on-the-price-of-russian-oil-comes-with-many-questions.html,2022-06-28T08:02:21Z,The idea is to limit how much Russia can earn from the oil it sells while still keeping markets well supplied.,"Leaders of the Group of 7 nations meeting in Germany, seeking a new way to throttle Russias finances while limiting the harm to Western economies, are discussing imposing a ceiling on the price paid … [+457 chars]"
Ukraine Live Updates: Russia’s Economy Proves More Resilient Than Expected,https://www.nytimes.com/live/2022/06/11/world/russia-ukraine-war-news,2022-06-11T08:02:20Z,"Ukraine’s economy is damaged but functional. Its military is short of Western weapons, giving Russia an advantage along the eastern front.","Yevgeny Shumilkin is going back to work on Sunday. To prepare, he pulled the familiar M off what had been his McDonalds shirt and covered the M on his McDonalds jacket with a Russian flag patch.It wi… [+10129 chars]"
Seizing Russian Assets to Help Ukraine Sets off White House Debate,https://www.nytimes.com/2022/05/31/us/politics/russia-sanctions-central-bank-assets.html,2022-05-31T19:52:11Z,Some European officials want to use more than $300 billion in Russian central bank assets to rebuild Ukraine. But Biden administration officials warn that diverting those funds could be illegal.,"I think its very natural that given the enormous destruction in Ukraine and huge rebuilding costs that they will face, that we will look to Russia to help pay at least a portion of the price that wil… [+2443 chars]"
"Russian Military Is Repeating Mistakes in Eastern Ukraine, U.S. Says",https://www.nytimes.com/2022/05/31/us/politics/russia-military-eastern-ukraine.html,2022-05-31T20:08:21Z,"President Vladimir V. Putin sent in a new commander in April, but Russian troops are still facing morale and other problems, American officials say.","In Ukraine, he established a more streamlined process. Russian pilots began coordinating with troops on the ground toward a similar objective in the eastern region of Donbas, and Russian units were t… [+2410 chars]"
EU Calls Russia’s Blockade of Ukranian Grain a War Crime,https://www.nytimes.com/2022/06/20/world/europe/russia-blockade-ukraine-grain.html,2022-06-20T20:51:39Z,"The war is contributing to global food shortages and rising prices, and the United Nations warns of possible famine. Ukraine is usually a major grain exporter.","President Volodymyr Zelensky of Ukraine made the same point in a remote address to the African Union on Monday. Moscow has deep ties to many African countries, which have been reluctant to criticize … [+730 chars]"
How Russia’s Wagner Group Is Expanding in Africa,https://www.nytimes.com/2022/05/31/world/africa/wagner-group-africa.html,2022-05-31T20:08:29Z,"Best known for its mercenaries, the Wagner Group also mines diamonds, spreads disinformation and props up autocrats in an effort to grow Russia’s footprint.","Since 2016 the US. has imposed at least seven sets of sanctions on Mr. Prigozhin, his companies and his associates, singling out his yacht and three private jets. Facebook and Twitter haveremoved hun… [+1288 chars]"
Lithuania Blames Russia for Cyberattacks,https://www.nytimes.com/2022/06/27/world/europe/lithuania-russia-cyberattacks.html,2022-06-27T22:54:35Z,"Hackers have struck dozens of Lithuanian government and private organizations, according to a Lithuanian official.",Lithuania insists it has imposed no cargo ban and accuses Russia of lying.. It says it has restricted just 1 percent of the goods that pass by rail through Lithuanian territory in response to Europea… [+1213 chars]
"As Battles Rage, Ukraine Rejects Macron Plea not to ‘Humiliate’ Russia",https://www.nytimes.com/2022/06/04/world/europe/ukraine-macron-russia-izium.html,2022-06-04T16:55:03Z,"Amid reports of battlefield gains by Ukraine, an official angrily rejected Mr. Macron’s advice, saying it “can only humiliate France.”","But one thing Russia had already achieved was international isolation and a solidifying of the Western alliance against it. Jens Stoltenberg, NATOs secretary general, met Friday with Prime Minister S… [+1555 chars]"
G7 Leaders Work to Punish Russia Over Ukraine War,https://www.nytimes.com/2022/06/26/world/europe/ukraine-russia-war-g7.html,2022-06-26T20:59:03Z,"On the first day of their gathering, Group of 7 leaders moved to increase the economic pressure on Russia, but a missile attack on the Ukrainian capital made clear that Moscow is not backing down.","Janet L. Yellen, the American Treasury secretary, has privately been telling foreign leaders that the best way to achieve both goals would be to impose a so-called price cap on Russian oil sales to E… [+1307 chars]"
Live Updates: G7 to Seek Ban on Imports of Russian Gold,https://www.nytimes.com/live/2022/06/26/world/russia-ukraine-war-news,2022-06-26T08:16:22Z,"President Biden announced the move on Sunday, ahead of a summit that will focus on the war in Ukraine and the worsening global economy Russia targeted Ukraine’s capital, Kyiv, striking a residential building with missiles.","President Biden at a news conference after meetings with Group of 7 leaders at NATO headquarters in Brussels in March.Credit...Doug Mills/The New York Times
When President Biden met his Western alli… [+4257 chars]"
Here are the latest developments in the war in Ukraine.,https://www.nytimes.com/2022/05/30/world/europe/here-are-the-latest-developments-in-the-war-in-ukraine.html,2022-05-30T05:02:20Z,,"A day after fighting in Ukraine expanded on another front, with the military announcing a counteroffensive around the southern port city of Kherson, European leaders will be gathering in Brussels for… [+889 chars]"
"At NATO Summit in Madrid, Debates Underneath the Unity",https://www.nytimes.com/2022/06/27/world/europe/nato-summit-madrid-ukraine.html,2022-06-27T16:04:39Z,"The alliance is supporting Ukraine’s defense against Russia with money and arms, but its summit in Madrid this week will involve some difficult talks, including about where to put troops.","The issue is now more sensitive, with Moscow accusing Lithuania of blocking its rail shipments to its heavily armed enclave of Kaliningrad in line with E.U. sanctions against Russia, and threatening … [+1255 chars]"
Live Updates: Russia Fires Barrage of Rockets at Targets Across Ukraine,https://www.nytimes.com/live/2022/06/25/world/russia-ukraine-war-news,2022-06-25T10:51:05Z,Officials said the attacks included over 40 rockets fired from Belarusian airspace and appeared to hit mostly military targets. They came hours before President Vladimir V. Putin of Russia was to meet with Belarus’s leader.,"A heat and power plant in Berlin on Thursday. Germany may soon have to ration gas, as Russia has shown a willingness to cut off supplies to E.U. buyers.Credit...Clemens Bilan/EPA, via Shutterstock
B… [+3989 chars]"
"In Ukraine, Some Ethnic Hungarians Feel Ambivalence About the War",https://www.nytimes.com/2022/06/16/world/europe/ethnic-hungarians-ukraine-war.html,2022-06-16T04:01:09Z,"After Moscow’s invasion, some Ukrainians worry that divided loyalties within the country’s small ethnic Hungarian minority might make it susceptible to pro-Russia propaganda from Hungary.","TRANSCARPATHIA, Ukraine Beneath dark clouds unleashing a summer rain, officials in a southwestern Ukrainian border village gathered silently, slowly hanging wreaths on branches to commemorate the des… [+10296 chars]"
Putin’s Ukraine War Woke Up Europe,https://www.nytimes.com/2022/05/31/opinion/putin-europe-ukraine.html,2022-05-31T23:00:08Z,Europe is more united than ever in the wake of the Russian invasion of Ukraine.,"Whether we like it or not, added Fischer, modern Europe is now in a confrontational mode with Russia. Russia is no longer part of any European peace order. Theres been a complete loss of trust with P… [+2198 chars]"
Russia Is Down. But It’s Not Out.,https://www.nytimes.com/2022/06/02/opinion/russia-ukraine-war-nato.html,2022-06-02T09:08:06Z,"Despite its failures in Ukraine, we shouldn’t write Russia off.","But appearances can be deceptive. After all, many of the armys initial failures stemmed from Mr. Putins misplaced assumption that the war would be short and sharp: Russian troops were simply not prep… [+2500 chars]"
Russia and America Are Parting Ways,https://www.nytimes.com/2022/06/09/opinion/russia-america-culture-putin.html,2022-06-09T05:00:05Z,"The post-totalitarian dream of a peaceful, friendly future is over.","Yet somewhere along the way, the good will slowed. After expressing enthusiasm for Russias first post-Soviet president, Boris Yeltsin, Americas leaders found his K.G.B.-fashioned successor, Vladimir … [+3463 chars]"
How Putin Has Played His Energy Cards,https://www.nytimes.com/2022/05/31/opinion/ukraine-energy-war-europe-gas.html,2022-05-31T18:05:06Z,The energy realists Jason Bordoff and Meghan O’Sullivan explain why the Ukraine war means a very bumpy ride in the transition off of fossil fuels.,"At the more macro level, were all still commending one another for the unity that this crisis has brought both within Europe and in the trans-Atlantic community. But there are little cleavages emergi… [+3059 chars]"
"On Inflation and the Food Crisis, the World Can Work Together or Fall Apart",https://www.nytimes.com/2022/06/18/opinion/inflation-global-food-shortage-ukraine.html,2022-06-18T12:24:50Z,No single country can solve the problem of rising food and fuel costs.,"As is so often the case, it is the poorest countries that suffer the sharpest blow, and history shows that hunger can quickly turn lethal. Nigeria, Somalia, Ethiopia, Egypt and Yemen are already feel… [+2003 chars]"
Five Blunt Truths About the War in Ukraine,https://www.nytimes.com/2022/06/14/opinion/ukraine-war-putin.html,2022-06-14T23:00:08Z,It’s time for Biden to take greater risks for victory.,"But that cant happen in an artillery war when Russia can fire some 60,000 shells per day against the roughly 5,000 that the Ukrainians have said they can get off. Quantity, as the saying goes, has a … [+1226 chars]"
President Biden: What America Will and Will Not Do in Ukraine,https://www.nytimes.com/2022/05/31/opinion/biden-ukraine-strategy.html,2022-05-31T23:10:05Z,The U.S. will help Ukraine be in the strongest possible position at the negotiating table. We do not want to prolong the war just weaken Russia.,"We will continue cooperating with our allies and partners on Russian sanctions, the toughest ever imposed on a major economy. We will continue providing Ukraine with advanced weaponry, including Jave… [+1958 chars]"
Will Biden’s Gas Tax Holiday Make a Difference?,https://www.nytimes.com/2022/06/22/business/dealbook/will-bidens-gas-tax-holiday-make-a-difference.html,2022-06-22T13:03:02Z,Many economists say suspending federal taxes on gas will not significantly cut prices for consumers.,"Millions of tax returns have not been processed as the I.R.S. tries to clear its backlog. The agency is facing a larger-than-normal pileup of returns, the Treasury Department said, with more than twi… [+2874 chars]"
"Inflation, Stock Market and Business News for June 27, 2022 - The New York Times",https://www.nytimes.com/live/2022/06/27/business/economy-news-inflation-stocks-russia,2022-06-27T09:03:42Z,Economic sanctions that blocked bond payments have strengthened efforts to seal off Moscow from global markets.,"Russia missed a deadline for making bond payments on Sunday, a move signaling its first default on international debt in more than a century, after Western sanctions thwarted the governments efforts … [+9295 chars]"
"Inflation, Stock Market and Business News: Live Updates - The New York Times",https://www.nytimes.com/live/2022/06/27/business/economy-news-inflation-stocks,2022-06-27T09:03:42Z,"This default would be unusual because it would be a result of economic sanctions blocking transactions, not because the government has run out of money.","The Russian Central Bank headquarters in Moscow. The head of the bank, Elvira Nabiullina, has said that there wont be any immediate consequences of a default.Credit...Maxim Shemetov/Reuters
Russia a… [+3481 chars]"
The Week in Business: Escalating U.S. Sanctions on Russia - The New York Times,https://www.nytimes.com/2022/05/29/business/the-week-in-business-sanctions-russia.html,2022-05-29T11:00:08Z,"The chip maker Broadcom continued its acquisitive streak, buying VMware. Gas prices head higher. And a report will show if job growth continues to be strong.","Credit...Giacomo Bagnara
On Wednesday at midnight, the Biden administration let lapse an exemption in the sweeping sanctions against Russia that had allowed the country to continue making payments o… [+3178 chars]"
"Latest Economy, Business and Gas Tax News: Live Updates - The New York Times",https://www.nytimes.com/live/2022/06/21/business/economy-news-inflation-stocks,2022-06-21T10:09:07Z,"Latest Economy, Business and Gas Tax News: Live Updates  The New York Times","The Yang Mei Hu oil products tanker moored at a crude oil terminal in Nakhodka, Russia, this month.Credit...Tatiana Meel/Reuters
A surge in demand from Asia for discounted Russian oil is making up f… [+3400 chars]"
May Consumer Price Report: Live Updates - The New York Times,https://www.nytimes.com/live/2022/06/10/business/inflation-cpi-report-may,2022-06-10T10:31:31Z,"<ol><li>May Consumer Price Report: Live Updates  The New York Times
</li><li>Most Americans expect inflation to get worse, Post-Schar School poll finds  The Washington Post
</li><li>Here's Why Food, Energy Inflation Hit American Households Like Never Before…","Shopping for groceries at a Sainsburys supermarket in London.Credit...Tolga Akmen/EPA, via Shutterstock
Russias invasion of Ukraine has caused inflation to become stubbornly entrenched in countries … [+2634 chars]"
Why Gas Prices Are So High - The New York Times,https://www.nytimes.com/interactive/2022/06/14/business/gas-prices.html,2022-06-14T09:00:01Z,"<ol><li>Why Gas Prices Are So High  The New York Times
</li><li>Several factors are converging to push gas prices higher  KSL.com
</li><li>West Palm Beach has most expensive gas prices in Florida  Miami Herald
</li><li>Gas up 25 cents in a week in Colorado…","$1
$2
$3
$4
$5 per gallon
1980
1990
2000
2010
2020
Expected June avg.
$4.59 per gallon
Adjusted for inflation
Not adjusted
Source: Energy Information AdministrationNote: Prices adjusted… [+6190 chars]"
"From Russian Elites, No Sign of Broad Challenge to Putin",https://www.nytimes.com/2022/06/22/world/europe/russia-war-elite-putin.html,2022-06-23T11:57:37Z,Alexander Y. Lebedev looks like a prime target for sanctions meant to prompt Russia’s elites to turn against the Kremlin. He is a onetime billionaire and a...,Alexander Y. Lebedev looks like a prime target for sanctions meant to prompt Russia’s elites to turn against the Kremlin. He is a onetime billionaire and a former KGB agent with deep connections both… [+8195 chars]
Russia-Ukraine War News: Live Updates,https://www.nytimes.com/live/2022/06/27/world/russia-ukraine-war-news,2022-06-27T06:09:01Z,A possible agreement on oil price caps comes as Russia appeared closer to defaulting on its international debt. President Volodymyr Zelensky is about to speak virtually at the Group of 7 summit in Germany.,"The Russian Central Bank headquarters in Moscow. The head of the bank, Elvira Nabiullina, has said that there wont be any immediate consequences of a default.Credit...Maxim Shemetov/Reuters
Russia a… [+3506 chars]"
What Hundreds of Photos of Weapons Reveal About Russia’s Brutal War Strategy,https://www.nytimes.com/interactive/2022/06/19/world/europe/ukraine-munitions-war-crimes.html,2022-06-19T04:15:01Z,A New York Times analysis of visual evidence from Ukraine showed widespread use by Russia of cluster weapons banned under certain international treaties.,"Reflecting a shockingly barbaric and old-fashioned wartime strategy, Russian forces have pummeled Ukrainian cities and towns with a barrage of rockets and other munitions, most of which can be consid… [+22051 chars]"
Mariya Lasitskene: Olympic champion calls for IOC to lift sanctions on Russian athletes,https://www.bbc.co.uk/sport/athletics/61756392,2022-06-10T08:10:46Z,Russian Olympic high jump champion Mariya Lasitskene calls for IOC president Thomas Bach to end a ban on Russian and Belarusian athletes from international competition.,"Mariya Lasitskene is the reigning Olympic and world champion in high jump
Russian Olympic high jump champion Mariya Lasitskene has called on the International Olympic Committee president Thomas Bach… [+2117 chars]"
Ukraine war round-up: A city under siege and how Russia is coping with sanctions,https://www.bbc.co.uk/news/world-europe-61811161,2022-06-15T19:06:57Z,We hear about life in Severodonetsk - and look at whether Russia's economy will survive Western sanctions.,"For some time now we've been reporting on military developments in the key eastern city of Severodonetsk, the majority of which is now under Russian control.
Taking Severodonetsk - as well as a near… [+4865 chars]"
Putin rails against the West and Eurovision pulls out of Ukraine - round up,https://www.bbc.co.uk/news/world-europe-61844872,2022-06-17T18:52:38Z,"Russia's leader says sanctions are ""mad and thoughtless"", as the war stops Ukraine from hosting Eurovision .","Russian President Vladimir Putin railed against the West on Friday, stating that sanctions imposed on Russia are ""mad and thoughtless"". 
Speaking at an economic conference in St Petersburg, he said … [+3205 chars]"
G7 face battle for unity as cost of Ukraine war mounts,https://www.bbc.co.uk/news/world-europe-61940007,2022-06-25T21:24:52Z,The Russian war against Ukraine will inevitably dominate the summit of G7 nations in Bavaria.,"By James LandaleDiplomatic correspondent
The Russian war against Ukraine will inevitably dominate the summit of G7 nations in Bavaria. 
And the leaders of the US, UK, Germany, France, Italy, Canada… [+2904 chars]"
Kaliningrad row: Lithuania accuses Russia of lying about rail 'blockade',https://www.bbc.co.uk/news/world-europe-61901764,2022-06-22T19:11:50Z,The prime minister says talk of a blockade is untrue and a tiny amount of goods are affected.,"By Paul KirbyBBC News
Lithuanian Prime Minister Ingrida Simonyte has said Russian claims of a rail blockade of its territorial outpost in Kaliningrad are a lie.
Kaliningrad is on the Baltic Sea and… [+3611 chars]"
Ukraine war: Zelensky to address G7 as Russian missiles hit cities,https://www.bbc.co.uk/news/world-europe-61947294,2022-06-27T03:21:22Z,"The Ukrainian president calls for more weapons and says partners ""need to move faster"".","Media caption, Watch: BBC journalist Olga Malchevska returns to bombed Kyiv home for the first time
Ukraine's President Volodymyr Zelensky is expected to urge delivery of more heavy weapons when he … [+3713 chars]"
Ukraine round-up: 'Dead cities' in east and FM Lavrov not cleared to fly,https://www.bbc.co.uk/news/world-europe-61713520,2022-06-06T20:49:14Z,Ukrainian forces 'holding on' in Severodonetsk as another Russian general dies at the front.,"Image source, National Police of Ukraine/Handout via REUTERS
Image caption, A Ukrainian police officer inspects damaged remains of a student centre in Lysychansk destroyed in Russian shelling
Ukrai… [+3524 chars]"
"Ukraine round-up: Medal sale millions to help refugees, and Ben Stiller visits Zelensky",https://www.bbc.co.uk/news/world-europe-61884212,2022-06-21T20:12:54Z,"A Russian journalist raises millions selling his Nobel medal, and a Hollywood actor visits Ukraine.","Russia has warned Lithuania of ""serious"" consequences after it banned the rail transfer of some goods to the Russian territory of Kaliningrad. 
Russia ""will certainly respond to such hostile actions… [+3497 chars]"
Ukraine round-up: Escape from besieged city and refugee camp in Wales,https://www.bbc.co.uk/news/world-middle-east-61898741,2022-06-22T18:48:24Z,"Civilians take their last chance to escape Lysychansk, and a centre for 60 Ukrainian families in Wales.","An apparent drone strike has suspended operations at an oil refinery in Russia near the border with Ukraine. 
A statement from the facility in the Rostov region says the plant was hit by two strikes… [+4507 chars]"
Russia blockading Ukrainian grain is a 'real war crime' - EU,https://www.bbc.co.uk/news/world-europe-61864049,2022-06-20T09:50:32Z,"Russia is stopping grain leaving Ukrainian ports, sparking warnings tens of millions risk famine.","Russia's blockade of millions of tonnes of Ukrainian grain is a ""real war crime"", says EU foreign policy chief Josep Borrell.
""It is inconceivable - one cannot imagine that millions of tonnes of whe… [+1606 chars]"
Grain blockade a 'war crime' and rock band reunites - Ukraine round-up,https://www.bbc.co.uk/news/world-europe-61863889,2022-06-20T17:10:04Z,"The EU calls on Russia to end its Ukrainian port blockade, and the teenage band reunited amid the war.","Ukraine plays a crucial role in the global food supply, exporting wheat and other grains to countries across the world. 
That's why Russia's blockade of Ukrainian ports is so damaging, and why on Mo… [+3435 chars]"
Russia unveils 'tasty' McDonald's substitute,https://www.bbc.co.uk/news/world-europe-61774475,2022-06-12T09:47:07Z,"The fast food outlets are being rebranded as ""Tasty and that's it"" after the burger giant pulled out.","By Steve RosenbergRussia Editor, Moscow
It's a Russian revamp of an American icon. 
Fast food giant McDonald's pulled out of Russia in protest at the invasion of Ukraine and sold its restaurants he… [+2037 chars]"
Russia's war prompts regional rush to become EU candidates,https://www.bbc.co.uk/news/world-europe-61757829,2022-06-11T00:57:56Z,"While the prospects for Ukraine and Moldova look good, Georgia is accused of backsliding on democracy.","By Rayhan DemytrieBBC News, Tbilisi
European Union leaders are to decide later this month whether to welcome Ukraine, Moldova and Georgia as candidate states for membership of the European Union. 
… [+5466 chars]"
