title,url,date_published,snippet,body
Business,https://www.economist.com/the-world-this-week/2022/06/02/business,2022-06-02T13:21:30Z,,The euro zones annual inflation rate leapt to 8.1% in May. The European Central Bank is expected to raise interest rates for the first time in a decade in July and again in September. Surging prices … [+4445 chars]
Why the oil price is spiking again,https://www.economist.com/finance-and-economics/2022/05/31/why-the-oil-price-is-spiking-again,2022-05-31T20:35:52Z,A tightening EU embargo of Russian oil is just one explanation,In the 1970s Arab states used the oil weapon of embargoes to punish Western governments for supporting Israel. On May 30th the heads of the 27 eu member governments agreed to turn the weapon on thems… [+4851 chars]
Why oil prices are spiking again,https://www.economist.com/finance-and-economics/2022/05/31/why-oil-prices-are-spiking-again,2022-05-31T20:35:52Z,A tightening EU embargo of Russian oil is just one explanation,In the 1970s Arab states used the oil weapon of embargoes to punish Western governments for supporting Israel. On May 30th the heads of the 27 eu member governments agreed to turn the weapon on thems… [+4856 chars]
Refiners are providing a fresh source of drama for oil markets,https://www.economist.com/finance-and-economics/2022/06/09/refiners-are-providing-a-fresh-source-of-drama-for-oil-markets,2022-06-09T10:31:08Z,"The low-key, low-margin industry is printing money","Americas driving season has officially begun. Despite rising inflation and the lingering threat of the pandemic, motorists hit the highways with gusto over the recent Memorial Day long weekend. Some … [+4721 chars]"
Could seizing Russian assets help rebuild Ukraine?,https://www.economist.com/finance-and-economics/2022/06/06/could-seizing-russian-assets-help-rebuild-ukraine,2022-06-06T20:27:15Z,There are both legal and practical hurdles in the way,"In 2011 viktor vekselberg, a metals tycoon and Kremlin insider, visited the team designing the Tango, a $90m yacht he had ordered, to oversee its construction. His attention to detail proved his undo… [+10429 chars]"
Why oil is back above $120 per barrel,https://www.economist.com/finance-and-economics/2022/05/31/why-oil-is-back-above-120-per-barrel,2022-05-31T20:35:52Z,A tightening EU embargo of Russian oil is just one explanation,In the 1970s Arab states used the oil weapon of embargoes to punish Western governments for supporting Israel. On May 30th the heads of the 27 eu member governments agreed to turn the weapon on thems… [+4799 chars]
Has Russia legalised intellectual-property theft?,https://www.economist.com/business/2022/06/02/has-russia-legalised-intellectual-property-theft,2022-06-02T09:06:33Z,A new law seems to strip away the IP rights of Western firms,"As its economy was being bombarded with Western sanctions in early March, Russia decided to amend a section of its civil code. The world took little notice of decree number 299, which authorised the … [+3203 chars]"
The West has a chance to wean India off Russian weaponry,https://www.economist.com/asia/2022/06/13/the-west-has-a-chance-to-wean-india-off-russian-weaponry,2022-06-13T17:31:24Z,"But co-operation on defence with America, in particular, remains fraught","Joint weapons production between India and the West has a long and chequered history. Consider the Tejas fighter jet, whose development was approved in 1983 by Indira Gandhi, the prime minister of th… [+6862 chars]"
The war in Ukraine has given the West a chance to wean India off Russian weaponry,https://www.economist.com/asia/2022/06/13/the-war-in-ukraine-has-given-the-west-a-chance-to-wean-india-off-russian-weaponry,2022-06-13T17:31:24Z,"But co-operation on defence with America, in particular, remains fraught","Joint weapons production between India and the West has a long and chequered history. Consider the Tejas fighter jet, whose development was approved in 1983 by Indira Gandhi, the prime minister of th… [+6862 chars]"
A plan to revive South Korea’s nuclear-power sector faces obstacles,https://www.economist.com/asia/2022/06/08/a-plan-to-revive-south-koreas-nuclear-power-sector-faces-obstacles,2022-06-08T16:48:29Z,But it could help wean the country off fossil fuels,"The south gate of Shin Hanul, a nuclear power station in Uljin on South Koreas east coast, does not get a lot of traffic. At lunchtime on a recent weekday there were no heavy vehicles to be seen, onl… [+3822 chars]"
Is Turkey more trouble to NATO than it is worth?,https://www.economist.com/europe/2022/06/16/is-turkey-more-trouble-to-nato-than-it-is-worth,2022-06-16T14:07:54Z,Recep Tayyip Erdogan’s government is the alliance’s loose cannon,"The received wisdom is that Russias invasion of Ukraine has breathed new life, and a new sense of purpose, urgency and unity into nato. Someone forgot to tell Recep Tayyip Erdogan. Over the past mont… [+6047 chars]"
Emmanuel Macron seeks to advertise his support for Ukraine,https://www.economist.com/europe/2022/06/14/emmanuel-macron-seeks-to-advertise-his-support-for-ukraine,2022-06-14T18:12:10Z,Confusion lingers about France’s attitude towards Russia’s war,"FRANCES PRESIDENT, Emmanuel Macron, left his electoral worries at home on June 14th when he flew to Romania to start a brief tour of eastern Europe. Just days before the run-off votes in legislative … [+5975 chars]"
Europe is squabbling—but remains united where it really matters,https://www.economist.com/europe/2022/06/02/europe-is-squabbling-but-remains-united-where-it-really-matters,2022-06-02T13:21:30Z,A new sanctions package belies complaints of internal rifts,"Unity among the nations of Europe is like a French soufflé. First comes the impressive puff, then, inexorably, a graceless sagging as the dish is tested by time and cutlery. Both the diplomat and the… [+6168 chars]"
NATO holds its most important summit in generations,https://www.economist.com/europe/2022/06/26/nato-holds-its-most-important-summit-in-generations,2022-06-26T19:24:55Z,The alliance is fortifying its eastern borders. But it is divided over how far to go in Ukraine,"WHEN NATO published its strategic concepta sort of vision statementin 2010, things were looking good. Today the Euro-Atlantic area is at peace and the threat of a conventional attack against NATO ter… [+10725 chars]"
Bashar al-Assad is hollowing out Syria’s ravaged state,https://www.economist.com/middle-east-and-africa/2022/06/16/bashar-al-assad-is-hollowing-out-syrias-ravaged-state,2022-06-16T14:07:53Z,Protection rackets and drug-dealing are big sources of income,"Forget flamboyant Arab dictators in military attire laden with medals or clad in swirling tribal robes. Bashar al-Assad, Syrias president, is the picture of modesty. Usually he wears no jewellery, no… [+5341 chars]"
Why the West should be wary of permanently seizing Russian assets,https://www.economist.com/leaders/2022/06/09/why-the-west-should-be-wary-of-permanently-seizing-russian-assets,2022-06-09T10:38:55Z,Permanently grabbing Russian assets is a seductive idea. It would also be a mistake,"More than 100 days into the war in Ukraine, the biggest sanctions programme ever imposed on a major economy is still being tightened. America and Europe have frozen Russias currency reserves held in … [+4513 chars]"
From freezing to seizing,https://www.economist.com/leaders/2022/06/09/from-freezing-to-seizing,2022-06-09T10:38:55Z,Why the West should be wary of permanently seizing Russian assets,"More than 100 days into the war in Ukraine, the biggest sanctions programme ever imposed on a major economy is still being tightened. America and Europe have frozen Russias currency reserves held in … [+4513 chars]"
A new nuclear era,https://www.economist.com/leaders/2022/06/02/a-new-nuclear-era,2022-06-02T09:15:42Z,"With his threats to use the bomb, Russia’s president has overturned the nuclear order","One hundred days ago Vladimir Putin launched his invasion of Ukraine by warning of a nuclear strike. Having exalted Russias atomic arsenal and promised Ukraines subjugation, he threatened countries t… [+6374 chars]"
Energy security gives climate-friendly nuclear-power plants a new appeal,https://www.economist.com/briefing/2022/06/23/energy-security-gives-climate-friendly-nuclear-power-plants-a-new-appeal,2022-06-23T15:24:24Z,To make good on it they have to get easier to build,"The worlds largest crane, Big Carl, trundles up and down the railway which bisects the site. To the south are cavernous temporary structures which serve as factory floors, sheltered from the elements… [+16365 chars]"
Russia’s invasion of Ukraine has eroded the nuclear taboo,https://www.economist.com/briefing/2022/06/02/russias-invasion-of-ukraine-has-eroded-the-nuclear-taboo,2022-06-02T09:59:01Z,This war is unlikely to go nuclear. But it is increasing the risk that future conflicts will,"In 1999 nina tannenwald, a political scientist at Brown University, wrote a paper analysing something she had observed among generals, politicians and strategists: the nuclear taboo. This was not, sh… [+16173 chars]"
Oligarch megayacht hides in UAE creek...,https://apnews.com/article/russia-ukraine-politics-technology-middle-east-c6592eb5a483c7d95e47cc9bd8f77bde,2022-06-01T12:07:36Z,"Oligarch megayacht hides in UAE creek...

 
 
 
 (Top headline, 8th story, link)

 

 

 
 Related stories:Kremlin propaganda declares WW3 has started...
Threatens to wipe out USA with Satan II missiles...
Biden to Provide Ukraine With Advanced Rocket S…","RAS AL-KHAIMAH, United Arab Emirates (AP) In the dusty, northern-most sheikhdom of the United Arab Emirates, where laborers cycle by rustic tea shops, one of the worlds largest yachts sits in a quiet… [+6123 chars]"
"Missiles strike Kyiv, shattering sense of calm...",https://apnews.com/article/russia-ukraine-kyiv-government-and-politics-e98d1d788e132c2a1f2c8ead7ae58761,2022-06-05T10:10:36Z,"Missiles strike Kyiv, shattering sense of calm...

 
 
 
 (Top headline, 3rd story, link)

 

 

 
 Related stories:WAR TURNS: Hail of Russian artillery tests Ukrainian morale...
'They're in hell'...
Zelensky losing 60 to 100 soldiers a day...
Battle i…","KYIV, Ukraine (AP) Russias defense ministry said a barrage of airstrikes on Ukraines capital destroyed tanks donated by the West and other armor in an attack on Sunday that shattered five weeks of ee… [+8085 chars]"
Key city's fate in balance as fighting rages in east Ukraine...,https://apnews.com/article/russia-ukraine-moscow-business-blockades-74883ed750fb8778259cf733e1095fb8,2022-06-09T11:49:40Z,"BAKHMUT, Ukraine (AP) — The human cost of the war in Ukraine  mounted as workers pulled up to 100 bodies from each smashed building in the devastated city of Mariupol — a gruesome effort that one official described as an “endless caravan of death.”","BAKHMUT, Ukraine (AP) The human cost of the war in Ukraine mounted as workers pulled up to 100 bodies from each smashed building in the devastated city of Mariupol a gruesome effort that one official… [+6209 chars]"
Biden Says US Will Provide Advanced Rocket Systems to Ukraine...,https://apnews.com/article/russia-ukraine-kyiv-politics-middle-east-fc6b7e347f0aa95d8aa3654479677f6f,2022-06-01T00:34:36Z,"Biden Says US Will Provide Advanced Rocket Systems to Ukraine...

 
 
 
 (Top headline, 4th story, link)

 

 

 
 Related stories:Kremlin propaganda declares 'WW3 has started'...
Threatens to wipe out USA with just four Satan II missiles...
Moscow Mili…","KYIV, Ukraine A regional Ukrainian governor on Tuesday said the Russian bombardment has caused a leak of toxic nitric acid from an industrial facility.
Luhansk Gov. Serhiy Haidai said a Russian air … [+16034 chars]"
Macron says Russia can't win...,https://apnews.com/article/russia-ukraine-politics-united-nations-terrorist-attacks-be890f11b0a5abfb41ddb1cfc8d5b212,2022-06-28T16:34:39Z,"Macron says Russia can't win...

 
 
 
 (First column, 9th story, link)

 

 

 
 Related stories:Pentagon Blasts Putin Nuke Saber-Rattling...
NATO INCREASES FORCES TO 300,000...
UK: '1937 MOMENT'...

 

 
 
 Drudge Report Feed needs your support!   B…","KREMENCHUK, Ukraine (AP) Frances president denounced Russias fiery airstrike on a crowded shopping mall in Ukraine as a new war crime Tuesday and vowed the Wests support for Kyiv would not waver, say… [+6465 chars]"
Biden urges Western unity amid war fatigue...,https://apnews.com/article/russia-ukraine-g-7-summit-inflation-biden-moscow-8ec2d58070215ec8393b25e4109eac97,2022-06-26T15:01:38Z,"ELMAU, Germany (AP) — President Joe Biden on Sunday praised the continued unity of the global alliance confronting Russia, as he and other heads of the Group of Seven leading economies strategized on sustaining the pressure in their effort to isolate Moscow o…","ELMAU, Germany (AP) President Joe Biden on Sunday praised the continued unity of the global alliance confronting Russia, as he and other heads of the Group of Seven leading economies strategized on s… [+6269 chars]"
EXPLAINER: What's the impact of a Russian debt default? - The Associated Press - en Español,https://apnews.com/article/russia-ukraine-foreign-debt-sovereign-322dd9b66c6954063ef810c5922f0315,2022-06-26T17:05:25Z,"<ol><li>EXPLAINER: What's the impact of a Russian debt default?  The Associated Press - en Español
</li><li>Russia Is Hours Away From Its First Foreign Default in a Century  Bloomberg
</li><li>Sanctions Push Russia Near First Foreign Default Since Revolutio…","Russia is poised to default on its foreign debt for the first time since the 1917 Bolshevik Revolution, further alienating the country from the global financial system following sanctions imposed ove… [+5890 chars]"
"Serbia ignores EU sanctions, secures gas deal with Putin - The Associated Press",https://apnews.com/article/russia-ukraine-putin-european-union-aleksandar-vucic-5a6bbab20373ef26829378c6a0eb6065,2022-05-29T17:55:25Z,"BELGRADE, Serbia (AP) — As the war in Ukraine rages , Serbia's president announced that he has secured an “extremely favorable” natural gas deal with Russia during a telephone conversation Sunday with Russian President Vladimir Putin.","BELGRADE, Serbia (AP) As the war in Ukraine rages, Serbias president announced that he has secured an extremely favorable natural gas deal with Russia during a telephone conversation Sunday with Russ… [+2524 chars]"
EU leaders agree on partial embargo on Russian oil - The Associated Press,https://apnews.com/article/russia-ukraine-zelenskyy-hungary-european-union-d0d4144c84749f84676a2f41b03b2ad4,2022-05-30T23:38:08Z,"<ol><li>EU leaders agree on partial embargo on Russian oil  The Associated Press
</li><li>EU disagreements stall progress on proposed Russia sanctions  Al Jazeera English
</li><li>Latest Russia-Ukraine News  The New York Times
</li><li>Hungary's Orbán says…",BRUSSELS (AP) European Union leaders agreed Monday to embargo most Russian oil imports into the bloc by year-end as part of new sanctions on Moscow worked out at a summit focused on helping Ukraine w… [+4690 chars]
$30B from Russian oligarchs frozen under REPO seizure effort - The Associated Press - en Español,https://apnews.com/article/russia-ukraine-government-and-politics-d67e109941461f0b8df53832582b9ca9,2022-06-29T09:59:17Z,"WASHINGTON (AP) — A multinational task force designed to seize Russian oligarchs' wealth  has blocked and frozen $30 billion in sanctioned individuals' property and funds in its first 100 days in operation, the Treasury Department reported Wednesday.",WASHINGTON (AP) A multinational task force designed to seize Russian oligarchs wealth has blocked and frozen $30 billion in sanctioned individuals property and funds in its first 100 days in operatio… [+2559 chars]
Russia offers foreign debt payment system similar to gas one - The Associated Press,https://apnews.com/article/russia-ukraine-putin-government-and-politics-9040260186a97d33bc693bf279abceed,2022-05-30T11:04:48Z,"<ol><li>Russia offers foreign debt payment system similar to gas one  The Associated Press
</li><li>Russia Readies New Bond-Payment Plan in Bid to Avoid Default  Bloomberg
</li><li>Russia eyes gas-for-roubles template for foreign Eurobond payments  Reuters…","MOSCOW (AP) Russia said Monday it may use an arrangement similar to that used for payments for its gas supplies to pay its dollar-denominated foreign debts.
The Vedomosti business daily quoted Finan… [+2744 chars]"
G-7 leaders end summit pledging to hurt Russia economically - The Associated Press,https://apnews.com/article/nato-climate-g-7-summit-russia-ukraine-zelenskyy-7e539b7f8b1900259e7d0198591c6d5c,2022-06-28T11:03:45Z,"<ol><li>G-7 leaders end summit pledging to hurt Russia economically  The Associated Press
</li><li>G7 leaders work to 'starve' Russia of oil money as Zelensky says he wants the war over by the end of the year  CNN
</li><li>G-7 leaders stop short of new ener…","ELMAU, Germany (AP) Leaders of the worlds wealthiest democracies struck a united stance to support Ukraine for as long as it takes as Russias invasion grinds on, and said they would explore far-reach… [+5372 chars]"
EXPLAINER: Why Russia-Lithuania tensions are rising - The Associated Press,https://apnews.com/article/russia-ukraine-politics-moscow-soviet-union-world-war-ii-c8404294261b2fc200b16ea9e66533bb,2022-06-22T16:59:02Z,"<ol><li>EXPLAINER: Why Russia-Lithuania tensions are rising  The Associated Press
</li><li>Why is Lithuania risking Russia’s wrath over Kaliningrad?  Yahoo News
</li><li>Moscow and NATO could be about to clash over Russia's European exclave Kaliningrad  CNB…",New tensions between Moscow and the West are rising after Lithuania decided to halt the transport of some goods through its territory to the Russian region of Kaliningrad as part of European Union sa… [+6311 chars]
US basketball star Griner due in Russian court - The Associated Press,https://apnews.com/article/russia-ukraine-entertainment-politics-sports-brittney-griner-e855442ad005104a3eed495438ca03ed,2022-06-27T07:55:30Z,"<ol><li>US basketball star Griner due in Russian court  The Associated Press
</li><li>WNBA star Brittney Griner scheduled for hearing in Russian court  Fox News
</li><li>Brittney Griner to attend preliminary court hearing behind closed doors, lawyer says  C…","MOSCOW (AP) More than four months after she was arrested at a Moscow airport for cannabis possession, American basketball star Brittney Griner is to appear in court Monday for a preliminary hearing a… [+2908 chars]"
Russian troops entering Sievierodonetsk in eastern Ukraine - The Associated Press,https://apnews.com/article/russia-ukraine-zelenskyy-government-and-politics-moscow-a82d4539f85e472f9a36a378413b748c,2022-05-30T09:56:15Z,"<ol><li>Russian troops entering Sievierodonetsk in eastern Ukraine  The Associated Press
</li><li>Intense fighting breaks out in Ukraine's Donbas region  CBS News
</li><li>Russia's war in Ukraine: Live updates  CNN
</li><li>Ukraine: Russia's military has e…","KRAMATORSK, Ukraine (AP) The Russian-battered eastern Ukrainian city of Sievierodonetsk appeared to be on the brink of becoming another Mariupol on Monday as the mayor told The Associated Press that … [+5302 chars]"
NATO nations block Russian envoy's plane from Serbia visit - The Associated Press - en Español,https://apnews.com/article/russia-ukraine-politics-sergey-lavrov-moscow-ebcab64aac80dc26c8941f30fabb246b,2022-06-06T11:13:57Z,"<ol><li>NATO nations block Russian envoy's plane from Serbia visit  The Associated Press - en Español
</li><li>Russia FM Lavrov axes Serbia trip after other countries deny airpsace  Business Insider
</li><li>NATO nations block Russian envoy's plane from Ser…","BELGRADE, Serbia (AP) Serbia and Russia confirmed Monday that a planned visit by Russias foreign minister to the Balkan country will not take place, with Moscow accusing the West of preventing the tr… [+3759 chars]"
Ukraine fears a long war might cause West to lose interest - The Associated Press,https://apnews.com/cd240ea4311723e369a5916137c31087,2022-06-10T06:42:44Z,"KYIV, Ukraine (AP) — As Russia’s invasion of Ukraine grinds into its fourth month, officials in Kyiv have expressed fears that the specter of “war fatigue” could erode the West's resolve to help the country push back Moscow's aggression.","KYIV, Ukraine (AP) As Russias invasion of Ukraine grinds into its fourth month, officials in Kyiv have expressed fears that the specter of war fatigue could erode the Wests resolve to help the countr… [+6022 chars]"
Russian journalist sells Nobel Prize for Ukrainian children - The Associated Press - en Español,https://apnews.com/article/russia-ukraine-dmitry-muratov-journalists-9a6bb6e61350e1bb8221924c1bfe30a3,2022-06-20T05:21:16Z,NEW YORK (AP) — What's the price of peace? That question could be partially answered Monday night when Russian journalist Dmitry Muratov auctions off his Nobel Peace Prize medal. The proceeds will go directly to UNICEF in its efforts to help children displace…,"NEW YORK (AP) Whats the price of peace?
That question could be partially answered Monday night when Russian journalist Dmitry Muratov auctions off his Nobel Peace Prize medal. The proceeds will go d… [+4168 chars]"
"US wins case to seize Russian superyacht in Fiji, sails away - The Associated Press",https://apnews.com/article/russia-ukraine-sports-new-zealand-united-states-fiji-fca11dc9117214a679845e6ab4300e2b,2022-06-07T10:44:06Z,"WELLINGTON, New Zealand (AP) — The United States won a legal battle on Tuesday to seize a Russian-owned superyacht in Fiji and wasted no time in taking command of the $325 million vessel and sailing it away from the South Pacific nation.","WELLINGTON, New Zealand (AP) The United States won a legal battle on Tuesday to seize a Russian-owned superyacht in Fiji and wasted no time in taking command of the $325 million vessel and sailing it… [+4568 chars]"
"G-7 leaders to commit to Ukraine, US sending anti-air system - The Associated Press",https://apnews.com/article/russia-ukraine-nato-g-7-summit-zelenskyy-boris-johnson-3437ebe5d3e167e399af96665d1354b6,2022-06-27T05:26:15Z,"<ol><li>G-7 leaders to commit to Ukraine, US sending anti-air system  The Associated Press
</li><li>What to watch from Joe Biden's trip to the G7  CNN
</li><li>Storm clouds at home dampen Biden's return to Europe  POLITICO
</li><li>Tale of 2 Summits: 'Amer…","ELMAU, Germany (AP) Leaders of the Group of Seven economic powers are set to commit themselves to the long haul in supporting Ukraine as they meet in the German Alps and confer by video link with Ukr… [+3801 chars]"
Live updates | German official: Time working against Russia - The Associated Press - en Español,https://apnews.com/article/russia-ukraine-moscow-united-states-39a4e31399665b6fc824fba8a29a3f56,2022-06-02T10:18:45Z,"KYIV, Ukraine — Ukrainian President Volodymyr Zelenskyy says if Russia prevails in its war in Ukraine “then the dark times will come for everyone” in Europe. Addressing the parliament in Luxembourg via a video link on Thursday, Zelenskyy said: “If we win this…","KYIV, Ukraine Ukrainian President Volodymyr Zelenskyy says if Russia prevails in its war in Ukraine then the dark times will come for everyone in Europe.
Addressing the parliament in Luxembourg via … [+9079 chars]"
"Russia warns West of weapons repercussions, pounds Ukraine - The Associated Press",https://apnews.com/article/russia-ukraine-kyiv-government-and-politics-moscow-61ef29e1911bf2e38a19a6110e764e09,2022-06-02T13:41:15Z,"KYIV, Ukraine (AP) — Britain pledged Thursday to send sophisticated medium-range rocket systems to Ukraine, joining the United States and Germany in equipping the embattled nation with advanced weapons for shooting down aircraft and knocking out artillery.","KYIV, Ukraine (AP) Britain pledged Thursday to send sophisticated medium-range rocket systems to Ukraine, joining the United States and Germany in equipping the embattled nation with advanced weapons… [+7501 chars]"
Several factors are converging to push gas prices higher - The Associated Press - en Español,https://apnews.com/article/why-are-gas-prices-rising-541819ca1aa4d3dc0a0206271f9f8589,2022-06-11T19:18:25Z,"<ol><li>Several factors are converging to push gas prices higher  The Associated Press - en Español
</li><li>Drivers sound off on how high gas prices are impacting their lives  WPTV News - FL Palm Beaches and Treasure Coast
</li><li>Gas Prices Hit $5 a Gall…","DALLAS (AP) There is little evidence that gasoline prices, which hit a record $5 a gallon on Saturday, will drop anytime soon.
Rising prices at the pump are a key driver in the highest inflation tha… [+5601 chars]"
European Union leaders set to grant Ukraine candidate status - The Associated Press,https://apnews.com/article/russia-ukraine-brussels-european-union-ff560e01c6b3e4f9c70777fad97be397,2022-06-23T11:15:00Z,"<ol><li>European Union leaders set to grant Ukraine candidate status  The Associated Press
</li><li>EU leaders to grant Ukraine candidate status in blow to Putin  The Guardian
</li><li>Ukraine takes step toward EU membership as Russian forces tighten vise o…","BRUSSELS (AP) European Union leaders on Thursday are set to make Ukraine a candidate for joining the 27-nation bloc, a first step in a long and unpredictable journey toward full membership that could… [+3585 chars]"
