title,url,date_published,snippet,body
Russian-held Ukraine region scheming to sell grain to North America -RIA - Reuters.com,https://www.reuters.com/world/europe/russian-held-ukraine-region-scheming-sell-grain-north-america-ria-2022-06-10/,2022-06-10T21:37:00Z,"Authorities in a part of Ukraine seized by Russia are using ""cunning schemes"" to avoid Western sanctions and sell grain to North America and other parts of the world, Russian state-run RIA news agency reported on Friday.","June 10 (Reuters) - Authorities in a part of Ukraine seized by Russia are using ""cunning schemes"" to avoid Western sanctions and sell grain to North America and other parts of the world, Russian stat… [+1500 chars]"
"Kremlin says gas cuts due to sanctions affecting turbines, not premeditated - Reuters",https://www.reuters.com/business/energy/kremlin-says-gas-cuts-due-sanctions-affecting-turbines-not-premeditated-2022-06-16/,2022-06-16T12:15:00Z,"Recent reductions in the supply of Russian gas to Europe are not premeditated but are due to problems with turbine maintenance caused by sanctions, Kremlin spokesperson Dmitry Peskov said on Thursday.","June 16 (Reuters) - Recent reductions in the supply of Russian gas to Europe are not premeditated but are due to problems with turbine maintenance caused by sanctions, Kremlin spokesperson Dmitry Pes… [+1546 chars]"
Some 4.48 bln euros of Russian assets frozen in Germany - FinMin - Reuters.com,https://www.reuters.com/markets/europe/some-448-bln-euros-russian-assets-frozen-germany-finmin-2022-06-15/,2022-06-15T13:01:00Z,"Some 4.48 billion euros ($4.67 billion) worth of Russian assets are currently frozen in Germany after European Union countries earlier this month agreed on their sixth package of sanctions against Moscow, German Finance Minister Christian Lindner said.","BERLIN, June 15 (Reuters) - Some 4.48 billion euros ($4.67 billion) worth of Russian assets are currently frozen in Germany after European Union countries earlier this month agreed on their sixth pac… [+418 chars]"
Moscow to summon EU ambassador to Russia over Kaliningrad transit - Kaliningrad governor - Reuters,https://www.reuters.com/world/moscow-summon-eu-ambassador-russia-over-kaliningrad-transit-kaliningrad-governor-2022-06-20/,2022-06-20T21:23:00Z,"The Russian foreign ministry will summon on Tuesday European Union ambassador to Moscow Markus Ederer over Lithuania's ban of the transit of goods under EU sanctions through Kaliningrad, the governor of Kaliningrad said on Monday.",June 21 (Reuters) - The Russian foreign ministry will summon on Tuesday European Union ambassador to Moscow Markus Ederer over Lithuania's ban of the transit of goods under EU sanctions through Kalin… [+872 chars]
Lithuania says sanctions on goods to Kaliningrad take effect from Saturday - Reuters.com,https://www.reuters.com/world/europe/lithuania-says-sanctions-goods-kaliningrad-take-effect-saturday-2022-06-18/,2022-06-18T13:21:00Z,Lithuanian authorities said a ban on the transit through their territory to the Russian enclave of Kaliningrad of goods that are subject to EU sanctions will take effect from Saturday.,"VILNIUS, June 18 (Reuters) - Lithuanian authorities said a ban on the transit through their territory to the Russian enclave of Kaliningrad of goods that are subject to EU sanctions will take effect … [+1298 chars]"
Canada seeking pathway to enable German gas flow amid Russian sanctions -Bloomberg - Reuters,https://www.reuters.com/business/energy/canada-seeking-pathway-enable-german-gas-flow-amid-russian-sanctions-bloomberg-2022-06-21/,2022-06-21T19:24:00Z,"Ottawa is evaluating options to help restore German gas supplies as a crucial Nord Stream 1 pipeline part is stranded in Canada due to Russian sanctions, the Canadian Natural Resources Minister said in an interview with Bloomberg on Tuesday.","OTTAWA, June 21 (Reuters) - Ottawa is evaluating options to help restore German gas supplies as a crucial Nord Stream 1 pipeline part is stranded in Canada due to Russian sanctions, the Canadian Natu… [+1549 chars]"
"EU sanctions should include Russian gas embargo, says Ukraine official - Reuters",https://www.reuters.com/world/europe/eu-sanctions-should-include-russian-gas-embargo-says-ukraine-official-2022-06-26/,2022-06-26T11:17:00Z,"The latest missile strikes by Russia on Kyiv show that international sanctions should be more aggressive and include an EU embargo on Russian gas, the Ukraine president's chief of staff said on Sunday.","KYIV, June 26 (Reuters) - The latest missile strikes by Russia on Kyiv show that international sanctions should be more aggressive and include an EU embargo on Russian gas, the Ukraine president's ch… [+505 chars]"
Russian bank VTB says sanctions stalling effort to hire U.S. lawyers - Reuters,https://www.reuters.com/legal/legalindustry/russian-bank-vtb-says-sanctions-stalling-effort-hire-us-lawyers-2022-06-16/,2022-06-16T18:50:00Z,Lawyers who are set to take over the defense of Russia's VTB Bank in a Manhattan federal court lawsuit say U.S. sanctions are preventing them from getting to work and getting paid.,"(Reuters) - Lawyers who are set to take over the defense of Russia's VTB Bank in a Manhattan federal court lawsuit say U.S. sanctions are preventing them from getting to work and getting paid.
Marc … [+2493 chars]"
"Biden, G7 leaders to agree on import ban on Russian gold - source - Reuters.com",https://www.reuters.com/world/biden-g7-leaders-agree-import-ban-russian-gold-source-2022-06-25/,2022-06-25T17:03:00Z,"U.S. President Joe Biden and his G7 counterparts will agree on an import ban on new gold from Russia as they broaden sanctions against Moscow for its war against Ukraine, a source familiar with the matter told Reuters on Saturday.","WASHINGTON, June 25 (Reuters) - U.S. President Joe Biden and his G7 counterparts will agree on an import ban on new gold from Russia as they broaden sanctions against Moscow for its war against Ukrai… [+674 chars]"
"Russian diesel exports to Europe drop in May, but yet to nosedive - Reuters",https://www.reuters.com/business/energy/russian-diesel-exports-europe-drop-may-yet-nosedive-2022-05-31/,2022-05-31T12:00:00Z,"Russian diesel exports to Europe declined by 8% in May from the previous month to their lowest since October 2020, data showed, as traders slowly reduce purchases from Russia in response to tightening sanctions on Moscow.","LONDON, May 31 (Reuters) - Russian diesel exports to Europe declined by 8% in May from the previous month to their lowest since October 2020, data showed, as traders slowly reduce purchases from Russ… [+1754 chars]"
Russian rouble weakens past 63 vs dollar after EU sanctions - Reuters,https://www.reuters.com/markets/currencies/russian-rouble-weakens-past-63-vs-dollar-after-eu-sanctions-2022-05-31/,2022-05-31T09:03:00Z,The Russian rouble firmed past 61 against the dollar on Tuesday but soon slipped back towards 64 as capital controls provided support and concerns about new European sanctions dragged the market lower.,May 31 (Reuters) - The Russian rouble firmed past 61 against the dollar on Tuesday but soon slipped back towards 64 as capital controls provided support and concerns about new European sanctions drag… [+1734 chars]
"Time is running out for Russia, German economy minister says - Reuters",https://www.reuters.com/world/europe/time-is-running-out-russia-german-economy-minister-says-2022-06-02/,2022-06-02T10:33:00Z,"Germany must work harder to reduce its energy-dependence on Russia but Western sanctions in response to Moscow's invasion of Ukraine are still taking a heavy toll on the Russian war machine, German Economy Minister Robert Habeck said on Thursday.","BERLIN, June 2 (Reuters) - Germany must work harder to reduce its energy-dependence on Russia but Western sanctions in response to Moscow's invasion of Ukraine are still taking a heavy toll on the Ru… [+979 chars]"
"Kremlin says Putin, Xi agreed to boost ties in energy, finance - Reuters.com",https://www.reuters.com/world/europe/kremlin-says-putin-xi-agreed-boost-ties-energy-finance-2022-06-15/,2022-06-15T13:31:00Z,"Russian President Vladimir Putin agreed in a phone call with his Chinese counterpart Xi Jinping to expand cooperation in energy, finance and industry as Moscow faces unprecedented Western sanctions over Ukraine, the Kremlin said on Wednesday.","June 15 (Reuters) - Russian President Vladimir Putin agreed in a phone call with his Chinese counterpart Xi Jinping to expand cooperation in energy, finance and industry as Moscow faces unprecedented… [+505 chars]"
"UK sets out new Russia sanctions for ""barbaric treatment of children in Ukraine"" - Reuters",https://www.reuters.com/world/uk/uk-sets-out-new-russia-sanctions-barbaric-treatment-children-ukraine-2022-06-16/,2022-06-16T10:35:00Z,"Britain on Thursday said it had sanctioned Russian Children's Rights Commissioner Maria Lvova-Belova for the ""forced transfer and adoption of Ukrainian children"", as part of a new wave of sanctions against Russia over the Ukrainian crisis.","LONDON, June 16 (Reuters) - Britain on Thursday said it had sanctioned Russian Children's Rights Commissioner Maria Lvova-Belova for the ""forced transfer and adoption of Ukrainian children"", as part … [+622 chars]"
"Russian region says Lithuania will curb imports, exports by rail - Reuters",https://www.reuters.com/world/europe/russian-region-says-lithuania-will-curb-imports-exports-by-rail-2022-06-17/,2022-06-17T21:49:00Z,"Lithuania has told the Russian region of Kaliningrad that it will block the import and export of a large number of goods by rail because of Western sanctions, the regional governor said on Friday.","June 17 (Reuters) - Lithuania has told the Russian region of Kaliningrad that it will block the import and export of a large number of goods by rail because of Western sanctions, the regional governo… [+1709 chars]"
"U.S. urges countries to reach out if having issues with Russian food, fertilizer exports - Reuters",https://www.reuters.com/world/europe/us-urges-countries-reach-out-if-having-issues-with-russian-food-fertilizer-2022-06-22/,2022-06-22T21:49:00Z,"Countries should ask the United States for help if they have any problems importing Russian food and fertilizer, a senior U.S. official said on Wednesday, stressing that such goods were not subject to U.S. sanctions over Moscow's war in Ukraine.","NEW YORK, June 22 (Reuters) - Countries should ask the United States for help if they have any problems importing Russian food and fertilizer, a senior U.S. official said on Wednesday, stressing that… [+2313 chars]"
"Latest U.S. sanctions on Russia target gold, banks, defense-related entities -Treasury website - Reuters.com",https://www.reuters.com/world/europe/latest-us-sanctions-russia-target-gold-banks-defense-related-entities-treasury-2022-06-28/,2022-06-28T14:55:00Z,"The United States on Tuesday imposed sanctions on over 100 targets and banned the import of new Russian gold, increasing pressure on Russia following its invasion of Ukraine in line with commitments made by the G7 this week.","WASHINGTON, June 28 (Reuters) - The United States on Tuesday imposed sanctions on over 100 targets and banned the import of new Russian gold, increasing pressure on Russia following its invasion of U… [+2368 chars]"
Russian service sector shrinks again in May on weak demand - PMI - Reuters,https://www.reuters.com/markets/europe/russian-service-sector-shrinks-again-may-weak-demand-pmi-2022-06-03/,2022-06-03T06:14:00Z,"Russia's service sector shrank for the third consecutive month in May, under pressure from the impact of Western sanctions and weak demand at home, the S&P Global purchasing managers index (PMI) showed on Friday.","June 3 (Reuters) - Russia's service sector shrank for the third consecutive month in May, under pressure from the impact of Western sanctions and weak demand at home, the S&amp;P Global purchasing ma… [+1618 chars]"
Saudi Arabia to raise oil production if Russian output falls under sanctions- FT - Reuters,https://www.reuters.com/business/energy/saudi-arabia-raise-oil-production-if-russian-output-falls-under-sanctions-ft-2022-06-02/,2022-06-02T01:35:00Z,"Saudi Arabia is prepared to raise its oil production if Russia's output falls substantially because of the western sanctions imposed on it, the Financial Times reported on Wednesday, citing sources.","June 1 (Reuters) - Saudi Arabia is prepared to raise its oil production if Russia's output falls substantially because of the western sanctions imposed on it, the Financial Times reported on Wednesda… [+1243 chars]"
Germany faces 5 bln euros a year hit from Russian gas sanctions -newspaper - Reuters.com,https://www.reuters.com/business/energy/germany-faces-5-bln-euros-year-hit-russian-gas-sanctions-newspaper-2022-06-05/,2022-06-05T15:31:00Z,"Russia's sanctions against Gazprom Germania and its subsidiaries could cost German taxpayers and gas users an extra 5 billion euros ($5.4 billion) a year to pay for replacement gas, the Welt am Sonntag weekly reported, citing industry representatives.","BERLIN, June 5 (Reuters) - Russia's sanctions against Gazprom Germania and its subsidiaries could cost German taxpayers and gas users an extra 5 billion euros ($5.4 billion) a year to pay for replace… [+1550 chars]"
EXCLUSIVE Kazakhstan renames its export oil to avoid Russia sanctions risk - Reuters,https://www.reuters.com/business/energy/exclusive-kazakhstan-renames-its-export-oil-avoid-russia-sanctions-risk-2022-06-03/,2022-06-03T14:06:00Z,Kazakhstan is changing the name of the oil it exports via Russian sea ports to Kazakhstan Export Blend Crude Oil (KEBCO) to dissociate it from oil originating in Russia in order to avoid sanction risks and issues with financing.,June 3 (Reuters) - Kazakhstan is changing the name of the oil it exports via Russian sea ports to Kazakhstan Export Blend Crude Oil (KEBCO) to dissociate it from oil originating in Russia in order to… [+2210 chars]
Sanctions-hit Kremlin to stage annual 'Russian Davos' bereft of financial elite - Reuters.com,https://www.reuters.com/world/europe/sanctions-hit-kremlin-stage-annual-russian-davos-bereft-financial-elite-2022-06-14/,2022-06-14T15:26:00Z,"Russia for years hosted world leaders and business titans at its annual economic forum in St Petersburg, but the ""Russian Davos"" will see little of the global financial elite this time around with Moscow isolated by sanctions over its actions in Ukraine.","June 14 (Reuters) - Russia for years hosted world leaders and business titans at its annual economic forum in St Petersburg, but the ""Russian Davos"" will see little of the global financial elite this… [+5240 chars]"
U.S. Treasury says all buying of Russian debt and equity banned under sanctions - Reuters.com,https://www.reuters.com/markets/us/us-treasury-says-all-buying-russian-debt-equity-banned-under-sanctions-2022-06-07/,2022-06-07T15:07:00Z,"The U.S. Treasury Department has advised U.S. money managers that Washington's sanctions on Moscow bar any secondary market purchases of debt or stocks belonging to Russia's government and firms, not just newly issued, further tightening curbs on the country …","WASHINGTON/LONDON, June 7 (Reuters) - The U.S. Treasury Department has advised U.S. money managers that Washington's sanctions on Moscow bar any secondary market purchases of debt or stocks belonging… [+1925 chars]"
"EU unity on Russian sanctions 'starting to crumble', German minister says - Reuters.com",https://www.reuters.com/world/europe/eu-unity-russian-sanctions-starting-crumble-german-minister-says-2022-05-29/,2022-05-29T16:10:00Z,"German Economy Minister Robert Habeck on Sunday expressed fears that the European Union's unity was ""starting to crumble"" ahead of a summit to discuss an oil embargo against Russia and plans to cut dependence on Russian energy.","BERLIN, May 29 (Reuters) - German Economy Minister Robert Habeck on Sunday expressed fears that the European Union's unity was ""starting to crumble"" ahead of a summit to discuss an oil embargo agains… [+1381 chars]"
EU blacklists wife of Russian billionaire Melnichenko to curb bypassing sanctions - Reuters,https://www.reuters.com/world/europe/eu-blacklists-wife-russian-billionaire-melnichenko-curb-bypassing-sanctions-2022-06-03/,2022-06-03T17:02:00Z,"The European Union on Friday blacklisted Aleksandra Melnichenko, the wife of Andrey Melnichenko, a previously sanctioned Russian billionaire who Reuters revealed had reassigned his companies to her in a bid to contain the business damage.","BRUSSELS, June 3 (Reuters) - The European Union on Friday blacklisted Aleksandra Melnichenko, the wife of Andrey Melnichenko, a previously sanctioned Russian billionaire who Reuters revealed had reas… [+1828 chars]"
Swiss lower house backs power to independently impose sanctions - Reuters.com,https://www.reuters.com/world/europe/swiss-lower-house-backs-power-independently-impose-sanctions-2022-06-09/,2022-06-09T14:59:00Z,Switzerland's lower house on Thursday backed legal changes that will allow the usually neutral country to impose sanctions independently of other nations or international groups on people or entities that have violated international humanitarian law.,"ZURICH, June 9 (Reuters) - Switzerland's lower house on Thursday backed legal changes that will allow the usually neutral country to impose sanctions independently of other nations or international g… [+1936 chars]"
"Russia, Turkey agree to more consultations on grain exports from Ukraine - Reuters",https://www.reuters.com/world/russia-turkey-agree-more-consultations-grain-exports-ukraine-2022-06-22/,2022-06-22T09:36:00Z,"Russian and Turkish delegations have agreed to continue consultations on safe vessel departures and grain exports from Ukrainian ports, the Russian defence ministry said on Wednesday.","June 22 (Reuters) - Russian and Turkish delegations have agreed to continue consultations on safe vessel departures and grain exports from Ukrainian ports, the Russian defence ministry said on Wednes… [+438 chars]"
"Canada imposes Russia-related sanctions 22 individuals, 4 entities - Reuters",https://www.reuters.com/world/europe/canada-imposes-russia-related-sanctions-22-individuals-4-entities-2022-05-31/,2022-05-31T13:27:00Z,Canada said Tuesday it was imposing new sanctions on Russia and putting restrictions on 22 individuals and four entities in response to Moscow's invasion of Ukraine.,"OTTAWA, May 31 (Reuters) - Canada said Tuesday it was imposing new sanctions on Russia and putting restrictions on 22 individuals and four entities in response to Moscow's invasion of Ukraine.
The r… [+552 chars]"
"Rouble stays near 7-yr peaks, OFZ bonds climb higher - Reuters.com",https://www.reuters.com/markets/europe/rouble-stays-near-7-yr-peaks-ofz-bonds-climb-higher-2022-06-24/,2022-06-24T07:44:00Z,"The Russian rouble stabilised near seven-year peaks on Friday, supported by capital controls and high prices for Russian exports, such as oil and gas, while OFZ government bond prices climbed higher.","June 24 (Reuters) - The Russian rouble stabilised near seven-year peaks on Friday, supported by capital controls and high prices for Russian exports, such as oil and gas, while OFZ government bond pr… [+2279 chars]"
Russia to spend $14.5 bln to boost local aircraft production amid sanctions - Reuters.com,https://www.reuters.com/business/aerospace-defense/russia-spend-145-bln-boost-local-aircraft-production-amid-sanctions-2022-06-27/,2022-06-27T11:26:00Z,Russia's government announced plans on Monday to invest 770 billion roubles ($14.5 billion) in the country's aviation industry by the end of this decade to boost the share of domestically-manufactured aircraft.,June 27 (Reuters) - Russia's government announced plans on Monday to invest 770 billion roubles ($14.5 billion) in the country's aviation industry by the end of this decade to boost the share of dome… [+1813 chars]
"No more EU sanctions on Russia needed, negotiations better option -Hungary - Reuters.com",https://www.reuters.com/world/europe/no-more-eu-sanctions-russia-needed-negotiations-better-option-hungary-2022-06-23/,2022-06-23T21:24:00Z,"The European Union should stop adding sanctions on Russia over its invasion of Ukraine and instead push for a ceasefire and the start of negotiations, a senior aide to Hungarian Prime Minister Viktor Orban said on Thursday.","BRUSSELS, June 23 (Reuters) - The European Union should stop adding sanctions on Russia over its invasion of Ukraine and instead push for a ceasefire and the start of negotiations, a senior aide to H… [+2689 chars]"
Novak says Russia can increase oil production in July - Reuters,https://www.reuters.com/markets/commodities/novak-says-russia-can-increase-oil-production-july-2022-06-16/,2022-06-16T07:42:00Z,"Russia plans to increase oil production next month as export flows are being redirected to avoid Western sanctions, energy officials said on Thursday, predicting domestic oil output would be either flat or decline slightly this year.","June 16 (Reuters) - Russia plans to increase oil production next month as export flows are being redirected to avoid Western sanctions, energy officials said on Thursday, predicting domestic oil outp… [+1588 chars]"
EU ambassadors back sixth round of Russia sanctions - Reuters,https://www.reuters.com/world/europe/eu-ambassadors-back-sixth-round-russia-sanctions-2022-06-02/,2022-06-02T14:08:00Z,"European Union diplomats gave a final approval on Thursday to the bloc's sixth round of sanctions against Russia for invading Ukraine, a diplomat told Reuters.","BRUSSELS, June 2 (Reuters) - European Union diplomats gave a final approval on Thursday to the bloc's sixth round of sanctions against Russia for invading Ukraine, a diplomat told Reuters.
The sanct… [+839 chars]"
Sanctions prevent Moscow from retaining military capabilities -Germany's Scholz - Reuters.com,https://www.reuters.com/world/europe/sanctions-prevent-moscow-retaining-military-capabilities-germanys-scholz-2022-06-07/,2022-06-07T11:18:00Z,"Moscow will not be able to retain its military capabilities due to tough Western sanctions imposed as a result of Russia's invasion of Ukraine, German Chancellor Olaf Scholz said on Tuesday.","VILNIUS, June 7 (Reuters) - Moscow will not be able to retain its military capabilities due to tough Western sanctions imposed as a result of Russia's invasion of Ukraine, German Chancellor Olaf Scho… [+667 chars]"
Putin says Russia will not mothball oil wells despite West's import ban - Reuters.com,https://www.reuters.com/business/energy/putin-says-russia-will-not-mothball-oil-wells-despite-wests-import-ban-2022-06-09/,2022-06-09T16:25:00Z,Russian President Vladimir Putin said on Thursday that Russian companies will not block off their oil wells despite the West's efforts to lessen its dependence on energy supplies from Moscow.,June 9 (Reuters) - Russian President Vladimir Putin said on Thursday that Russian companies will not block off their oil wells despite the West's efforts to lessen its dependence on energy supplies f… [+1650 chars]
Russia and China open cross-border bridge as ties deepen - Reuters.com,https://www.reuters.com/world/china/russia-china-open-cross-border-bridge-ties-deepen-2022-06-10/,2022-06-10T13:27:00Z,Russia and China opened a new cross-border bridge in the far east on Friday which they hope will further boost trade as Moscow reels from sweeping Western sanctions imposed over its actions in Ukraine.,June 10 (Reuters) - Russia and China opened a new cross-border bridge in the far east on Friday which they hope will further boost trade as Moscow reels from sweeping Western sanctions imposed over i… [+2213 chars]
Lloyd's of London says working with regulators to implement Russia sanctions - Reuters,https://www.reuters.com/markets/europe/lloyds-london-says-working-with-regulators-implement-russia-sanctions-2022-06-01/,2022-06-01T10:17:00Z,"Lloyd's of London, the world's oldest insurance market, said on Wednesday that it was working closely with British and international governments and regulators to implement global sanctions against Russia.","LONDON, June 1 (Reuters) - Lloyd's of London, the world's oldest insurance market, said on Wednesday that it was working closely with British and international governments and regulators to implement… [+519 chars]"
European parliament bars Russian lobbyists - Reuters,https://www.reuters.com/world/europe/european-parliament-bars-russian-lobbyists-2022-06-02/,2022-06-02T13:39:00Z,"Russian lobbyists are barred from the European Parliament, the head of the chamber said on Thursday, adding that Europe had to protect themselves from the Kremlin's influence and propaganda over the war in Ukraine.","BRUSSELS, June 2 (Reuters) - Russian lobbyists are barred from the European Parliament, the head of the chamber said on Thursday, adding that Europe had to protect themselves from the Kremlin's influ… [+860 chars]"
"Depositary receipt holders of Russia's Sberbank, VTB face conversion headache - Reuters.com",https://www.reuters.com/business/finance/depositary-receipt-holders-russias-sberbank-vtb-face-conversion-headache-2022-06-09/,2022-06-09T11:38:00Z,"Investors holding depositary receipts in Russia's sanctioned top banks are facing difficulties in converting them into shares after the European Union targeted Russia's national clearing house with sanctions, sources and analysts told Reuters.",June 9 (Reuters) - Investors holding depositary receipts in Russia's sanctioned top banks are facing difficulties in converting them into shares after the European Union targeted Russia's national cl… [+3033 chars]
