title,url,date_published,snippet,body
Russia defaults on foreign debt for first time since 1917 revolution – reports,https://amp.theguardian.com/world/2022/jun/27/russia-defaults-on-foreign-debt-for-first-time-since-1917-revolution-reports,2022-06-27T04:34:59Z,"The Kremlin owes about $40bn but has been shut out of the international financial system since the invasion of UkraineRussia has defaulted on its foreign debt for the first time since the 1917 revolution, according to reports, further alienating the country f…","Russia has defaulted on its foreign debt for the first time since the 1917 revolution, according to reports, further alienating the country from the global financial system after sanctions imposed ov… [+3323 chars]"
Russia and the west compete to secure safe passage for Ukraine’s grain,https://amp.theguardian.com/world/2022/jun/02/russia-and-the-west-compete-to-secure-safe-passage-for-ukraines-grain,2022-06-02T05:00:29Z,"Analysis: both sides agree grain must reach world markets soon but each wants to decide howIn a game of diplomatic cat and mouse, Russia and the west are coming up with similar if sometimes competing ideas for how Ukraine’s badly needed grain can be given saf…","In a game of diplomatic cat and mouse, Russia and the west are coming up with similar if sometimes competing ideas for how Ukraines badly needed grain can be given safe passage through the Black Sea … [+7187 chars]"
Russia ‘turning wave of food crises into tsunami’ by blocking grain exports,https://amp.theguardian.com/world/2022/jun/24/russia-turning-wave-of-food-crises-into-tsunami-by-blocking-grain-exports,2022-06-24T15:23:15Z,Germany’s foreign minister says preventing movement of 25m tonnes of supply is ‘using hunger as a weapon of war’Russia has transformed an existing life-threatening wave of food crises into a tsunami by blocking the export of 25m tonnes of grain from Ukraine’s…,"Russia has transformed an existing life-threatening wave of food crises into a tsunami by blocking the export of 25m tonnes of grain from Ukraines ports, the Germanys foreign minister has said.
Spea… [+4183 chars]"
Federal judge authorizes US to seize two of Roman Abramovich’s private jets,https://amp.theguardian.com/us-news/2022/jun/06/roman-abramovich-private-jets-us-government-seize,2022-06-06T20:18:25Z,"US justice department prosecutors say both jets flew to Russia in March, violating export restrictionsA federal judge in New York on Monday authorized the US government to seize two private jets owned by Roman Abramovich, after they flew to Russia following i…","A federal judge in New York on Monday authorized the US government to seize two private jets owned by Roman Abramovich, after they flew to Russia following its invasion of Ukraine, officials said.
T… [+2199 chars]"
Hungary to make $600m annual profit through Russian oil tax – research agency,https://amp.theguardian.com/world/2022/jun/14/hungary-to-make-600m-annual-profit-through-russian-oil-tax-research-agency,2022-06-14T12:12:13Z,"Eurointelligence analysis says profit is ‘at expense of everyone else in EU’Hungary is set to make $600m (€575m) yearly profit through a tax on Russian oil “at the expense of everyone else in the EU”, a research agency has suggested.The Hungarian government, …","Hungary is set to make $600m (575m) yearly profit through a tax on Russian oil at the expense of everyone else in the EU, a research agency has suggested.
The Hungarian government, which gained an o… [+3192 chars]"
OPEC boosts oil production as gas prices soar - The Washington Post,https://www.washingtonpost.com/business/2022/06/02/opec-oil-production-prices/,2022-06-02T18:39:00Z,"<ol><li>OPEC boosts oil production as gas prices soar  The Washington Post
</li><li>Russian oil production falls by 1 million barrels per day | DW News  DW News
</li><li>OPEC+ raises output faster than expected as Russia's war roils global energy markets  C…","Placeholder while article actions load
The consortium of the worlds largest oil-producing countries agreed to boost fossil fuel production faster than expected Thursday as energy prices rise worldwi… [+5093 chars]"
White House plan to send gas rebates complicated by chip shortages - The Washington Post,https://www.washingtonpost.com/us-policy/2022/06/17/biden-gas-white-house/,2022-06-17T15:00:45Z,"<ol><li>White House plan to send gas rebates complicated by chip shortages  The Washington Post
</li><li>White House Weighs Fuel-Export Limits as Pump Prices Surge  Bloomberg
</li><li>White House unlikely to push for gas rebate cards, official says  CNN
</…","Placeholder while article actions load
Senior White House aides have in recent days explored new ideas for responding to high gas prices and looked again at some that they had previously discarded, … [+5335 chars]"
Surging gas prices are squeezing the U.S. economy — and the White House - The Washington Post,https://www.washingtonpost.com/us-policy/2022/06/11/gas-prices-biden-economy/,2022-06-11T13:00:00Z,"<ol><li>Surging gas prices are squeezing the U.S. economy — and the White House  The Washington Post
</li><li>US Gas Prices: Refinery Bottlenecks Spur Surging Prices, Won't Ease Soon  Markets Insider
</li><li>Gas prices reach unprecedented high prices  CBS …","Placeholder while article actions load
With the average price of gas nationwide topping $5/gallon early Saturday, surging fuel prices across the United States are creating new strains for millions o… [+11340 chars]"
"Israel, Egypt, EU sign gas deal - The Washington Post",https://www.washingtonpost.com/world/2022/06/15/israel-gas-europe-export-turkey/,2022-06-15T17:58:00Z,"<ol><li>Israel, Egypt, EU sign gas deal  The Washington Post
</li><li>Israel, EU and Egypt sign gas agreement  Al Jazeera English
</li><li>In landmark deal signed in Cairo, Israel to export natural gas, via Egypt, to Europe  The Times of Israel
</li><li>Is…","Placeholder while article actions load
TEL AVIV Israel, Egypt and the European Union on Wednesday signed a trilateral natural gas agreement in Cairo, as Europe scrambles to cobble together an energy… [+4687 chars]"
"The final, brutal collapse of GOP’s big Michael Flynn conspiracy theory",https://www.washingtonpost.com/politics/2022/06/01/flynn-unmasking-bash-report/,2022-06-01T14:48:39Z,A newly revealed report puts to rest the right's conspiracy theories about Michael Flynn.,"Placeholder while article actions load
Among the many GOP efforts to counterprogram the Russia investigation with thinly constructed conspiracy theories, one of the most persistent ones was the so-c… [+6488 chars]"
Biden: G-7 will ban Russian gold imports to deny Putin revenue for war in Ukraine,https://www.washingtonpost.com/world/2022/06/26/biden-g7-summit-ban-russian-gold/,2022-06-26T08:10:07Z,"Biden, in Germany for the Group of Seven nations summit, said gold is ""a major export that rakes in tens of billions of dollars for Russia.”","Placeholder while article actions load
TELFS, Austria President Biden and his counterparts in the Group of Seven nations are announcing a ban on new imports of Russian gold in an attempt to further … [+3814 chars]"
House panel approves expanding anti-money laundering reporting requirements,https://www.washingtonpost.com/business/2022/06/23/pandora-papers-enablers-money-laundering-bill/,2022-06-23T21:00:00Z,The legislation would impose know-your-client rules that now apply to bankers on other service providers in an effort to prevent the movement of ill-gotten wealth into the U.S. financial system.,"Placeholder while article actions load
A bipartisan group of lawmakers cleared a major hurdle this week to advance what they call the most significant revision to Americas anti-money laundering laws… [+4379 chars]"
"As Biden heads to Europe, the mood on Ukraine is grimmer",https://www.washingtonpost.com/politics/2022/06/24/biden-g7-nato-ukraine/,2022-06-24T16:32:07Z,"When Western allies met earlier this year, their tone on Ukraine was resolute and optimistic. This time, the future is uncertain and the mood far more somber.","Placeholder while article actions load
MUNICH When President Biden met with his European counterparts in March, the mood despite the grim circumstances was almost heady: A weeks-old Russian invasion… [+8906 chars]"
Biden and NATO send Russia a defiant message,https://www.washingtonpost.com/politics/2022/06/29/biden-nato-defiant-russia/,2022-06-29T15:19:54Z,"NATO countries, welcoming Finland and Sweden and announcing a surge of forces, hope to signal to Moscow that their commitment to Ukraine is not waning.","Placeholder while article actions load
MADRID Under pressure to find new ways to confront Russia as its deadly invasion of Ukraine drags into its fifth month, President Biden and his NATO allies Wed… [+7814 chars]"
Biden grapples with inflation and immigration,https://www.washingtonpost.com/politics/2022/06/10/biden-inflation-immigration/,2022-06-10T22:50:01Z,"After several days enmeshed in a diplomatic spat on democracy in Latin America, Biden on Friday confronted domestic crises over inflation and immigration.","Placeholder while article actions load
LOS ANGELES President Biden laced into oil corporations and shipping conglomerates on Friday, accusing them of chasing excessive profits instead of lowering pr… [+7245 chars]"
Mexico’s president snubs Biden invitation to summit,https://www.washingtonpost.com/politics/2022/06/06/mexico-president-snub-biden/,2022-06-06T23:13:36Z,"López Obrador says he will not attend this week's Summit of the Americas in Los Angeles because Biden is not inviting Cuba, Venezuela or Nicaragua.","Placeholder while article actions load
Mexican President Andrés Manuel López Obrador said on Monday that he will not attend this weeks Summit of the Americas in Los Angeles, after President Biden de… [+6634 chars]"
Soaring inflation and $6.30 gas spur relief checks in California,https://www.washingtonpost.com/business/2022/06/28/california-inflation-relief-gas-prices/,2022-06-28T19:06:47Z,"The California measure is a response to high gas prices and inflation, Democratic lawmakers say.","Placeholder while article actions load
Nearly 23 million residents of California, which has the nations highest average gas prices, may soon receive inflation relief checks to help address soaring c… [+6429 chars]"
Biden to urge Congress to suspend federal gas tax for 3 months,https://www.washingtonpost.com/politics/2022/06/22/biden-gas-tax-holiday/,2022-06-22T09:00:00Z,Biden will urge Congress Wednesday to suspend the federal gas tax. He is also calling on states to suspend their gas taxes.,"Placeholder while article actions load
President Biden will urge Congress on Wednesday to suspend the federal gas tax of 18.3 cents per gallon for three months, marking the latest White House effort… [+7277 chars]"
The U.S.-Russia conflict is heating up — in cyberspace,https://www.washingtonpost.com/opinions/2022/06/07/us-russia-conflict-is-heating-up-cyberspace/,2022-06-07T21:50:48Z,The internet confrontation is a microcosm of Russia’s larger standoff with the West.,"Placeholder while article actions load
As the war in Ukraine rages, a long-standing battle between Russia and the United States over cyberspace is also heating up, with a top Russian diplomat warnin… [+5136 chars]"
"NATO is united on Ukraine. Good, but plenty could still go wrong.",https://www.washingtonpost.com/opinions/2022/06/29/nato-summit-madrid-ukraine-biden-weapons/,2022-06-29T21:17:04Z,"Slow weapons delivery to Ukraine, political fatigue among allies and unwise provocations could shift the advantage to Russia.","Placeholder while article actions load
Brussels NATO solidarity was on display at a summit meeting this week in Madrid. One after another, officials pledged to stay the course and combat Russian Pre… [+4795 chars]"
"In Ukraine, is the balance tipping in Moscow’s favor? Not yet.",https://www.washingtonpost.com/opinions/2022/06/14/ukraine-weapons-russia-eastern-ukraine/,2022-06-14T21:43:51Z,"Ukraine says it needs more heavy weapons, fast. But Russia has its own challenges, and U.S. officials say fears that Russia is winning are overblown.","Placeholder while article actions load
Russian military advances in eastern Ukraine this month have raised growing concern in the West that the balance of the war is tipping in Moscows favor. But Bi… [+5034 chars]"
Analysis | Hopes of Russian help on ransomware are officially dead - The Washington Post,https://www.washingtonpost.com/politics/2022/06/01/hopes-russian-help-ransomware-are-officially-dead/,2022-06-01T12:12:00Z,Moscow signaled a chance for cooperation but reversed course.,"Placeholder while article actions load
Welcome to The Cybersecurity 202! It seems like Portland, Ore.-based author Nancy Crampton Brophy who was recently convicted of murdering her husband did herse… [+12061 chars]"
Elevated cyber threats are the 'new normal' - The Washington Post,https://www.washingtonpost.com/politics/2022/06/07/elevated-cyber-threats-are-new-normal/,2022-06-07T15:05:00Z,"We’ll be facing major threats for the ‘foreseeable future,’ cyber officials say","Placeholder while article actions load
Welcome to The Cybersecurity 202!Judd Apatows George Carlin documentary on HBO is a triumph and a great history lesson. I highly recommend it. Heres one of Car… [+11372 chars]"
Cybersecurity's bad and it's getting worse - The Washington Post,https://www.washingtonpost.com/politics/2022/06/24/cybersecuritys-bad-its-getting-worse/,2022-06-24T12:20:00Z,Three big takeaways from eight years on the cyber beat.,"Placeholder while article actions load
Welcome to The Cybersecurity 202! This is my last newsletter after three-and-a-half years as author of The Cybersecurity 202. Its been a blast!
Thank you!: To… [+12396 chars]"
It’s time to start thinking about the endgame in Ukraine,https://www.washingtonpost.com/opinions/2022/06/16/ukraine-war-endgame-russia-europe-us-goals/,2022-06-16T21:52:32Z,Both Ukraine and its Western friends need to formulate war goals.,"Placeholder while article actions load
In 1942, Winston Churchill tried to ready the British people for a long conflict. This is not the end, he said, referring to the Allied victory in Egypt. It is… [+4987 chars]"
The best China strategy? Defeat Russia.,https://www.washingtonpost.com/opinions/2022/06/09/biden-administration-defeat-russia-contain-china-ukraine-war/,2022-06-09T22:47:04Z,Putin’s Russia is the world’s great spoiler.,"Placeholder while article actions load
We are now living in a totally new era, said the 99-year old Henry Kissinger, commenting on Russias invasion of Ukraine. In an op-ed last week, President Biden… [+4886 chars]"
"In Africa, Eastern Europe battles Russian narrative on Ukraine",https://www.washingtonpost.com/national-security/2022/06/25/africa-hunger-ukraine-grain-russia/,2022-06-25T09:00:13Z,Russia has convinced some African nations that sanctions are causing the global food crisis. Eastern European countries are trying to change that narrative.,"Placeholder while article actions load
With fears growing of a severe food crisis sparked by the war in Ukraine, Kyiv and its Eastern European allies are opening a new front in their battle to build… [+7950 chars]"
Russia threatens Lithuania for enforcing E.U. sanctions on Kaliningrad,https://www.washingtonpost.com/world/2022/06/21/kaliningrad-lithuania-russia-reaction/,2022-06-21T14:01:24Z,"Russia said there would be ""serious"" consequences after Lithuania banned sanctioned goods from passing through to Moscow's exclave of Kaliningrad.","Placeholder while article actions load
Moscow warned Tuesday that Lithuania would face serious consequences for barring the transit of E.U.-sanctioned goods through its territory to the Russian excl… [+2949 chars]"
"How Kaliningrad, Russian territory surrounded by NATO, is tangled in the Ukraine war",https://www.washingtonpost.com/world/2022/06/21/kaliningrad-lithuania-eu-blockade-russia-nato/,2022-06-21T07:56:50Z,"Lithuania is enforcing sanctions on goods shipped to Kaliningrad, which is surrounded by NATO members and physically separated from the rest of Russia.","The Russian exclave of Kaliningrad, located hundreds of miles west of the rest of the country, is the latest flash pointbetween Moscow and the rest of Europe as the fallout from Russian President Vla… [+687 chars]"
Hacked Russian radio station broadcasts Ukrainian anthem,https://www.washingtonpost.com/world/2022/06/09/russia-radio-station-hacked-ukraine-anthem-kommersant/,2022-06-09T07:45:19Z,Russian radio station Kommersant FM's news bulletin was interrupted by the Ukrainian anthem and antiwar songs.,"Placeholder while article actions load
A Russian radio stations news bulletin was interrupted Wednesday by Ukrainian anthems and antiwar songs, in the latest example of Russian media outlets apparen… [+2266 chars]"
"Putin thinks West will blink first in war of attrition, Russian elites say",https://www.washingtonpost.com/world/2022/06/03/russia-putin-economy-attrition-war/,2022-06-03T07:00:20Z,The Kremlin is seeking to ramp up economic pressure to erode foreign support for Ukraine.,"Placeholder while article actions load
Russian President Vladimir Putin is digging in for a long war of attrition over Ukraine and will be relentless in trying to use economic weapons, such as a blo… [+7864 chars]"
"Beijing chafes at Moscow's requests for support, Chinese officials say",https://www.washingtonpost.com/national-security/2022/06/02/china-support-russia-ukraine/,2022-06-02T21:58:17Z,"Moscow has on at least two occasions pressed Beijing to offer new forms of economic support — exchanges that one Chinese official described as “tense.«  Officials declined to share specifics of Russia’s requests, but one official said it included maintaining …","Placeholder while article actions load
Russian officials have raised increasingly frustrated requests for greater support during discussions with Beijing in recent weeks, calling on China to live up… [+9869 chars]"
"China on wrong side of history for backing Russian interests amid war, U.S. warns",https://www.washingtonpost.com/world/2022/06/16/china-xi-jinping-putin-russia-sovereignty-ukraine/,2022-06-16T07:15:19Z,"In a call with Putin, Xi said China and Russia support each other's ""core interests concerning sovereignty and security.”","Placeholder while article actions load
Chinese President Xi Jinping declared his support for Russias sovereignty and security during a Wednesday phone call with Vladimir Putin, prompting a swift U.S… [+3096 chars]"
De-arched former Moscow McDonald's reopens without Big Macs,https://www.washingtonpost.com/world/2022/06/12/mcdonalds-moscow-reopen/,2022-06-12T16:55:32Z,The new name translates roughly from Russian as « tasty and that's it. »,"Placeholder while article actions load
There are no arches, golden or otherwise, in the ersatz McDonalds that opened Sunday in Moscow. The familiar red and yellow colors are nowhere to be found. Mis… [+6394 chars]"
"Last month, China imported more Russian crude oil than ever before",https://www.washingtonpost.com/world/2022/06/20/china-russia-oil-exports/,2022-06-20T09:43:42Z,"Over the first 100 days of the war, China has become the world's leading buyer of Russian fossil fuels, as many Western nations cut back on Russian oil and gas.","Placeholder while article actions load
Chinas imports of Russia crude oil hit a record of 8.42 million metric tons in May, as Chinese buyers take advantage of discounted prices as part of Beijings p… [+3313 chars]"
"Russia-Ukraine war live updates: Ukraine marks 100 days of war, under bombardment and on the counterattack",https://www.washingtonpost.com/world/2022/06/03/russia-ukraine-war-news-putin-live-updates/,2022-06-03T06:01:00Z,Ukraine’s Zelensky called areas under Russian control a « zone of total catastrophe » and said the military situation in Severodonetsk was dire.,"The Russian Defense Ministry said Thursday that grain can be exported from Ukraines ports in the Black Sea using humanitarian corridors, amid concerns that a Russian blockade could threaten the globa… [+1711 chars]"
"As businesses flee Russia, a New York model returns to Moscow",https://www.washingtonpost.com/national-security/2022/06/21/russia-model-dikhtyar/,2022-06-21T09:00:00Z,Kira Dikhtyar returned to Moscow this spring to launch a new clothing line in Russia while declaring her support for Russian President Vladimir Putin.,"Placeholder while article actions load
As Western businesses fled Russia following Moscows invasion of Ukraine, Kira Dikhtyar, a 33-year-old model in New York City, traveled in the opposite directio… [+9143 chars]"
G-7 leaders seek price cap on Russian oil to 'starve' Putin's war effort,https://www.washingtonpost.com/world/2022/06/27/g7-biden-russian-oil-price-cap/,2022-06-27T08:23:04Z,"Tensions have emerged between Group of Seven leaders, as French President Emmanuel Macron has argued that any price cap should include gas.","Placeholder while article actions load
TELFS, Austria President Biden and his Group of Seven counterparts plan to unveil additional economic measures Monday to pressure Russia to end its war in Ukra… [+3033 chars]"
"Russian missiles hit Kyiv, shattering the capital's relative calm",https://www.washingtonpost.com/world/2022/06/26/ukraine-kyiv-blasts-playground/,2022-06-26T21:46:42Z,"The Sunday blasts hit a kindergarten playground and residential building in Kyiv, killing at least one — as Group of Seven nations leaders met in Germany for a summit.","Placeholder while article actions load
KYIV A series of strikes hit Kyiv early Sunday, shattering a sense of relative calm since Russias withdrawal from the capital in early April, as the Group of S… [+3595 chars]"
"Russia-Ukraine war live updates: Ukraine claws back part of Severodonetsk, but Putin shows no sign of slowing",https://www.washingtonpost.com/world/2022/06/04/russia-ukraine-war-putin-news-live-updates/,2022-06-04T06:01:40Z,Ukraine also rejected a British intelligence forecast that Russia could control the Luhansk region in two weeks.,"Russian President Vladimir Putin is digging in for a long war of attrition over Ukraine and will be relentless in trying to use economic weapons, such as a blockade of Ukrainian grain exports, to whi… [+801 chars]"
U.S. probing how American electronics wound up in Russian military gear,https://www.washingtonpost.com/world/2022/06/15/us-computer-chips-russian-military/,2022-06-15T22:55:16Z,Agents from the FBI and the Commerce Department are conducting joint visits to tech companies whose components have been found in abandoned weapons systems in Ukraine.,"Placeholder while article actions load
Federal agents have begun questioning U.S. technology companies on how their computer chips ended up in Russian military equipment recovered in Ukraine.
Comme… [+8595 chars]"
The diplomatic war over Ukrainian grain exports heats up,https://www.washingtonpost.com/world/2022/06/07/grain-export-blockade-russia-ukraine-africa/,2022-06-07T04:01:50Z,"Foreign governments are struggling for options to release Ukraine's immense supply of agricultural products, particularly wheat.","Placeholder while article actions load
Youre reading an excerpt from the Todays WorldView newsletter. Sign up to get the rest free, including news from around the globe, interesting ideas and opinio… [+6458 chars]"
Fiji court lets U.S. seize Russian oligarch's $300 million superyacht,https://www.washingtonpost.com/world/2022/06/08/fiji-yacht-russian-oligarch-suleyman-kerimov-ukraine/,2022-06-08T07:29:30Z,"The Amadea, a superyacht that U.S. officials say is owned by Russian oligarch Suleyman Kerimov, is heading to the United States.","Placeholder while article actions load
The United States secured a victory in its campaign to punish Russian billionaires for the war in Ukraine when Fijis Supreme Court ruled Tuesday that a $300 mi… [+3992 chars]"
"As prices rise, Europeans divided over how Ukraine war should end",https://www.washingtonpost.com/world/2022/06/15/ukraine-war-support-inflation-europe-poll-yougov/,2022-06-15T14:50:32Z,"A poll of Europeans from 10 countries suggests public attention may turn to fears about the war's wider impact, including the rising cost of living.","Placeholder while article actions load
As the war in Ukraine drags on through its fourth month, Europeans remain largely united in backing Kyiv, but they are divided over how long theyre willing to … [+5355 chars]"
Estonian leader urges faster help for Ukraine amid signs of war fatigue,https://www.washingtonpost.com/world/2022/06/16/estonia-kallas-ukraine-allies-aid/,2022-06-16T15:30:47Z,Concerns are growing that inflation will erode support for the Ukraine war among Western allies and entrench Russian gains,"Placeholder while article actions load
Ukraines allies need to accelerate their military assistance and other forms of aid before war fatigue takes hold in the West and Russia makes territorial gain… [+5358 chars]"
Ukraine's position has 'worsened' in fight for Severodonetsk,https://www.washingtonpost.com/national-security/2022/06/06/severodonetsk-ukraine-russia/,2022-06-06T23:43:31Z,"Russian forces have been expanding their footprint in the city, though Ukrainian troops remain in control of its industrial zone","Placeholder while article actions load
Russia escalated its assault against Ukraine on the battlefield Monday, pummeling a city that has emerged as a key battleground in the east as Moscow expanded … [+5073 chars]"
